{
  "2025": [
    {
      "numero_processo": "08004256920224058205",
      "classe": "APELAÇÃO CRIMINAL",
      "orgao_julgador": "1ª TURMA",
      "data_julgamento": "03/07/2025",
      "relator": "DESEMBARGADOR FEDERAL EDVALDO BATISTA DA SILVA JÚNIOR",
      "ementa": "PENAL. PROCESSUAL PENAL. SENTENÇA ABSOLUTÓRIA. APELO INTERPOSTO PELA ACUSAÇÃO. DENÚNCIA DE PRÁTICA DO DELITO LICITATÓRIO PREVISTO NA ANTIGA LEI Nº 8.666/93. DESMEMBRAMENTO DA AÇÃO PENAL ORIGINÁRIA DE AMPLO ESPECTRO: ENVOLVIMENTO DE AGENTES POLÍTICOS - PREFEITOS - SERVIDORES MUNICIPAIS, EMPRESÁRIOS, E PARTICULARES COM VÍNCULOS DE PARENTESCO ENTRE SI. FISCALIZAÇÃO ENCETADA, PRINCIPALMENTE, PELA CONTROLADORIA GERAL DA UNIÃO - CGU SOBRE IRREGULARIDADES EM CONTRATOS PÚBLICOS FIRMADOS ENTRE AS MUNICIPALIDADES E LOCADORAS DE VEÍCULOS PARA PRESTAR SERVIÇOS DE TRANSPORTE ESCOLAR - \"OPERAÇÃO VEICULAÇÃO\". OBJETO DESTA PERSECUÇÃO RESTRITO A TÓPICO ESPECÍFICO DA PEÇA ACUSATÓRIA - \"FATO 07 - FRAUDE AO PREGÃO PRESENCIAL Nº 003/2015/PM DE EMAS/PB\". ESCORREITA ABSOLVIÇÃO, ARRIMADA NO ART. 386, VII, DO CÓDIGO DE PROCESSO PENAL, DIANTE DA INEXISTÊNCIA DE PROVA IRREFUTÁVEL PARA ALICERÇAR CONDENAÇÃO. AUSENTE A DEMONSTRAÇÃO DO OBRIGATÓRIO ANIMUS - ELEMENTO SUBJETIVO DO INJUSTO PENAL LICITATÓRIO - DOS ACUSADOS EM FRUSTRAR O CARÁTER COMPETITIVO DO CERTAME. IRREGULARIDADES PROCEDIMENTAIS - \"DESORGANIZAÇÃO ADMINISTRATIVA\" - QUE NÃO DEVEM SER TRANSMUTADAS, OBRIGATORIAMENTE, EM ILÍCITO PENAL, À MÍNGUA DE PROVA - EXTREME DE DUBIEDADES - DE CONLUIO E AJUSTE DOS ACUSADOS VOLTADOS A FRAUDAR A REGULAR COMPETITIVIDADE DO PREGÃO EM COMENTO. IMPROCEDÊNCIA DA CORRESPONDENTE AÇÃO CIVIL PÚBLICA DE IMPROBIDADE ADMINISTRATIVA - MANTIDA NESTE REGIONAL -, PELOS MESMOS FATOS OBJETO DESTA PERSECUÇÃO PENAL. MANTIDA A SENTENÇA ABSOLUTÓRIA. APELO MINISTERIAL IMPROVIDO. 1.Depreende-se que a presente persecução penal, originariamente processada perante esta Corte Regional devido à prerrogativa de foro especial reconhecida, à época, em prol de alguns dos codenunciados, teve o desmembramento dos autos (Ação Penal nº 0002058-38.2016.4.05.0000, derivada das investigações emanadas da \"Operação Veiculação\") operado pela proclamação de decisum na origem, em 04 (quatro) processos criminais, restando o espectro da presente Ação Penal nº 0800425-69.2022.4.05.8205 limitado, tão-somente, ao objeto indicado no subtópico contido na Denúncia, como sendo, \"FATO 07 - Fraude ao Pregão Presencial nº 003/2015/PM de Emas/PB\". (PROCESSO: 08004256920224058205, APELAÇÃO CRIMINAL, DESEMBARGADOR FEDERAL EDVALDO BATISTA DA SILVA JÚNIOR, 1ª TURMA, JULGAMENTO: 03/07/2025)",
      "texto_pdf": "PROCESSO Nº: 0800425-69.2022.4.05.8205 - APELAÇÃO CRIMINAL APELANTE: MINISTÉRIO PÚBLICO FEDERAL APELADO: CARLOS ALEXANDRE FERNANDES MALTA E OUTROS ADVOGADO: FRANCISCO DE ASSIS REMIGIO II E OUTROS JUIZ PROLATOR DA SENTENÇA (1° GRAU): JUIZ(A) FEDERAL THIAGO BATISTA DE ATAIDE. 14ª VF/PB. RELATOR(A): DESEMBARGADOR(A) FEDERAL EDVALDO BATISTA DA SILVA JÚNIOR - 1ª TURMA EMENTA: PENAL. PROCESSUAL PENAL. SENTENÇA ABSOLUTÓRIA. APELO INTERPOSTO PELA ACUSAÇÃO. DENÚNCIA DE PRÁTICA DO DELITO LICITATÓRIO PREVISTO NA ANTIGA LEI Nº 8.666/93. DESMEMBRAMENTO DA AÇÃO PENAL ORIGINÁRIA DE AMPLO ESPECTRO: ENVOLVIMENTO DE AGENTES POLÍTICOS - PREFEITOS - SERVIDORES MUNICIPAIS, EMPRESÁRIOS, E PARTICULARES COM VÍNCULOS DE PARENTESCO ENTRE SI. FISCALIZAÇÃO ENCETADA, PRINCIPALMENTE, PELA CONTROLADORIA GERAL DA UNIÃO - CGU SOBRE IRREGULARIDADES EM CONTRATOS PÚBLICOS FIRMADOS ENTRE AS MUNICIPALIDADES E LOCADORAS DE VEÍCULOS PARA PRESTAR SERVIÇOS DE TRANSPORTE ESCOLAR - \"OPERAÇÃO VEICULAÇÃO\". OBJETO DESTA PERSECUÇÃO RESTRITO A TÓPICO ESPECÍFICO DA PEÇA ACUSATÓRIA - \"FATO 07 - FRAUDE AO PREGÃO PRESENCIAL Nº 003/2015/PM DE EMAS/PB\". ESCORREITA ABSOLVIÇÃO, ARRIMADA NO ART. 386, VII, DO CÓDIGO DE PROCESSO PENAL, DIANTE DA INEXISTÊNCIA DE PROVA IRREFUTÁVEL PARA ALICERÇAR CONDENAÇÃO. AUSENTE A DEMONSTRAÇÃO DO OBRIGATÓRIO ANIMUS - ELEMENTO SUBJETIVO DO INJUSTO PENAL LICITATÓRIO - DOS ACUSADOS EM FRUSTRAR O CARÁTER COMPETITIVO DO CERTAME. IRREGULARIDADES PROCEDIMENTAIS - \"DESORGANIZAÇÃO ADMINISTRATIVA\" - QUE NÃO DEVEM SER TRANSMUTADAS, OBRIGATORIAMENTE, EM ILÍCITO PENAL, À MÍNGUA DE PROVA - EXTREME DE DUBIEDADES - DE CONLUIO E AJUSTE DOS ACUSADOS VOLTADOS A FRAUDAR A REGULAR COMPETITIVIDADE DO PREGÃO EM COMENTO. IMPROCEDÊNCIA DA CORRESPONDENTE AÇÃO CIVIL PÚBLICA DE IMPROBIDADE ADMINISTRATIVA - MANTIDA NESTE REGIONAL -, PELOS MESMOS FATOS OBJETO DESTA PERSECUÇÃO PENAL. MANTIDA A SENTENÇA ABSOLUTÓRIA. APELO MINISTERIAL IMPROVIDO. 1.Depreende-se que a presente persecução penal, originariamente processada perante esta Corte Regional devido à prerrogativa de foro especial reconhecida, à época, em prol de alguns dos codenunciados, teve o desmembramento dos autos (Ação Penal nº 0002058-38.2016.4.05.0000, derivada das investigações emanadas da \"Operação Veiculação\") operado pela proclamação de decisum na origem, em 04 (quatro) processos criminais, restando o espectro da presente Ação Penal nº 0800425-69.2022.4.05.8205 limitado, tão-somente, ao objeto indicado no subtópico contido na Denúncia, como sendo, \"FATO 07 - Fraude ao Pregão Presencial nº 003/2015/PM de Emas/PB\". 2. Restringe-se, pois, o espectro desta Ação Penal nº 0800425-69.2022.4.05.8205 à apuração da prática, em tese, das condutas relacionadas ao crime licitatório previsto no art. 90, da Lei nº 8.666/93, cuja síntese das imputações - \"FATO 07\" - lançadas em desfavor dos codenunciados, ora apelados, foi assim sintetizada pelo juízo de primeiro grau, verbis: \"Aduz o MPF que, no período de 03 de janeiro a 20 de janeiro de 2015, J.W.S.M. (então prefeito de Emas/PB), R.G.C.S. (proprietário da empresa contratada), C.A.M. (proprietário da empresa contratada) e E.R.A.(pregoeiro) fraudaram, mediante ajuste e combinação, o caráter competitivo do Pregão Presencial nº 003/2015 (7º fato), com o fim de possibilitar vantagem para a organização criminosa, mediante a contratação da empresa M.L., para prestar serviços de locação de veículos à Prefeitura Municipal de Emas-PB.\" 3.Sustenta, em síntese, o apelo ministerial a necessidade de reforma, in totum, do decreto absolutório, por entender como mais que satisfatório o plexo das provas indicadas na peça acusatória e das demais que exsurgiram da instrução processual, voltadas à comprovação da autoria e materialidade delituosas quanto ao crime licitatório em comento, em desfavor de cada um dos apelados, servíveis à responsabilização penal dos recorridos pelo cometimento das condutas previstas no tipo penal do art. 90, da Lei nº 8.666/93, vigente à época dos fatos (revogada por força da Lei nº 14.133/21). 4.Todavia, em sentido oposto ao desiderato recursal de viés condenatório encampado pelo Parquet, expôs o sentenciante, de forma percuciente, através de hígidas razões fático-jurídicas, a motivação absolutória para rechaçar a imputação de cometimento do delito licitatório lançada em desfavor dos então denunciados, ora apelados, merecendo destacar os excertos dos fundamentos adotados no veredicto, reproduzidos neste Voto, sedimentados na inexistência de comprovação da materialidade delituosa das condutas delineadas nos autos, nos moldes do art. 386, VII, do Código de Processo Penal (\"não existir prova suficiente para a condenação\"). 5. Da análise da instrução probatória, ricamente delineada pelo sentenciante, em que salientada, inclusive, a fragilidade e inconsistência das provas testemunhais, depreende-se que não foi comprovado, nas condutas dos denunciados - para além de inexistir prova da materialidade delituosa -, o dolo específico de fraudar o certame licitatório, exigível, consoante pacificada jurisprudência do Superior Tribunal de Justiça - STJ, ao perfazimento das elementares do tipo penal do art. 90 da Lei nº 8.666/93, vigente à época dos fatos - transferido para o tipo do art. 337-F do CP, pela incidência do princípio da continuidade típico-normativa. 6. Nesse sentido - necessidade de comprovação do elemento subjetivo do tipo penal em específico -, bem se vê que o dominus litis não se desincumbiu do seu exclusivo ônus de demonstrar, de forma pontual e extreme de dubiedades, que houve, real e efetivamente, conluio entre os denunciados J.W.S.M. (então prefeito de Emas/PB), R.G.C.S. (proprietário da empresa contratada), C.A.M. (proprietário da empresa contratada) e E.R.A. (pregoeiro) direcionado ao objetivo de fraudar, mediante ajuste ou combinação, o caráter competitivo do Pregão Presencial nº 003/2015 (7º fato), com o casuístico propósito de viabilizar a contratação pública da empresa vencedora do certame, para prestar serviços de locação de veículos à Prefeitura Municipal de Emas-PB. 7.Como bem salientado pelo sentenciante, patenteou-se certa \"desorganização administrativa\" na condução de algumas etapas do processo licitatório do Pregão Presencial nº 003/2015 (7º fato), devido à inobservância, pelos agentes públicos, da liturgia ínsita à regularidade dos atos administrativos, sem que se possa conceber que tais irregularidades procedimentais devam, obrigatoriamente, ser transmutadas em ilícito penal, diante da ausência de demonstração factual do animus, da teleologia, da intencionalidade dos agentes mais diretamente envolvidos no certame, aqui denunciados, em fraudar ou frustrar o caráter competitivo entre os eventuais licitantes interessados em contratar com a Administração Pública, através de conluio e união de desígnios dirigidos à obtenção de vantagem derivada da adjudicação do objeto licitado, de modo a privilegiar a participação de, tão-somente, única empresa licitante, o que, ao fim e ao cabo da instrução processual, não se demonstrou. 8. Daí que a insurgência recursal ministerial não deve prosperar, visto que os fundamentos da Sentença recorrida decorreram de apurada análise lógica das provas que redundaram na absolvição dos denunciados na presente seara penal, importando em resposta estatal longe de qualquer desconformidade jurídica, por não haver o órgão acusador se desincumbido, satisfatoriamente, de comprovar, para além dos elementos que se revelaram, finda a instrução, unicamente indiciários, o cometimento das condutas supostamente típicas delineadas na peça acusatória. 9. Nesse sentido - necessidade de comprovação do elemento subjetivo do tipo penal em específico -, bem se vê que o dominus litis não se desincumbiu do seu exclusivo ônus de demonstrar, de forma pontual e extreme de dubiedades, que houve, real e efetivamente, conluio entre os denunciados J.W.S.M. (então prefeito de Emas/PB), R.G.C.S. (proprietário da empresa contratada), C.A.M. (proprietário da empresa contratada) e E.R.A. (pregoeiro) direcionado ao objetivo de fraudar, mediante ajuste ou combinação, o caráter competitivo do Pregão Presencial nº 003/2015 (7º fato), com o casuístico propósito de viabilizar a contratação pública da empresa vencedora do certame, para prestar serviços de locação de veículos à Prefeitura Municipal de Emas-PB. 10. Como bem salientado pelo sentenciante, patenteou-se certa \"desorganização administrativa\" na condução de algumas etapas do processo licitatório do Pregão Presencial nº 003/2015 (7º fato), devido à inobservância, pelos agentes públicos, da liturgia ínsita à regularidade dos atos administrativos, sem que se possa conceber que tais irregularidades procedimentais devam, obrigatoriamente, ser transmutadas em ilícito penal, diante da ausência de demonstração factual do animus, da teleologia, da intencionalidade dos agentes mais diretamente envolvidos no certame, aqui denunciados, em fraudar ou frustrar o caráter competitivo entre os eventuais licitantes interessados em contratar com a Administração Pública, através de conluio e união de desígnios dirigidos à obtenção de vantagem derivada da adjudicação do objeto licitado, de modo a privilegiar a participação de, tão-somente, única empresa licitante, o que, ao fim e ao cabo da instrução processual, não se demonstrou. 11. Daí que a insurgência recursal ministerial não deve prosperar, visto que os fundamentos da Sentença recorrida decorreram de apurada análise lógica das provas que redundaram na absolvição dos denunciados na presente seara penal, importando em resposta estatal longe de qualquer desconformidade jurídica, por não haver o órgão acusador se desincumbido, satisfatoriamente, de comprovar, para além dos elementos que se revelaram, finda a instrução, unicamente indiciários, o cometimento das condutas supostamente típicas delineadas na peça acusatória. 12. Aliás, também na esfera administrativa não prosperou, quer na primeira instância judicial, tanto quanto neste Regional, a respectiva Ação Civil Pública por ato de Improbidade Administrativa outrora movida pelo Ministério Público Federal (PJE nº 0800145-35.2021.4.05.8205), devendo ser integrado à fundamentação deste Voto a suma do teor do respeitável Acórdão proferido em sede de julgamento - não transitado em julgado - perante a Segunda Turma desta egrégia Corte, Sessão ordinária de 22.10.2024 (Relator Desembargador Federal PAULO ROBERTO DE OLIVEIRA LIMA), em que negado provimento ao apelo do Parquet, restando mantida a Sentença que julgou improcedente o pedido de condenação por ato ímprobo, nos moldes do art. 487, I, do NCPC, relacionado ao \"FATO Nº 07 - Pregão Presencial nº 003/2015 - PM de Emas-PB\", como se infere dos excertos da ementa do julgado colegiado transcritos neste Voto. 13. Assim, ainda que considerada a independência entre as instâncias cível e penal - e suas relativizações legais -, não há que se falar, na delimitada hipótese dos autos, em remanescer, para além do que já fora descartado na aludida Ação de Improbidade Administrativa - e respectivo Acórdão -, e, tanto quanto, no veredicto penal absolutório, qualquer fato punível juridicamente significante à incidência da norma penal incriminadora e de suas respectivas sanções. 14. Como visto, houve, nesta persecução penal, adequada resposta estatal, ainda que não sancionatória, à aludida prática descrita na Denúncia penal, assim como, na deflagração, também, da mencionada Ação de Improbidade Administrativa, sem, contudo, haver sido revelado qualquer significativo desvalor jurídico punível nas condutas dos codenunciados, aqui apelados, a ter lugar nas idênticas situações fáticas analisadas em ambas as instâncias - cível e penal -, sobre o mesmo \"FATO Nº 07 - Pregão Presencial nº 003/2015 - PM de Emas-PB\". 15. Apesar da prescindibilidade da demonstração de prejuízo ao erário, conforme a diretiva da Súmula nº 645/STJ (\"O crime de fraude à licitação é formal, e sua consumação prescinde da comprovação do prejuízo ou da obtenção de vantagem.\"), sendo despicienda, portanto, a produção de resultado naturalístico por se tratar de delito formal, fato é que, in casu, as condutas dos agentes, ora apelados, não restaram substancialmente subsumíveis às elementares do delito licitatório inserto no art. 90, da Lei nº 8.666/93, sendo acertadas suas respectivas absolvições pormenorizadamente justificadas no art. 386, VII, do Código de Processo Penal (\"não existir prova suficiente para a condenação\"). 16. Sentença mantida. Negado provimento ao apelo do Ministério Público Federal. LSJ (PROCESSO: 08004256920224058205, APELAÇÃO CRIMINAL, DESEMBARGADOR FEDERAL EDVALDO BATISTA DA SILVA JÚNIOR, 1ª TURMA, JULGAMENTO: 03/07/2025)",
      "consulta_processual_url": "https://www.trf5.jus.br/index.php/consulta-processual-fisico-e-eletronico"
    },
    {
      "numero_processo": "08243182120194058100",
      "classe": "APELAÇÃO CÍVEL",
      "orgao_julgador": "1ª TURMA",
      "data_julgamento": "03/07/2025",
      "relator": "DESEMBARGADOR FEDERAL EDVALDO BATISTA DA SILVA JÚNIOR",
      "ementa": "PROCESSO CIVIL. EMBARGOS DE DECLARAÇÃO. ALEGAÇÃO DE OFENSA AO ART. 1.022 DO CPC/2015. INEXISTÊNCIA DE VÍCIOS. ACÓRDÃO QUE ENFRENTOU TODAS AS QUESTÕES NECESSÁRIAS. RECURSO NÃO PROVIDO. (PROCESSO: 08243182120194058100, APELAÇÃO CÍVEL, DESEMBARGADOR FEDERAL EDVALDO BATISTA DA SILVA JÚNIOR, 1ª TURMA, JULGAMENTO: 03/07/2025)",
      "texto_pdf": "PROCESSO Nº: 0824318-21.2019.4.05.8100 - APELAÇÃO CÍVEL APELANTE: MAG COMERCIO DE PRESENTES LTDA ADVOGADO: LARRY JOHN RABB CARVALHO ADVOGADO: MARIANA SOARES FELIX APELADO: FAZENDA NACIONAL RELATOR(A): DESEMBARGADOR(A) FEDERAL EDVALDO BATISTA DA SILVA JÚNIOR - 1ª TURMA JUIZ PROLATOR DA SENTENÇA (1° GRAU): JUIZ(A) FEDERAL LEONARDO RESENDE MARTINS EMENTA: PROCESSO CIVIL. EMBARGOS DE DECLARAÇÃO. ALEGAÇÃO DE OFENSA AO ART. 1.022 DO CPC/2015. INEXISTÊNCIA DE VÍCIOS. ACÓRDÃO QUE ENFRENTOU TODAS AS QUESTÕES NECESSÁRIAS. RECURSO NÃO PROVIDO. 1. Embargos de declaração opostos contra acórdão que negou provimento ao recurso de apelação interposto por Mag Comércio de Presentes Ltda. A apelação foi apresentada contra sentença que julgou improcedente a ação movida pela empresa em face da União Federal (Fazenda Nacional), na qual se pleiteava a imediata conclusão do despacho aduaneiro das mercadorias vinculadas à Declaração de Importação nº 18/1726998-6. 2. À luz do disposto no artigo 1.022 do Código de Processo Civil, os embargos de declaração consubstanciam meio processual destinado a ensejar o aclaramento de trechos obscuros, a dissipação de contradições internas ao julgado, o suprimento de omissões pertinentes a matérias sobre as quais deveria ter-se pronunciado o juízo, de ofício ou por provocação das partes, bem como a retificação de inexatidões materiais eventualmente ocorridas no decisum. 3. As alegações da embargante não revelam vícios que justifiquem a oposição dos embargos, mas sim inconformismo com o mérito da decisão, o que é incabível nesta via. 4. A legalidade da retenção das mercadorias foi expressamente fundamentada nos arts. 41-A e 48 da IN SRF 680/2006, que autorizam a interrupção do despacho aduaneiro diante de indícios de fraude, como o subfaturamento, cabendo ao Fisco a apuração e eventual aplicação de penalidades. 5. Quanto à continuidade da retenção após o Auto de Infração, o acórdão esclareceu que a liberação das mercadorias está condicionada ao pagamento do crédito tributário ou à prestação de garantia, conforme o art. 48, §§ 8º e 9º, da IN 680/2006, afastando qualquer omissão nesse ponto. 6. A Súmula 323 do Supremo Tribunal Federal foi considerada, tendo-se reconhecido sua aplicabilidade em sede liminar; contudo, prevaleceu a orientação firmada no Tema 1.042 do STF, que admite a vinculação do despacho aduaneiro ao recolhimento de tributos, inclusive antes da constituição definitiva do crédito. 7. A exigência de garantia, conforme consignado no decisum embargado, encontra respaldo no art. 48, § 9º, da mesma instrução normativa, sendo desnecessária a menção expressa ao art. 106, §1º, II, do Regulamento Aduaneiro, dado o suficiente amparo legal apresentado. 8. As alegações relativas ao Tema 1.042 do STF foram analisadas, inclusive quanto à suposta inaplicabilidade ao caso concreto (distinguishing), à inexistência de exigência fiscal constituída, à necessidade de valoração aduaneira prévia e às particularidades do RE 1.090.591. O acórdão concluiu pela pertinência do precedente. Também foi rechaçada a tese de que a interposição de Manifestação de Inconformidade afasta a exigência fiscal, uma vez que a IN SRF 680/2006 permite a retenção até o cumprimento das exigências, conforme seu art. 48, § 1º. Por fim, não houve omissão quanto ao art. 21 do Decreto nº 70.235/72, já que a fundamentação do acórdão se baseou adequadamente na legislação aduaneira específica aplicável à hipótese. 9. Caso em que não se verificam omissões, contradições, obscuridades ou erros materiais no acórdão recorrido. As questões levantadas pela embargante foram devidamente enfrentadas, sendo as alegações mera tentativa de rediscutir o mérito, o que é incabível em sede de Embargos de Declaração. 10. O intuito de prequestionamento não autoriza o acolhimento dos embargos de declaração, sem que as mencionadas falhas específicas (omissão, obscuridade, contradição e erro material) se façam presentes, não se olvidando que, nos termos do art. 1.025 do CPC/2015, \"consideram-se incluídos no acórdão os elementos que o embargante suscitou, para fins de pré-questionamento, ainda que os embargos de declaração sejam inadmitidos ou rejeitados, caso o tribunal superior considere existentes erro, omissão, contradição ou obscuridade\" (prequestionamento implícito). 11. Embargos de declaração não providos. JSG (PROCESSO: 08243182120194058100, APELAÇÃO CÍVEL, DESEMBARGADOR FEDERAL EDVALDO BATISTA DA SILVA JÚNIOR, 1ª TURMA, JULGAMENTO: 03/07/2025)",
      "consulta_processual_url": "https://www.trf5.jus.br/index.php/consulta-processual-fisico-e-eletronico"
    },
    {
      "numero_processo": "08066422820224058400",
      "classe": "APELAÇÃO CÍVEL",
      "orgao_julgador": "1ª TURMA",
      "data_julgamento": "03/07/2025",
      "relator": "DESEMBARGADOR FEDERAL EDVALDO BATISTA DA SILVA JÚNIOR",
      "ementa": "ADMINISTRATIVO. MANDADO DE SEGURANÇA. APELAÇÃO. MILITAR TEMPORÁRIO \"SUB JUDICE\". PRORROGAÇÃO DE TEMPO DE SERVIÇO NEGADA. DESVIO DE FINALIDADE. ARBITRARIEDADE COMPROVADA. ANULAÇÃO DO ATO DE LICENCIAMENTO. REINTEGRAÇÃO ÀS FORÇAS ARMADAS. APELAÇÃO IMPROVIDA. (PROCESSO: 08066422820224058400, APELAÇÃO CÍVEL, DESEMBARGADOR FEDERAL EDVALDO BATISTA DA SILVA JÚNIOR, 1ª TURMA, JULGAMENTO: 03/07/2025)",
      "texto_pdf": "PROCESSO Nº: 0806642-28.2022.4.05.8400 - APELAÇÃO CÍVEL APELANTE: UNIÃO FEDERAL APELADO: FERNANDA RAFAELLA DE MELO SILVA ADVOGADO: George Arthur Fernandes Silveira e outros RELATOR(A): Desembargador(a) Federal Edvaldo Batista da Silva Júnior - 1ª Turma JUIZ PROLATOR DA SENTENÇA (1° GRAU): Juiz(a) Federal Magnus Augusto Costa Delgado EMENTA: ADMINISTRATIVO. MANDADO DE SEGURANÇA. APELAÇÃO. MILITAR TEMPORÁRIO \"SUB JUDICE\". PRORROGAÇÃO DE TEMPO DE SERVIÇO NEGADA. DESVIO DE FINALIDADE. ARBITRARIEDADE COMPROVADA. ANULAÇÃO DO ATO DE LICENCIAMENTO. REINTEGRAÇÃO ÀS FORÇAS ARMADAS. APELAÇÃO IMPROVIDA. 1. Apelação interposta pela UNIÃO a desafiar sentença proferida pelo Juízo da 1ª Vara Federal/RN, que concedeu a segurança pleiteada pela impetrante, para declarar a ilegalidade do ato administrativo voltado ao licenciamento/desligamento da Impetrante ou qualquer outro procedimento restritivo que seja decorrente unicamente da condição \"sub judice\" ostentada pela mesma, reconhecendo o seu direito às promoções aplicáveis, caso preencha os requisitos legais necessários, assegurando-se o recebimento \"de todos benefícios econômicos e hierárquicos inerentes às suas patentes\", nos moldes pugnados à inicial. 2. A questão central dos autos consiste em verificar a ocorrência (ou não) de desvio de finalidade em ato administrativo de não-prorrogação de tempo de serviço de militar temporário, cujo ingresso nas Forças Armadas ocorreu na condição de sub judice. 3. Inicialmente, rejeita-se a preliminar de decadência ao direito de promoção da apelada a Segundo-Tenente. Conforme já debatido na Primeira Instância, em se tratando de impetração contra ato omissivo da Administração, envolvendo obrigação de trato sucessivo, o prazo para ajuizamento de ação mandamental renova-se mensalmente. 4. Quanto ao mérito, O regime jurídico aplicado aos militares temporários difere daquele aplicado aos militares de carreira que ingressam por concurso público e gozam de estabilidade no serviço público. O oficial temporário mantém com a Administração militar vínculo precário, tendo a Administração legitimidade para licenciar o militar não estável, ex offício, caso entenda necessário, observando os parâmetros de percentuais do efetivo necessário e os critérios de oportunidade e conveniência. 5. Assim, em regra, não há que se falar em violação a direito adquirido pelo simples fato de ser indeferida a prorrogação do tempo de serviço (reengajamento), pois, envolve juízo de conveniência e oportunidade da autoridade administrativa, não cabendo intervenção do Judiciário. 6. O fato de o ato de prorrogação dos contratos dos militares temporários submeter-se ao poder discricionário da autoridade militar, não obsta sua invalidação pelo Poder Judiciário, caso reste demonstrado que desbordou do interesse público, tendo em vista que o desvio de finalidade é vício que atinge a legalidade do ato administrativo. 7. A impetrante, ora apelada, mesmo tendo obtido as notas necessárias para a promoção da carreira, não foi promovida para o nível de 2º Tenente. Do acervo probatório, percebe-se a existência de diretriz completamente discriminatória aplicada aos militares temporários, mormente quando se observa o diagrama da Instrução Normativa, no sentido de que, somente por meio de decisão judicial específica, poderão os militares compreendidos pela Marinha na condição de \"sub judice\" serem promovidos. De igual modo, corroborando a tese aqui firmada, teve a impetrante acesso a um documento intitulado \"EXTRATO DO MAPA DE INFORMAÇÕES DA TURMA DE OFICIAIS DE AGO/SET\", no qual consta, expressamente, seu nome na condição de \"OFICIAIS QUE APRESENTAM IMPEDITIVO PARA PRORROGAR O TEMPO DE SERVIÇO\", por motivo \"sub-judice\". 8. Ao que tudo indica, não foi considerado o interesse público para a prorrogação do tempo de serviço da apelada, finalidade que deve permear todos os atos da Administração Pública. Caso contrário, levadas em consideração seriam as boas avaliações e o bom trabalho realizado pela apelada durante a permanência na Marinha, consoante restou evidenciado em sua avaliação. 9. Não se pode, sob o escudo da discricionaridade, utilizar ato administrativo para cobrar ressentimentos pelo fato de a apelada ter ingressado na corporação amparada por decisão judicial, pois importa em evidente desrespeito à isonomia e ao direito de recorrer ao Judiciário. 10. Ainda que o Administrador não tenha atuado com o intento de satisfazer interesse pessoal, o fato de ter praticado o ato com o objetivo de alcançar finalidade diferente daquela expressamente imposta na regra que o definiu, é o suficiente para configurar o vício por desvio de finalidade no ato da Administração Militar. Nesse sentido, em situação como a dos autos, já decidiu esta Primeira Turma: TRF5- APELAÇÃO/REMESSA NECESSÁRIA: 08045686920204058400- Relator.: DESEMBARGADOR FEDERAL FELIPE MOTA PIMENTEL DE OLIVEIRA (AUXILIAR):, Data de Julgamento: 7/8/2024, 1ª TURMA. 11. Deve ser anulado o ato administrativo de licenciamento. Como corolário lógico, deve ser a impetrante reintegrada às Forças Armadas, desde o desligamento indevido, inclusive reconhecendo-se o seu direito às promoções aplicáveis, caso preencha os requisitos legais necessários, assegurando-se o recebimento de todos os benefícios econômicos e hierárquicos inerentes à sua patente, como acertadamente decidido na sentença. 12. Sem condenação em honorários advocatícios (art. 25 da Lei n. 12.016/09). 13. Apelação improvida. AE (PROCESSO: 08066422820224058400, APELAÇÃO CÍVEL, DESEMBARGADOR FEDERAL EDVALDO BATISTA DA SILVA JÚNIOR, 1ª TURMA, JULGAMENTO: 03/07/2025)",
      "consulta_processual_url": "https://www.trf5.jus.br/index.php/consulta-processual-fisico-e-eletronico"
    },
    {
      "numero_processo": "08188468420204058300",
      "classe": "APELAÇÃO CÍVEL",
      "orgao_julgador": "1ª TURMA",
      "data_julgamento": "03/07/2025",
      "relator": "DESEMBARGADOR FEDERAL EDVALDO BATISTA DA SILVA JÚNIOR",
      "ementa": "CONSTITUCIONAL, ADMINISTRATIVO E PROCESSUAL CIVIL. APELAÇÃO. PREVIDÊNCIA COMPLEMENTAR. REG/REPLAN. FUNCEF. EQUACIONAMENTO. QUEBRA DA PARIDADE. CAIXA ECONÔMICA FEDERAL. PATROCINADORA. RESP 137191-RJ (RECURSO REPETITIVO). LEGITIMIDADE PASSIVA DA CAIXA. COMPETÊNCIA DA JUSTIÇA FEDERAL. DEVOLUÇÃO AO PRIMEIRO GRAU PARA PROCESSAMENTO DA CAUSA. APELAÇÕES PROVIDAS. (PROCESSO: 08188468420204058300, APELAÇÃO CÍVEL, DESEMBARGADOR FEDERAL EDVALDO BATISTA DA SILVA JÚNIOR, 1ª TURMA, JULGAMENTO: 03/07/2025)",
      "texto_pdf": "PROCESSO Nº: 0818846-84.2020.4.05.8300 - APELAÇÃO CÍVEL APELANTE: FUNDACAO DOS ECONOMIARIOS FEDERAIS FUNCEF ADVOGADO: Renata Mollo Dos Santos APELANTE: MARIA DO SOCORRO DE BARROS RODRIGUES ADVOGADO: Ana Karina Pinto De Carvalho Silva APELANTE: MARIA DO ROSARIO MACEDO FARIAS ADVOGADO: Ana Karina Pinto De Carvalho Silva APELANTE: MARIA DE LOURDES PESSOA DE MOURA LAERT LAGO ADVOGADO: Ana Karina Pinto De Carvalho Silva APELANTE: MARIA DE FATIMA FERNANDES VIEIRA E SILVA ADVOGADO: Ana Karina Pinto De Carvalho Silva APELANTE: MARIA BELARMINA DE ARAUJO ADVOGADO: Ana Karina Pinto De Carvalho Silva APELANTE: LUCIANO JORGE FALCAO ALVES SOUTO ADVOGADO: Ana Karina Pinto De Carvalho Silva APELADO: LUCIANO JORGE FALCAO ALVES SOUTO ADVOGADO: Ana Karina Pinto De Carvalho Silva APELADO: FUNDACAO DOS ECONOMIARIOS FEDERAIS FUNCEF ADVOGADO: Renata Mollo Dos Santos APELADO: CAIXA ECONOMICA FEDERAL - CEF APELADO: MARIA DO SOCORRO DE BARROS RODRIGUES ADVOGADO: Ana Karina Pinto De Carvalho Silva APELADO: MARIA DO ROSARIO MACEDO FARIAS ADVOGADO: Ana Karina Pinto De Carvalho Silva APELADO: MARIA DE LOURDES PESSOA DE MOURA LAERT LAGO ADVOGADO: Ana Karina Pinto De Carvalho Silva APELADO: MARIA DE FATIMA FERNANDES VIEIRA E SILVA ADVOGADO: Ana Karina Pinto De Carvalho Silva APELADO: MARIA BELARMINA DE ARAUJO ADVOGADO: Ana Karina Pinto De Carvalho Silva RELATOR(A): Desembargador(a) Federal Edvaldo Batista da Silva Júnior - 1ª Turma JUIZ PROLATOR DA SENTENÇA (1° GRAU): Juiz(a) Federal Hélio Silvio Ourém Campos EMENTA: CONSTITUCIONAL, ADMINISTRATIVO E PROCESSUAL CIVIL. APELAÇÃO. PREVIDÊNCIA COMPLEMENTAR. REG/REPLAN. FUNCEF. EQUACIONAMENTO. QUEBRA DA PARIDADE. CAIXA ECONÔMICA FEDERAL. PATROCINADORA. RESP 137191-RJ (RECURSO REPETITIVO). LEGITIMIDADE PASSIVA DA CAIXA. COMPETÊNCIA DA JUSTIÇA FEDERAL. DEVOLUÇÃO AO PRIMEIRO GRAU PARA PROCESSAMENTO DA CAUSA. APELAÇÕES PROVIDAS. 1. Apelação interposta pela FUNDAÇÃO DOS ECONOMIÁRIOS FEDERAIS- FUNCEF, por LUCIANO JORGE FALCAO ALVES SOUTO e outros, em face da sentença proferida pelo Juízo da 6ª Vara Federal/PE, que acolheu os embargos de declaração opostos pelos particulares e julgou extinta a presente ação, sem resolução do mérito, face o reconhecimento da ilegitimidade passiva da CAIXA ECONÔMICA FEDERAL e, consequentemente, a incompetência absoluta da Justiça Federal, determinando a remessa dos autos a uma das Varas Cíveis da Justiça Estadual em Recife/PE. 2. Pretende a parte autora com a presente demanda, que se declare a exclusão dos Participantes e Assistidos da contribuição extraordinária dos Equacionamentos da FUNCEF, bem como que as rés suspendam os descontos dos Equacionamentos já iniciados em 2016, 2017 e 2018 (exercícios 2012 a 2016) do Plano Reg/ Replan Saldado e Não-Saldado, assim como quaisquer outros determinados para os anos subsequentes nas folhas de pagamentos e proventos dos participantes e assistidos, pela responsabilidade objetiva da Caixa e por terem os equacionamento sido calculados sobre o valor total a equacionar; de forma subsidiária, que a totalidade das contribuições extraordinárias mensais impostas aos autores seja limitada à alíquota máxima de 10% (dez por cento) sobre o valor do benefício líquido sujeito ao equacionamento. Requer, ainda, que declare a responsabilidade civil objetiva da CAIXA e da FUNCEF e que essas cumpram e arquem com a integralidade dos referidos custeios extraordinários dos equacionamentos da FUNCEF, assim como que essa última não retire os descontos de débitos já existentes anteriormente aos Equacionamentos (empréstimos por exemplo), dos contracheques dos demandantes, bem como cumpra o percentual de 35% da margem legal consignável (considerando o cômputo de todos os descontos facultativos por ordem de contratação). 3. O Juízo a quo ao acolher os embargos de declaração opostos pela parte autora, firmou seu entendimento no sentido de que a exclusão dos Participantes e Assistidos da contribuição extraordinária dos Equacionamentos da FUNCEF, bem como a suspensão dos descontos dos Equacionamentos já iniciados em 2016, 2017 e 2018 (exercícios 2012 a 2016) do Plano Reg/ Replan Saldado e Não-Saldado é de responsabilidade da FUNCEF, pessoa com personalidade jurídica própria, não sendo, portanto, responsabilidade da Caixa Econômica Federal- CEF, reconhecendo, assim, a ilegitimidade passiva da CEF, e, via de consequência, a incompetência da Justiça Federal para processamento do feito. 4. Reside a controvérsia recursal em examinar a legitimidade da CEF para compor o polo passivo da lide e, por conseguinte, a competência da Justiça Federal para processar a demanda. 5 O Superior Tribunal de Justiça, em recurso repetitivo, firmou a seguinte orientação (Tema 936): \"I - A patrocinadora não possui legitimidade passiva para litígios que envolvam participante/assistido e entidade fechada de previdência complementar, ligados estritamente ao plano previdenciário, como a concessão e a revisão de benefício ou o resgate da reserva de poupança, em virtude de sua personalidade jurídica autônoma. II - Não se incluem no âmbito da matéria afetada as causas originadas de eventual ato ilícito, contratual ou extracontratual, praticado pelo patrocinador.\". (REsp 1.370.191/RJ , Ministro Luís Felipe Salomão , 2S, DJe 01/08/2018). 6. No caso em tela, verifica-se que a pretensão dos autores não se limita à mera revisão do plano de benefícios, mas, envolve a alegação de atos ilícitos praticados pela patrocinadora (CAIXA) que teriam impactado o equilíbrio financeiro e atuarial do plano. Tal situação se enquadra na exceção prevista no item II da tese firmada pelo STJ. 7. Ademais, o art. 202, §3º da Constituição Federal e o art. 6º da Lei Complementar n. 108/2001 estabelecem a responsabilidade da patrocinadora pelo custeio dos planos de benefícios. Assim, eventual procedência dos pedidos formulados na inicial repercutirá necessariamente na esfera jurídico-patrimonial da CAIXA, sendo forçoso reconhecer a legitimidade da CEF e a consequente competência da Justiça Federal. Nesse sentido, precedentes desta egrégia Corte Regional em processos desse jaez: TRF-5 - AGRAVO DE INSTRUMENTO: 08072463220234050000, Relator.: CID MARCONI GURGEL DE SOUZA, Data de Julgamento: 17/08/2023, 3ª TURMA; AGRAVO DE INSTRUMENTO: 08112741420214050000, Relator.: BRUNO LEONARDO CAMARA CARRA (CONVOCADO), Data de Julgamento: 21/06/2022, 4ª TURMA. 8. A causa não se encontra madura para julgamento nesta instância, dada a complexidade da discussão e a necessidade de possibilitar às partes que se manifestem e eventualmente produzam novas provas, devendo, portanto, retornar ao Primeiro Grau para ser instruída e julgada. Sem condenação em honorários. 9. Apelações providas para reconhecer a legitimidade da CEF e, por decorrência, a competência da Justiça Federal, determinando o retorno dos autos ao Juízo de origem para o regular processamento do feito. AE (PROCESSO: 08188468420204058300, APELAÇÃO CÍVEL, DESEMBARGADOR FEDERAL EDVALDO BATISTA DA SILVA JÚNIOR, 1ª TURMA, JULGAMENTO: 03/07/2025)",
      "consulta_processual_url": "https://www.trf5.jus.br/index.php/consulta-processual-fisico-e-eletronico"
    },
    {
      "numero_processo": "08007856420234058400",
      "classe": "APELAÇÃO CÍVEL",
      "orgao_julgador": "1ª TURMA",
      "data_julgamento": "03/07/2025",
      "relator": "DESEMBARGADOR FEDERAL EDVALDO BATISTA DA SILVA JÚNIOR",
      "ementa": "ADMINISTRATIVO. ENSINO SUPERIOR. PÓS-GRADUAÇÃO STRICTO SENSU. DESLIGAMENTO AUTOMÁTICO POR REPROVAÇÃO. ATO ADMINISTRATIVO GRAVOSO. AUSÊNCIA DE DEVIDO PROCESSO LEGAL. PRINCÍPIOS DA BOA-FÉ, CONFIANÇA LEGÍTIMA E ISONOMIA. REATIVAÇÃO DE VÍNCULO. (PROCESSO: 08007856420234058400, APELAÇÃO CÍVEL, DESEMBARGADOR FEDERAL EDVALDO BATISTA DA SILVA JÚNIOR, 1ª TURMA, JULGAMENTO: 03/07/2025)",
      "texto_pdf": "PROCESSO Nº: 0800785-64.2023.4.05.8400 - APELAÇÃO CÍVEL APELANTE: UNIVERSIDADE FEDERAL DO RIO GRANDE DO NORTE APELADO: ANA PAULA CORDEIRO ERNESTO ADVOGADO: ANA PAULA CORDEIRO ERNESTO RELATOR(A): DESEMBARGADOR(A) FEDERAL EDVALDO BATISTA DA SILVA JÚNIOR - 1ª TURMA JUIZ PROLATOR DA SENTENÇA (1° GRAU): JUIZ(A) FEDERAL GISELE MARIA DA SILVA ARAUJO LEITE EMENTA: ADMINISTRATIVO. ENSINO SUPERIOR. PÓS-GRADUAÇÃO STRICTO SENSU. DESLIGAMENTO AUTOMÁTICO POR REPROVAÇÃO. ATO ADMINISTRATIVO GRAVOSO. AUSÊNCIA DE DEVIDO PROCESSO LEGAL. PRINCÍPIOS DA BOA-FÉ, CONFIANÇA LEGÍTIMA E ISONOMIA. REATIVAÇÃO DE VÍNCULO. 1. Recurso de apelação interposto contra sentença que julgou procedente o pleito inicial, para determinar a condenação da Universidade Federal do Rio Grande do Norte - UFRN à reativação do vínculo acadêmico/matrícula da parte autora no Programa de Mestrado referido nos autos, desde que inexista outro impedimento para tanto, além daquele objeto de controvérsia na presente demanda. 2. As instituições de ensino superior possuem autonomia didático-científica e administrativa, nos termos do art. 207 da Constituição Federal, que lhes confere a prerrogativa de estabelecer critérios de acesso, permanência e exclusão de discentes, desde que respeitados os princípios constitucionais e administrativos. Contudo, tal autonomia não é absoluta, devendo observar as garantias fundamentais do devido processo legal, contraditório e ampla defesa (CF, art. 5º, LIV e LV), aplicáveis tanto na esfera judicial quanto na administrativa, conforme disposto na Lei nº 9.784/1999. 3. A exclusão de um discente de programa de pós-graduação constitui ato administrativo gravoso, com impacto significativo sobre os direitos da apelada, especialmente considerando sua dedicação ao curso e os eventuais investimentos pessoais e financeiros realizados. Nos termos do art. 5º, LIV e LV, da Constituição Federal, e do art. 2º da Lei nº 9.784/1999, nenhum ato administrativo que implique restrição de direitos pode ser imposto sem a prévia notificação do interessado, com garantia de contraditório e ampla defesa. No caso, a apelada não foi notificada sobre a abertura de qualquer procedimento administrativo para apuração de suas reprovações ou sobre a possibilidade de desligamento, o que configura vício insanável no ato impugnado. 4. A alegação da apelante de que a apelada contou com 9 (nove) meses para proceder com a regularização de sua situação não prospera, pois a ausência de notificação formal impede que se impute à discente a responsabilidade por não buscar meios administrativos. A apelante permitiu que a apelada continuasse matriculada e cursasse disciplinas, inclusive aquelas em que fora reprovada, sem informá-la sobre a irregularidade de sua situação ou sobre o risco de desligamento. Tal conduta gerou legítima expectativa de regularidade do vínculo, configurando comportamento contraditório, que viola os princípios da confiança e da boa-fé objetiva, aplicáveis à Administração Pública. 5. Não pode prosperar o argumento recursal de que a reativação do vínculo violaria o princípio da isonomia, por conceder tratamento desigual à apelada em relação aos demais discentes. A isonomia não implica tratamento idêntico a situações distintas. A alegada condição de saúde da apelada e a comprovada ausência de devido processo legal justificam a diferenciação, em conformidade com o princípio da igualdade material (art. 5º, caput, CF). Ademais, a possibilidade de reingresso, mencionada pela apelante, não elide o prejuízo sofrido pela apelada, que investiu tempo e recursos financeiros no programa, sob a expectativa de regularidade de seu vínculo. 6. Recurso de apelação não provido. JSG (PROCESSO: 08007856420234058400, APELAÇÃO CÍVEL, DESEMBARGADOR FEDERAL EDVALDO BATISTA DA SILVA JÚNIOR, 1ª TURMA, JULGAMENTO: 03/07/2025)",
      "consulta_processual_url": "https://www.trf5.jus.br/index.php/consulta-processual-fisico-e-eletronico"
    },
    {
      "numero_processo": "08011548920224058401",
      "classe": "APELAÇÃO CÍVEL",
      "orgao_julgador": "1ª TURMA",
      "data_julgamento": "03/07/2025",
      "relator": "DESEMBARGADOR FEDERAL EDVALDO BATISTA DA SILVA JÚNIOR",
      "ementa": "APELAÇÃO CÍVEL. AÇÃO ORDINÁRIA. DEMORA NA EXPEDIÇÃO DE DIPLOMA. ENTREGA DO DIPLOMA NA MESMA DATA DO AJUIZAMENTO DA AÇÃO. EXTINÇÃO DO PROCESSO SEM RESOLUÇÃO DE MÉRITO POR FALTA DE INTERESSE PROCESSUAL. AUSÊNCIA DE PROVA DE DANOS EFETIVOS. RECURSO PARCIALMENTE PROVIDO APENAS PARA DEFERIR O PEDIDO DE GRATUIDADE DA JUSTIÇA. (PROCESSO: 08011548920224058401, APELAÇÃO CÍVEL, DESEMBARGADOR FEDERAL EDVALDO BATISTA DA SILVA JÚNIOR, 1ª TURMA, JULGAMENTO: 03/07/2025)",
      "texto_pdf": "PROCESSO Nº: 0801154-89.2022.4.05.8401 - APELAÇÃO CÍVEL APELANTE: MARCIA MARIA DA SILVA ADVOGADO: ALLAN CASSIO DE OLIVEIRA LIMA APELADO: IBRAPES-INSTITUTO BRASIL DE PESQUISA E ENSINO SUPERIOR LTDA ADVOGADO: HENRIQUE EDUARDO BEZERRA DA COSTA E OUTROS RELATOR(A): DESEMBARGADOR(A) FEDERAL EDVALDO BATISTA DA SILVA JÚNIOR - 1ª TURMA JUIZ PROLATOR DA SENTENÇA (1° GRAU): JUIZ(A) FEDERAL ORLAN DONATO ROCHA EMENTA: APELAÇÃO CÍVEL. AÇÃO ORDINÁRIA. DEMORA NA EXPEDIÇÃO DE DIPLOMA. ENTREGA DO DIPLOMA NA MESMA DATA DO AJUIZAMENTO DA AÇÃO. EXTINÇÃO DO PROCESSO SEM RESOLUÇÃO DE MÉRITO POR FALTA DE INTERESSE PROCESSUAL. AUSÊNCIA DE PROVA DE DANOS EFETIVOS. RECURSO PARCIALMENTE PROVIDO APENAS PARA DEFERIR O PEDIDO DE GRATUIDADE DA JUSTIÇA. 1. Recurso de apelação interposto em face de sentença que (em Ação Ordinária ajuizada com o fim de que a Universidade Vale do Acaraú - UVA/IBRASPES - Instituto Brasil de Pesquisa e Ensino Superior proceda à confecção e entrega do Diploma do Curso de Graduação em Pedagogia - Licenciatura Plena, no prazo de 10 (dez) dias), extinguiu o processo sem resolução de mérito, nos termos do art. 485, VI do Código de Processo Civil. 2. O cerne da demanda consiste na pretensão da parte autora de obter judicialmente a obrigação de fazer consistente na confecção e entrega do diploma de graduação em Pedagogia, bem como a indenização por danos morais decorrentes da demora da instituição de ensino (Universidade Vale do Acaraú - UVA/IBRASPES) na expedição do referido diploma, em violação ao prazo legal de 60 (sessenta) dias previsto pela Portaria nº 1.095/2018 do MEC, o que teria acarretado prejuízos profissionais, financeiros e emocionais à autora. 3. O Código de Processo Civil - CPC, no caput do art. 99, é expresso ao afirmar que o pedido de gratuidade da justiça pode ser formulado em sede de recurso. No parágrafo 3º do mesmo artigo, há a disposição de que se presume verdadeira a alegação de insuficiência deduzida exclusivamente por pessoa natural. No caso, a apelante afirma não possuir recursos financeiros para arcar com as custas e demais despesas processuais sem prejuízo de sua subsistência. Concede-se, portanto, o pedido de gratuidade de justiça. 4. Acertada a sentença recorrida ao extinguir o processo sem resolução de mérito, nos termos do art. 485, VI, do Código de Processo Civil, por ausência de interesse processual. No caso concreto, a ação visava compelir a instituição de ensino à emissão e entrega do diploma de graduação da autora. Contudo, conforme consta nos autos, o referido diploma foi entregue em 27/06/2022, na mesma data do ajuizamento da ação, o que esvazia a utilidade da prestação jurisdicional quanto à obrigação de fazer. 5. O pedido de indenização por danos morais possui natureza autônoma e, portanto, independe da procedência da obrigação de fazer, de modo que, ainda que esta tenha perdido seu objeto, persiste o interesse na análise da responsabilidade civil, especialmente diante da alegação de que o atraso na emissão do diploma teria causado prejuízos de ordem moral e profissional à autora; nesse contexto, cumpre destacar que a Portaria MEC nº 1.095/2018, em seu art. 18, estabelece que as instituições de ensino superior devem expedir os diplomas no prazo máximo de 60 (sessenta) dias contados da colação de grau, sendo que, no caso concreto, a colação ocorreu em 18/09/2021 e o diploma foi entregue apenas em 27/06/2022, caracterizando atraso de aproximadamente nove meses e, por conseguinte, violação ao prazo regulamentar; entretanto, para que se configure o dano moral indenizável, exige-se prova de lesão a direitos da personalidade, como honra, dignidade ou imagem, o que demanda mais do que o mero aborrecimento ou dissabor decorrente do inadimplemento contratual. 6. Inexiste nos autos qualquer elemento probatório que comprove tentativa de inserção no mercado de trabalho frustrada em razão do atraso na expedição do diploma, tampouco há demonstração de exigência formal do referido documento em processos seletivos ou oportunidades de contratação; assim, ausente prova de impedimento concreto ao exercício profissional, não se sustenta a alegação de privação ao exercício da atividade. 7. A parte autora, embora alegue constrangimentos e prejuízos financeiros, não apresentou qualquer prova documental que comprove, de forma objetiva, a perda de oportunidades profissionais, recusas em propostas de emprego ou outro dano concreto decorrente da demora na expedição do diploma; assim, ainda que o lapso temporal seja relevante, a ausência de comprovação dos prejuízos efetivamente suportados inviabiliza a indenização por danos morais, uma vez que o simples descumprimento contratual, por si só, não configura violação a direitos da personalidade. 8. A responsabilidade do fornecedor de serviços é objetiva, nos termos do art. 14 do CDC, prescindindo da prova de culpa. Entretanto, a configuração da obrigação de indenizar depende da comprovação cumulativa de conduta, dano e nexo causal. No presente caso, embora configurada a falha na prestação do serviço e a relação de causalidade, não restou demonstrado o dano indenizável, razão pela qual não se impõe a condenação. 9. Recurso de apelação parcialmente provido, apenas para deferir o pedido de gratuidade da justiça. JSG (PROCESSO: 08011548920224058401, APELAÇÃO CÍVEL, DESEMBARGADOR FEDERAL EDVALDO BATISTA DA SILVA JÚNIOR, 1ª TURMA, JULGAMENTO: 03/07/2025)",
      "consulta_processual_url": "https://www.trf5.jus.br/index.php/consulta-processual-fisico-e-eletronico"
    },
    {
      "numero_processo": "08071969820244058300",
      "classe": "REMESSA NECESSÁRIA CÍVEL",
      "orgao_julgador": "1ª TURMA",
      "data_julgamento": "03/07/2025",
      "relator": "DESEMBARGADOR FEDERAL EDVALDO BATISTA DA SILVA JÚNIOR",
      "ementa": "ADMINISTRATIVO. EMBARGOS DE DECLARAÇÃO. UFPE. LEI Nº 8.745/93. TEMA DE REPERCUSSÃO GERAL Nº 403 (RE 635648/CE). INEXISTÊNCIA DE OMISSÃO. EMBARGOS DE DECLARAÇÃO NÃO PROVIDOS. (PROCESSO: 08071969820244058300, REMESSA NECESSÁRIA CÍVEL, DESEMBARGADOR FEDERAL EDVALDO BATISTA DA SILVA JÚNIOR, 1ª TURMA, JULGAMENTO: 03/07/2025)",
      "texto_pdf": "PROCESSO Nº: 0807196-98.2024.4.05.8300 - EMBARGOS DE DECLARAÇÃO EM REMESSA NECESSÁRIA CÍVEL PARTE AUTORA: JOSE WALBERICO DA SILVA COSTA ADVOGADO: Yure Alves Figueredo Cruz PARTE RÉ: UNIVERSIDADE FEDERAL DE PERNAMBUCO RELATOR(A): Desembargador(a) Federal Edvaldo Batista da Silva Júnior - 1ª Turma JUIZ PROLATOR DA SENTENÇA (1° GRAU): Juiz(a) Federal Hélio Silvio Ourém Campos EMENTA: ADMINISTRATIVO. EMBARGOS DE DECLARAÇÃO. UFPE. LEI Nº 8.745/93. TEMA DE REPERCUSSÃO GERAL Nº 403 (RE 635648/CE). INEXISTÊNCIA DE OMISSÃO. EMBARGOS DE DECLARAÇÃO NÃO PROVIDOS. 1. Embargos de declaração opostos pela Universidade Federal de Pernambuco - UFPE, contra acórdão proferido pela Primeira Turma desta Corte Regional, que negou provimento à remessa oficial. 2. Alega o embargante, em síntese, que o acórdão incorreu em omissão quanto à proibição legal de contratação temporária da mesma pessoa pela Administração Pública, segundo o STF (Recurso Extraordinário 635.648-CE - Tema 403).Pugna, também, pelo sobrestamento do feito até o julgamento do Tema 1308 pelo STJ 3. Inicialmente, é de se salientar ser incabível, em sede de embargos de declaração, a busca por novo julgamento da matéria já expressamente decidida na decisão combatida. Ainda que para efeito de prequestionamento, os Embargos de Declaração exigem a presença dos requisitos de admissibilidade estabelecidos pelo art. 1.022, do CPC, quais sejam: a omissão, a obscuridade, contradição ou erro material. 4. Primeiramente, em relação ao sobrestamento, não se justifica a suspensão do processo até o deslinde dos recursos especiais representativos da controvérsia (RESP. 2.136.644/AL E RESP 2.141.105/RN, afetados em 17/02/2025), atinentes ao Tema 1308. Eventual sobrestamento do feito dar-se-á pela Vice-Presidência desta corte regional, por ocasião do exame da admissibilidade de recurso especial e extraordinário que venham a ser interpostos pelas partes (art. 1.030 do CPC e do art. 17, § 3º, \"a\" do Regimento Interno deste TRF da 5ª Região). 5. O acórdão foi claro na análise da questão levantada, ao destacar que ao impetrante/parte autora não se aplica a tese fixada pelo STF no RE 635648/CE, em relação ao disposto no art. 9º, III, da Lei n. 8.745/93, não havendo óbice à contratação pretendida, uma vez que se trata de instituições de ensino diversas, consoante vem, reiteradamente, decidindo o próprio STF (cf. RE 1120059, Rel. Min. EDSON FACHIN, j. 30/05/2018, DJe-110 DIVULG 04/06/2018 PUBLIC 05/06/2018). 6. Ausentes os vícios apontados pela embargante. Ao invés de demonstrar efetivos vícios na análise de questões necessárias ao julgamento da causa, a embargante, na verdade, apresenta teses jurídicas já apreciadas. O acórdão foi suficientemente fundamentado, além de ter sido elaborado em consonância com a legislação aplicável ao caso, não havendo que se falar em omissão. 7. Não se caracteriza como acórdão omisso aquele em que resta ausente de menção explícita a dispositivos legais mencionados pelas partes, sendo suficiente a apreciação da questão jurídica envolvida para que tenha havido pleno exame da lide, inclusive para fins de prequestionamento para acesso à instância extraordinária. 8. O Superior Tribunal de Justiça adota o entendimento de que o julgador não está obrigado a responder a todas as questões suscitadas pelas partes, quando já tenha encontrado motivo suficiente para proferir a decisão, bem como que a prescrição trazida pelo art. 489 do CPC/2015 veio confirmar a jurisprudência já sedimentada pelo Colendo Superior Tribunal de Justiça, sendo dever do julgador apenas enfrentar as questões capazes de infirmar a conclusão adotada na decisão recorrida. Precedente: EDcl no MS 21.315/DF, relatora Ministra Diva Malerbi (desembargadora Convocada TRF 3ª Região), Primeira Seção, julgado em 8/6/2016, DJe 15/6/2016. 9. Ao que parece, a pretensão da embargante é mesmo a de modificar o entendimento firmado por esta egrégia Turma no Acórdão embargado, o que não se mostra adequado através da presente via recursal. 10. Com efeito, as hipóteses legais autorizadoras para interposição de embargos declaratórios não foram verificadas, descabendo a utilização de dito recurso para modificação do acórdão. 11. Por fim, registre-se que o simples desejo de prequestionamento não acarreta o provimento do recurso se o acórdão não padece de qualquer omissão, obscuridade, contradição ou erro material. Com a entrada em vigor do CPC/15, a mera oposição dos embargos de declaração passa a gerar prequestionamento implícito, mesmo que os embargos sejam inadmitidos ou rejeitados, caso o Tribunal Superior entenda haver defeito no acórdão, na forma do artigo 1.025 do CPC. 12. Embargos de declaração não providos. GK (PROCESSO: 08071969820244058300, REMESSA NECESSÁRIA CÍVEL, DESEMBARGADOR FEDERAL EDVALDO BATISTA DA SILVA JÚNIOR, 1ª TURMA, JULGAMENTO: 03/07/2025)",
      "consulta_processual_url": "https://www.trf5.jus.br/index.php/consulta-processual-fisico-e-eletronico"
    },
    {
      "numero_processo": "08191469320224058100",
      "classe": "APELAÇÃO CÍVEL",
      "orgao_julgador": "1ª TURMA",
      "data_julgamento": "03/07/2025",
      "relator": "DESEMBARGADOR FEDERAL EDVALDO BATISTA DA SILVA JÚNIOR",
      "ementa": ". PROCESSO CIVIL. EMBARGOS DE DECLARAÇÃO. ART. 1.022 DO CÓDIGO DE PROCESSO CIVIL. INEXISTÊNCIA DE OMISSÃO E DE CONTRADIÇÃO. RECURSO NÃO PROVIDO. (PROCESSO: 08191469320224058100, APELAÇÃO CÍVEL, DESEMBARGADOR FEDERAL EDVALDO BATISTA DA SILVA JÚNIOR, 1ª TURMA, JULGAMENTO: 03/07/2025)",
      "texto_pdf": "PROCESSO Nº: 0819146-93.2022.4.05.8100 - APELAÇÃO CÍVEL APELANTE: TRANSNACIONAL TRANSPORTES LTDA ADVOGADO: THIAGO BONAVIDES BORGES DA CUNHA BITAR APELADO: FAZENDA NACIONAL RELATOR(A): DESEMBARGADOR(A) FEDERAL EDVALDO BATISTA DA SILVA JÚNIOR - 1ª TURMA MAGISTRADO CONVOCADO: DESEMBARGADOR(A) FEDERAL ROBERTA WALMSLEY S. C. PORTO DE BARROS JUIZ PROLATOR DA SENTENÇA (1° GRAU): JUIZ(A) FEDERAL HELOISA SILVA DE MELO EMENTA. PROCESSO CIVIL. EMBARGOS DE DECLARAÇÃO. ART. 1.022 DO CÓDIGO DE PROCESSO CIVIL. INEXISTÊNCIA DE OMISSÃO E DE CONTRADIÇÃO. RECURSO NÃO PROVIDO. 1. Embargos de declaração opostos contra acórdão que negou provimento ao recurso de apelação interposto em face de sentença que denegou a segurança postulada, consistente no reconhecimento do direito à compensação dos créditos indicados no Pedido de Habilitação de Crédito n° 19614.743738/2022-99 com quaisquer outros tributos apurados pela empresa impetrante perante a Secretaria Especial da Receita Federal do Brasil (RFB). 2. Os embargos de declaração, nos termos do art. 1.022 do Código de Processo Civil, possuem natureza integrativa e destinam-se, precipuamente, à eliminação de vícios formais que comprometam a clareza ou completude do julgado (a saber: omissão, contradição, obscuridade ou erro material), não se prestando, por sua teleologia, à rediscussão do mérito da causa ou à revisão da ratio decidendi firmada no acórdão recorrido. 3. Hipótese em que não assiste razão à embargante, pelas razões que seguem: a) o acórdão enfrentou expressamente o argumento relativo ao trânsito em julgado, ao afirmar que a compensação deve observar a legislação vigente à época da propositura da ação, sendo irrelevante a data do trânsito em julgado (cf. Tema 265/STJ); b) o decisum assentou que a compensação está condicionada às regras do art. 26-A da Lei nº 11.457/2007, com as alterações da Lei nº 13.670/2018, rechaçando a retroatividade de normas mais favoráveis ao contribuinte; c) o aresto deixou claro que a compensação, independentemente da origem do crédito, deve observar os limites legais e regulamentares aplicáveis aos tributos administrados pela Receita Federal, não havendo regime jurídico autônomo para créditos judiciais; d) a decisão invocou fundamentos legais suficientes para justificar a vedação da compensação pretendida, afastando, de forma implícita porém suficiente, a tese de que se trata de restrição jurisprudencial sem amparo normativo; e) o acórdão considerou que, ainda que o procedimento de habilitação judicial seja específico, não afasta a submissão do crédito ao regime geral de compensação, conforme disciplinado pela legislação de regência; f) ao aplicar critérios legais objetivos relacionados à utilização do e-Social, o julgado implicitamente afastou qualquer violação ao princípio da isonomia, pois a distinção decorre da própria norma legal. 4. caso em que as razões apresentadas nos embargos declaratórios revelam, na realidade, o inconformismo da embargante com a interpretação adotada pelo decisum recorrido, interpretação essa que não encontra solução na restrita órbita deste recurso integrativo. 5. É pacífico na doutrina e na jurisprudência desta Egrégia Corte, bem como nas dos Tribunais Superiores, o entendimento de que \"O julgador não é obrigado a rebater todos os argumentos aventados pelas partes quando o acórdão recorrido analisar, com clareza, as questões essenciais ao deslinde da controvérsia, havendo, ainda, razões suficientes para sua manutenção\" (EDcl no AgRg nos EDcl no AREsp 534.318/PB, Rel. Ministro Reynaldo Soares Da Fonseca, Quinta Turma, julgado em 11/6/2015, DJe 17/6/2015). No mesmo sentido: EDcl no REsp 1642727/RJ, Rel. Ministro Herman Benjamin, Segunda Turma, julgado em 13/06/2017, DJe 20/06/2017; REsp 1600906/SC, Rel. Ministra Assusete Magalhães, Segunda Turma, julgado em 20/04/2017, DJe 02/05/2017). 6. Embargos de declaração não providos. JSG (PROCESSO: 08191469320224058100, APELAÇÃO CÍVEL, DESEMBARGADOR FEDERAL EDVALDO BATISTA DA SILVA JÚNIOR, 1ª TURMA, JULGAMENTO: 03/07/2025)",
      "consulta_processual_url": "https://www.trf5.jus.br/index.php/consulta-processual-fisico-e-eletronico"
    },
    {
      "numero_processo": "08089654920234050000",
      "classe": "AGRAVO DE INSTRUMENTO",
      "orgao_julgador": "1ª TURMA",
      "data_julgamento": "03/07/2025",
      "relator": "DESEMBARGADOR FEDERAL EDVALDO BATISTA DA SILVA JÚNIOR",
      "ementa": ". PROCESSO CIVIL. EMBARGOS DE DECLARAÇÃO. ART. 1.022 DO CÓDIGO DE PROCESSO CIVIL. INEXISTÊNCIA DE OMISSÃO E DE CONTRADIÇÃO. RECURSO NÃO PROVIDO. (PROCESSO: 08089654920234050000, AGRAVO DE INSTRUMENTO, DESEMBARGADOR FEDERAL EDVALDO BATISTA DA SILVA JÚNIOR, 1ª TURMA, JULGAMENTO: 03/07/2025)",
      "texto_pdf": "PROCESSO Nº: 0808965-49.2023.4.05.0000 - AGRAVO DE INSTRUMENTO AGRAVANTE: GUILHERME PRAZERES DE CERQUEIRA SERVICOS DE IMPLEMENTOS RODOVIARIOS ADVOGADO: GEORGE JOSE NASCIMENTO DE SOUZA AGRAVADO: FAZENDA NACIONAL RELATOR(A): DESEMBARGADOR(A) FEDERAL EDVALDO BATISTA DA SILVA JÚNIOR - 1ª TURMA PROCESSO ORIGINÁRIO: 0800937-59.2021.4.05.8311 - 30ª VARA FEDERAL - PE EMENTA. PROCESSO CIVIL. EMBARGOS DE DECLARAÇÃO. ART. 1.022 DO CÓDIGO DE PROCESSO CIVIL. INEXISTÊNCIA DE OMISSÃO E DE CONTRADIÇÃO. RECURSO NÃO PROVIDO. 1. Embargos de declaração opostos contra acordão que negou provimento ao agravo de instrumento interposto contra decisão proferida pelo Juízo da 30ª Vara Federal de Pernambuco, que rejeitou a exceção de pré-executividade manejada. 2. Os embargos de declaração, nos termos do art. 1.022 do Código de Processo Civil, possuem natureza integrativa e destinam-se, precipuamente, à eliminação de vícios formais que comprometam a clareza ou completude do julgado (a saber: omissão, contradição, obscuridade ou erro material), não se prestando, por sua teleologia, à rediscussão do mérito da causa ou à revisão da ratio decidendi firmada no acórdão recorrido. 3. O decisum embargado reconheceu a regularidade da CDA, com base na presunção de certeza, liquidez e exigibilidade (art. 3º da Lei nº 6.830/80 e art. 204 do CTN), e refutou a nulidade alegada, exigindo do executado prova inequívoca para afastar tal presunção. O acórdão, ademais, é claro, apresentando fundamentação precisa sobre os pontos controvertidos, como a validade da CDA, a existência de notificação administrativa e a ausência de prescrição ou decadência. Para além disso, não se identifica erro material no julgado, pois a decisão não apresenta inexatidões, equívocos de cálculo ou premissas fáticas equivocadas. Por fim, o acórdão analisou os documentos e as notificações constantes nos autos, confirmando a regularidade do procedimento administrativo e a inexistência de prescrição, com base no parcelamento que suspendeu a exigibilidade do crédito, conforme preceitua o art. 151, VI, do CTN. Assim, inexiste vício a ser corrigido nos moldes do art. 1.022, III, do CPC. 4. O intuito de prequestionamento não autoriza o acolhimento dos embargos de declaração, sem que as mencionadas falhas específicas (omissão, obscuridade, contradição e erro material) se façam presentes, não se olvidando que, nos termos do art. 1.025 do CPC/2015, \"consideram-se incluídos no acórdão os elementos que o embargante suscitou, para fins de pré-questionamento, ainda que os embargos de declaração sejam inadmitidos ou rejeitados, caso o tribunal superior considere existentes erro, omissão, contradição ou obscuridade\" (prequestionamento implícito). 5. Nego provimento aos embargos de declaração. JSG (PROCESSO: 08089654920234050000, AGRAVO DE INSTRUMENTO, DESEMBARGADOR FEDERAL EDVALDO BATISTA DA SILVA JÚNIOR, 1ª TURMA, JULGAMENTO: 03/07/2025)",
      "consulta_processual_url": "https://www.trf5.jus.br/index.php/consulta-processual-fisico-e-eletronico"
    },
    {
      "numero_processo": "08086277520234050000",
      "classe": "AGRAVO DE INSTRUMENTO",
      "orgao_julgador": "1ª TURMA",
      "data_julgamento": "03/07/2025",
      "relator": "DESEMBARGADOR FEDERAL EDVALDO BATISTA DA SILVA JÚNIOR",
      "ementa": ". PROCESSO CIVIL. EMBARGOS DE DECLARAÇÃO. ART. 1.022 DO CÓDIGO DE PROCESSO CIVIL. INEXISTÊNCIA DE OMISSÃO E DE CONTRADIÇÃO. RECURSO NÃO PROVIDO. (PROCESSO: 08086277520234050000, AGRAVO DE INSTRUMENTO, DESEMBARGADOR FEDERAL EDVALDO BATISTA DA SILVA JÚNIOR, 1ª TURMA, JULGAMENTO: 03/07/2025)",
      "texto_pdf": "PROCESSO Nº: 0808627-75.2023.4.05.0000 - AGRAVO DE INSTRUMENTO AGRAVANTE: UNIL INDUSTRIA E COMERCIO DE MATERIAIS PLASTICOS EIRELI ADVOGADO: MINARTE FIGUEIREDO BARBOSA FILHO E OUTRO AGRAVADO: FAZENDA NACIONAL RELATOR(A): DESEMBARGADOR(A) FEDERAL EDVALDO BATISTA DA SILVA JÚNIOR - 1ª TURMA EMENTA. PROCESSO CIVIL. EMBARGOS DE DECLARAÇÃO. ART. 1.022 DO CÓDIGO DE PROCESSO CIVIL. INEXISTÊNCIA DE OMISSÃO E DE CONTRADIÇÃO. RECURSO NÃO PROVIDO. 1. Embargos de declaração opostos contra acordão que deu provimento ao agravo de instrumento interposto por UNIL Indústria e Comércio de Materiais Plásticos Ltda. contra a decisão proferida pelo Juízo da 11ª Vara Federal/PE, que indeferiu o pedido de aproveitamento dos valores bloqueados no sistema SISBAJUD para abatimento do saldo devedor do parcelamento. 2. Os embargos de declaração, nos termos do art. 1.022 do Código de Processo Civil, possuem natureza integrativa e destinam-se, precipuamente, à eliminação de vícios formais que comprometam a clareza ou completude do julgado (a saber: omissão, contradição, obscuridade ou erro material), não se prestando, por sua teleologia, à rediscussão do mérito da causa ou à revisão da ratio decidendi firmada no acórdão recorrido. 3. O acórdão enfrentou expressamente o fato de o bloqueio via SISBAJUD ter ocorrido antes da formalização da transação excepcional, reconhecendo que, embora anterior ao parcelamento, o bloqueio poderia ser mantido, mas seu aproveitamento para quitação de parcelas estimularia a regularização do débito. A fundamentação baseou-se na Lei nº 13.988/2020 e em precedentes do TRF5 (Processos 0807193-51.2023.4.05.0000 e 0812043-17.2024.4.05.0000). A tese de que o uso de valores bloqueados configuraria vantagem indevida foi afastada com base no art. 11 da mesma lei e em portarias da PGFN, que autorizam a amortização da dívida por meios alternativos. Destacou-se que a conversão do valor em renda da União atende ao princípio da menor onerosidade (art. 805 do CPC), beneficiando ambas as partes sem comprometer o caráter do parcelamento. 4. Quanto à legalidade e isonomia, o acórdão afastou quaisquer violações, amparando-se em normas tributárias específicas e no entendimento do STJ (Tema Repetitivo 1.012). Concluiu-se que a solução preserva o equilíbrio entre os interesses do Fisco e do contribuinte, sem conferir privilégios. 5. Os argumentos sobre a necessidade de reexame de fatos e provas foram rechaçados por desvirtuarem a finalidade dos embargos de declaração, que, conforme o art. 1.022 do CPC, destinam-se apenas à correção de vícios formais. 6. Embargos de declaração não providos. JSG (PROCESSO: 08086277520234050000, AGRAVO DE INSTRUMENTO, DESEMBARGADOR FEDERAL EDVALDO BATISTA DA SILVA JÚNIOR, 1ª TURMA, JULGAMENTO: 03/07/2025)",
      "consulta_processual_url": "https://www.trf5.jus.br/index.php/consulta-processual-fisico-e-eletronico"
    }
  ]
}