{
  "2025": [
    {
      "numero_processo": "08037289720244050000",
      "classe": "AGRAVO DE INSTRUMENTO",
      "orgao_julgador": "2ª TURMA",
      "data_julgamento": "03/06/2025",
      "relator": "DESEMBARGADOR FEDERAL PAULO ROBERTO DE OLIVEIRA LIMA",
      "ementa": "PROCESSUAL CIVIL. AGRAVO DE INSTRUMENTO. EMPRÉSTIMO COMPULSÓRIO. LIQUIDAÇÃO DE SENTENÇA. CÁLCULOS DO PERITO DO JUÍZO. PRESUNÇÃO DE LEGITIMIDADE E VERACIDADE. (PROCESSO: 08037289720244050000, AGRAVO DE INSTRUMENTO, DESEMBARGADOR FEDERAL PAULO ROBERTO DE OLIVEIRA LIMA, 2ª TURMA, JULGAMENTO: 03/06/2025)",
      "texto_pdf": "PROCESSO Nº: 0803728-97.2024.4.05.0000 - AGRAVO DE INSTRUMENTO AGRAVANTE: MOINHO PATOENSE LTDA - ME ADVOGADO: Odon Dantas Bezerra Cavalcanti AGRAVADO: CENTRAIS ELETRICAS BRASILEIRAS SA e outro ADVOGADO: Decio Flavio Gonçalves Torres Freire RELATOR(A): Desembargador(a) Federal Paulo Roberto de Oliveira Lima - 2ª Turma PROCESSO ORIGINÁRIO: 0800571-93.2020.4.05.8201 - 10ª VARA FEDERAL - PB JUIZ PROLATOR DA SENTENÇA (1° GRAU): Juiz(a) Federal EMENTA PROCESSUAL CIVIL. AGRAVO DE INSTRUMENTO. EMPRÉSTIMO COMPULSÓRIO. LIQUIDAÇÃO DE SENTENÇA. CÁLCULOS DO PERITO DO JUÍZO. PRESUNÇÃO DE LEGITIMIDADE E VERACIDADE. 1. Trata-se de agravo de instrumento de MOINHO PATOENSE LTDA - ME, em contrariedade à decisão proferida em sede de cumprimento de sentença, que, ao apreciar pedido de liquidação de sentença, formulado pela ora agravante em desfavor da União e da Eletrobrás, fundado no título executivo judicial constituído nos autos da Ação Ordinária n°0001944-47.2010.4.05.8201, acolheu como valor devido ao liquidante a importância apontada pelo perito judicial (identificador nº. 4058201.12273746), que indicou o montante de R$ 117.076,81 (atualizado para 07/2022). 2. A decisão agravada não merece reproche. A sentença em cumprimento condenou a ELETROBRÁS e a UNIÃO a restituírem a diferença da correção monetária do empréstimo compulsório incidente sobre o consumo de energia elétrica, instituído pela Lei nº 4.156/62. 3. Conquanto o agravante sustente que a decisão judicial adotou premissa equivocada, não é assim. Em verdade, o juízo considerou que o Tribunal, no julgamento do Agravo de Instrumento nº 0805351-36.2023.4.05.0000, já definiu que a liquidação do julgado deve obedecer ao que restou definido no título executivo (incidência dos juros remuneratórios até a data do resgate), e daí o juízo destacou que \"no contexto atual, deve prevalecer o entendimento adotado na perícia, pois atende ao comando judicial definitivo proferido Agravo de Instrumento nº 0805351-36.2023.4.05.0000, no que diz respeito ao termo final da aplicação dos juros remuneratórios.\". 4. Melhor sorte não tem a alegação sobre erro quanto a data de encerramento dos cálculos, porquanto embora o agravante sustente que os cálculos apresentados estão atualizados até março de 2020, o perito judicial afirmou ao juízo expressamente que os cálculos todos foram encerrado na mesma data de 31.12.22, destacando, \"a fim de permitir a essa autoridade o efeito-comparativo entre elas\", referindo-se às planilhas. 5. De resto, os cálculos do perito do juízo gozam da presunção de legitimidade e certeza, de modo que as asserções da recorrente não merecem guarida. 6. Por último, também não procede a pretensão recursal concernente à omissão quanto aos honorários advocatícios de sucumbência fixados na fase de conhecimento. Em verdade, esse tema não frequentou a decisão da liquidação. Note-se que toda a celeuma resolvida pelo juízo concernira à liquidação do título, mormente no que tange aos cálculos concernentes à correção monetária e juros remuneratórios. Observe-se, mais, que ainda que o liquidante tenha quantificado o valor dos honorários sucumbenciais em sua inicial, sobre o tema o juízo não se manifestou e a parte interessada não embargou de declaração, o que importaria em supressão de instância a análise por este tribunal. 7. Agravo de instrumento desprovido. MN (PROCESSO: 08037289720244050000, AGRAVO DE INSTRUMENTO, DESEMBARGADOR FEDERAL PAULO ROBERTO DE OLIVEIRA LIMA, 2ª TURMA, JULGAMENTO: 03/06/2025)",
      "consulta_processual_url": "https://www.trf5.jus.br/index.php/consulta-processual-fisico-e-eletronico"
    },
    {
      "numero_processo": "08057866220204058100",
      "classe": "APELAÇÃO CÍVEL",
      "orgao_julgador": "2ª TURMA",
      "data_julgamento": "03/06/2025",
      "relator": "DESEMBARGADOR FEDERAL PAULO ROBERTO DE OLIVEIRA LIMA",
      "ementa": "TRIBUTÁRIO. EMBARGOS À EXECUÇÃO FISCAL. REDIRECIONAMENTO. DISSOLUÇÃO IRREGULAR DA PESSOA JURÍDICA. ART. 135, III, DO CTN. POSSIBILIDADE. SÚMULA 435 DO STJ. (PROCESSO: 08057866220204058100, APELAÇÃO CÍVEL, DESEMBARGADOR FEDERAL PAULO ROBERTO DE OLIVEIRA LIMA, 2ª TURMA, JULGAMENTO: 03/06/2025)",
      "texto_pdf": "PROCESSO Nº: 0805786-62.2020.4.05.8100 - APELAÇÃO CÍVEL APELANTE: CHARMILLE MODAS LTDA - ME e outro ADVOGADO: Andre Luis Negreiros De Almeida APELADO: FAZENDA NACIONAL RELATOR(A): Desembargador(a) Federal Paulo Roberto de Oliveira Lima - 2ª Turma JUIZ PROLATOR DA SENTENÇA (1° GRAU): Juiz(a) Federal Gledison Marques Fernandes EMENTA TRIBUTÁRIO. EMBARGOS À EXECUÇÃO FISCAL. REDIRECIONAMENTO. DISSOLUÇÃO IRREGULAR DA PESSOA JURÍDICA. ART. 135, III, DO CTN. POSSIBILIDADE. SÚMULA 435 DO STJ. 1. Presume-se dissolvida irregularmente a empresa que deixar de funcionar no seu domicílio fiscal, sem comunicação aos órgãos competentes, legitimando o redirecionamento da execução fiscal para o sócio gerente. Circunstância que, por si só, já é causa suficientemente apta a atrair a responsabilidade contida no art. 135 do CTN, conforme entendimento já pacificado e consolidado pelo STJ, tendo sido sumulado no verbete de n.º 435 (STJ - primeira seção, D.J. 14/04/2010, DJe 13/05/2010). Caso dos autos, no qual, conforme informado na sentença de primeiro grau, considerou-se a existência de dissolução irregular da empresa em razão de certidão expedida por oficial de justiça, quando da tentativa de citação, no sentido da sua não localização no endereço respectivo. Correto, pois, o redirecionamento do feito na hipótese. 2. O STJ, por meio da sistemática dos recursos repetitivos prevista no art. 543-C do Código de Processo Civil, consolidou o entendimento no sentido de que inexiste ilegalidade na utilização da taxa SELIC, como índice de juros de mora. (STJ, RESP 11111175, Rel.: Ministra DENISE ARRUDA, Órgão Julgador: PRIMEIRA SEÇÃO, Julgado em: 10/06/2009, DJe: 01/07/2009). 3. A multa de mora no patamar de 20% (vinte por cento) do valor da exação devida não se mostra abusiva ou desarrazoada, de maneira que não se há que falar em ofensa aos princípios da capacidade contributiva e do não confisco. 4. Apelação improvida. cmal (PROCESSO: 08057866220204058100, APELAÇÃO CÍVEL, DESEMBARGADOR FEDERAL PAULO ROBERTO DE OLIVEIRA LIMA, 2ª TURMA, JULGAMENTO: 03/06/2025)",
      "consulta_processual_url": "https://www.trf5.jus.br/index.php/consulta-processual-fisico-e-eletronico"
    },
    {
      "numero_processo": "08134259720214058100",
      "classe": "APELAÇÃO CÍVEL",
      "orgao_julgador": "3ª TURMA",
      "data_julgamento": "03/06/2025",
      "relator": "DESEMBARGADOR FEDERAL LUIZ BISPO DA SILVA NETO (CONVOCADO)",
      "ementa": "TRIBUTÁRIO. EXCLUSÃO DA BASE DE CÁLCULO DO PIS E DA COFINS. RECEITAS DECORRENTES DA VENDA DE ATIVO PERMANENTE. BENS INTANGÍVEIS. DESNECESSIDADE DE CONTABILIZAÇÃO. REFORMA PARCIAL DA SENTENÇA. (PROCESSO: 08134259720214058100, APELAÇÃO CÍVEL, DESEMBARGADOR FEDERAL LUIZ BISPO DA SILVA NETO (CONVOCADO)",
      "texto_pdf": "PROCESSO Nº: 0813425-97.2021.4.05.8100 - APELAÇÃO CÍVEL APELANTE: CENTRAL DE NEGOCIOS E COBRANCA LTDA. ADVOGADO: Maria José De Farias Machado e outros APELADO: FAZENDA NACIONAL RELATOR(A): Desembargador(a) Federal Alexandre Luna Freire - 3ª Turma MAGISTRADO CONVOCADO: DESEMBARGADOR(A) FEDERAL LUIZ BISPO DA SILVA NETO JUIZ PROLATOR DA SENTENÇA (1° GRAU): Juiz(a) Federal Ricardo Cunha Porto EMENTA: TRIBUTÁRIO. EXCLUSÃO DA BASE DE CÁLCULO DO PIS E DA COFINS. RECEITAS DECORRENTES DA VENDA DE ATIVO PERMANENTE. BENS INTANGÍVEIS. DESNECESSIDADE DE CONTABILIZAÇÃO. REFORMA PARCIAL DA SENTENÇA. 1. Trata-se de apelação interposta pela CENTRAL DE NEGÓCIOS E COBRANÇA LTDA. contra a sentença proferida em sede de ação submetida ao procedimento comum pelo Juiz Federal da 8ª Vara da Seção Judiciária do Ceará, que julgou improcedente o pedido. 2. Em suas razões, a parte apelante defende o equívoco do lançamento tributário, considerando que não está sujeita à incidência de PIS/COFINS em razão de ter alienado bem de seu ativo permanente. Aduz que, de acordo como o art. 1º da Lei nº 10.833/2003, vigente à época da ocorrência dos fatos em causa, não integram a base de cálculo da COFINS as receitas não-operacionais, decorrentes da venda de bens do ativo permanente. Registra que a controvérsia jurídica gira em torno da exigência, ou não, de registro formal na contabilidade para classificação de bens que, por sua própria natureza, deveriam ser considerados como integrantes do ativo permanente. Sobre o tema, ressalta que o equívoco cometido pelo Julgador reside na consideração de que seria o registro contábil que confere a natureza jurídica de ativo aos bens e direitos da empresa, quando é exatamente o contrário, ou seja, a natureza dos bens e direitos é que deve guiar o registro contábil, haja vista que a contabilidade não cria, apenas reflete uma realidade econômica. Afirma que os efeitos tributários decorrem da realidade econômica do funcionamento da entidade, pelo que é preciso se perquirir a natureza jurídica dos negócios realizados para fins de se identificar a incidência ou não de determinada espécie tributária. Sustenta, ainda, que o fato de não ter havido custos ou despesas que estejam diretamente relacionados à obtenção de bens intangíveis até poderia ter alguma repercussão no cálculo do imposto de renda, se fosse o caso, mas não do PIS e da COFINS, pois não se trata de fator relevante para determinar a aplicação do art. 1.º. §3º, II, da Lei n.º 10.833/2003. Assevera, por fim, o art. 1.º, §3.º, II, da Lei 10.833/2003 não exige a prévia contabilização de custos relativos à aquisição do bem de ativo fixo para que ele possa ser assim considerado, tampouco a não-incidência está condicionada à inexistência de possível ganho de capital na operação. 3. Diante desse quadro, o cerne da matéria devolvida ao conhecimento deste TRF da 5ª Região consiste em perquirir se, para a exclusão de receita proveniente de venda de bens intangíveis da base de cálculo do PIS e da COFINS, faz-se necessária a comprovação de que os referidos bens estejam contabilizados no ativo permanente. 4. Inicialmente, importa consignar que os bens intangíveis são aqueles que não possuem uma forma física (sem substância física), mas têm valor econômico para a empresa, como é o caso dos direitos autorais, marcas, patentes, softwares, desenhos industriais, franquias, entre outros. São bens incorpóreos que constituem as propriedades imateriais de uma empresa. 5. Consoante relato expresso na sentença recorrida, \"A autora afirmou que celebrou contratos objetivando a alienação de bens componentes de seu ativo, notadamente intangível (fundo de comércio e \"marca\"), com a empresa \"LEMON TECNOLOGIA E ARRECADAÇÃO LTDA\". Vendeu toda a estrutura necessária à montagem dos stands ou guichês (móveis e utensílios - balcões de MDF com vidros laterais e frontais, acompanhados de computadores, cofres, impressoras e cadeiras), assim como a titularidade da marca \"Chegue e Pague\", e o seu direito de empreender na mesma atividade, ou seja, negociou cláusula de não concorrência com a adquirente\". 6. Sucede que \"a RFB entendeu que parte dessa venda não envolveria bens do ativo permanente, face à ausência de registro contábil prévio, lançando, assim, PIS e COFINS sobre o valor referente à venda da marca e o compromisso de não concorrência, acrescido de multa de 75%\". 7. A legislação vigente à época da ocorrência dos fatos geradores (Lei nº 10.833/2003) tratava do tema nos seguintes termos: § 3o Não integram a base de cálculo a que se refere este artigo as receitas: (...); II - não-operacionais, decorrentes da venda de ativo permanente. 8. O termo ativo permanente era utilizado para se reportar aos bens e investimentos de longo prazo de uma empresa, sem os quais ela não consegue operar, de modo que são essenciais para o seu funcionamento. 9. Por sua vez, são exemplos de bens do ativo permanente: edifícios, ferramentas, galpões, instalações industriais, maquinário, terrenos, veículos, patentes, marcas etc. 10. A importância do ativo permanente pode ser observada por representar um investimento a longo prazo e aumentar o valor patrimonial da empresa. 11. Diante desse quadro, afigura-se correta a conclusão da fiscalização, em relação ao contrato de Exclusividade Comercial e não concorrência, segundo a qual é devida a inclusão da renda auferida na base de cálculo das contribuições do PIS e COFINS, por não corresponder ao conceito de bem do Ativo Permanente. 12. Ainda sobre o tema, o pronunciamento do juiz sentenciante merece prosperar, ao reconhecer que o contrato de Exclusividade Comercial e não concorrência não constitui uma relação jurídica de compra e venda, muito menos de bem do ativo permanente, cuidando-se seu objeto de uma obrigação de fazer/não fazer. 13. Por sua vez, acerca da matéria remanescente, a norma de exclusão da base de cálculo em exame não exige o registro contábil, haja vista que a sua ausência não é capaz de fulminar o conteúdo econômico subjacente à operação de venda realizada. 14. Significa dizer que os efeitos econômicos da venda dos bens intangíveis (marca), objeto do lançamento do PIS e da COFINS pela RFB, são independentes da circunstância de estarem ou não registrados na contabilidade da empresa. 15. De fato, a contabilização da marca como ativo permanente não possui relevância para a realização da operação de venda de bens intangíveis, de modo que a hipótese de não integração na base de cálculo do PIS e da COFINS em exame não pode ser afastada em decorrência da ausência de registro contábil. 16. Registre-se, ademais, que o § 3º do art. 1º da Lei nº 10.833/2003 trata das hipóteses de não integração da base de cálculo, acarretando a redução do alcance da regra-matriz de incidência em decorrência da limitação imposta à abrangência do seu critério quantitativo. 17. Por outro lado, o art. 1º da lei acima aludida, ao definir a base de cálculo do tributo, expressamente consignou que a receita auferida não guarda qualquer relação com a denominação ou classificação contábil. 18. Disso resulta o reconhecimento de que se a base de cálculo independe da denominação ou classificação, afigura-se de rigor que as hipóteses de não integração a ela relativa (exclusão da base de cálculo) mantenha essa mesma característica, qual seja a dispensa do registro contábil. 19. Melhor dizendo, se todas as receitas integrantes da base de cálculo das contribuições (R) dispensam qualquer relação com a denominação ou classificação contábil, conclui-se que aquelas excluídas desse universo também prescindiam de registro contábil, haja vista que essas receitas apartadas (não-operacionais, decorrentes da venda de ativo permanente - \"r\") mantinham relação de pertinência com o conjunto \"R\". 20. Com efeito, se dessa relação de pertinência decorre que o elemento compõe o conjunto (r pertence a R), forçoso afirmar que a adequação ao universo dos integrantes pressupõe a realização da característica comum dos seus elementos. 21. Nesse contexto, a consectária exclusão das \"receitas não-operacionais decorrentes da venda de ativo permanente\" (\"r\") da base de cálculo das contribuições lançadas denota que a dispensa de qualquer relação com a denominação ou classificação contábil permanece como sua característica elementar. 22. Diante do exposto, desponta evidente que ao exigir o registro contábil prévio como condição indispensável para a exclusão de receita proveniente de venda de bens intangíveis da base de cálculo do PIS e da COFINS a autoridade fiscal estabeleceu restrição que não se amolda ao desenho normativo do tributo, incidindo no descumprimento do pressuposto interpretativo segundo o qual o legislador não \"esconde elefantes em buraco de rato\", ao constituir uma exigência que sequer foi cogitada. 23. Cumpre enfatizar, em arremate, que não compete ao Poder Judiciário acolher interpretação que retire o sentido de regra expressa posta pelo legislador, submetendo ao inteiro arbítrio da RFB a criação de exigência que não se harmoniza com a regra-matriz de incidência dos tributos, conforme visto. 24. Assim, considerando que a exclusão de receita proveniente de venda de bens intangíveis da base de cálculo do PIS e da COFINS não depende da comprovação de que os referidos bens estejam contabilizados no ativo permanente, impõe-se a reforma parcial da sentença. 25. Apelação parcialmente provida. 26. No que concerne ao capítulo relativo à reforma da sentença, afasta-se a aplicação do que prescreve o § 11 do art. 85 do CPC, visto que descaracterizada a ocorrência de pressuposto indispensável à sua incidência, qual seja a dupla sucumbência, sendo de rigor, por outro lado, a inversão dos ônus sucumbenciais e a consequente condenação da UNIÃO (FAZENDA NACIONAL) no pagamento de honorários, arbitrando-os nos percentuais mínimos, dentre aqueles previstos nos incisos I a V do § 3º do art. 85 do CPC, incidentes sobre a quantia correspondente ao valor do proveito econômico obtido. 27. Lado outro, em relação ao capítulo da decisão que confirmou os termos da sentença, impõe-se a majoração em um ponto percentual dos honorários advocatícios fixados na sentença recorrida (de forma que os honorários finais passam a 11% do valor da causa), ante o que dispõe o § 11 do art. 85 do CPC. (PROCESSO: 08134259720214058100, APELAÇÃO CÍVEL, DESEMBARGADOR FEDERAL LUIZ BISPO DA SILVA NETO (CONVOCADO), 3ª TURMA, JULGAMENTO: 03/06/2025)",
      "consulta_processual_url": "https://www.trf5.jus.br/index.php/consulta-processual-fisico-e-eletronico"
    },
    {
      "numero_processo": "08066133520184058200",
      "classe": "APELAÇÃO CÍVEL",
      "orgao_julgador": "7ª TURMA",
      "data_julgamento": "03/06/2025",
      "relator": "DESEMBARGADOR FEDERAL LEONARDO AUGUSTO NUNES COUTINHO",
      "ementa": "PREVIDENCIÁRIO. PROCESSO CIVIL. CUMPRIMENTO DE SENTENÇA. REVISÃO DA RMI. LEI N. 6.423/77. ORTN/OTN. APOSENTADORIA POR INVALIDEZ. INEXIGIBILIDADE DO TÍTULO EXECUTIVO. SENTENÇA MANTIDA. APELAÇÃO IMPROVIDA. (PROCESSO: 08066133520184058200, APELAÇÃO CÍVEL, DESEMBARGADOR FEDERAL LEONARDO AUGUSTO NUNES COUTINHO, 7ª TURMA, JULGAMENTO: 03/06/2025)",
      "texto_pdf": "EMENTA: PREVIDENCIÁRIO. PROCESSO CIVIL. CUMPRIMENTO DE SENTENÇA. REVISÃO DA RMI. LEI N. 6.423/77. ORTN/OTN. APOSENTADORIA POR INVALIDEZ. INEXIGIBILIDADE DO TÍTULO EXECUTIVO. SENTENÇA MANTIDA. APELAÇÃO IMPROVIDA. 1. Trata-se de recurso de apelação interposto por BERNADETE DE LIMA SOARES em face de decisão proferida pelo juízo da 3ª Vara Federal da Seção Judiciária da Paraíba, que extinguiu o cumprimento de sentença sob o fundamento de inexigibilidade do título no qual se funda a execução, tendo em vista a ausência de obrigação de fazer (revisão de benefício) a ser cumprida nos autos, fulminando, ainda, eventual obrigação de pagar, não havendo valores atrasados/retroativos a serem pagos. Sem condenação em honorários advocatícios. 2. Em suas razões, a apelante alega, em síntese, que: 1) teria havido ofensa à coisa julgada formada no processo de origem à revisão, qual seja, o que concedeu a revisão no benefício de aposentadoria por invalidez do falecido; 2) o valor mensal da pensão por morte deveria equivaler a 100% (cem por cento) do valor da aposentadoria por invalidez, a qual foi liquidada no processo de revisão do falecido de nº 200.2006.002.420-1 ou 0002420-88.2006.8.15.2001); 3) o parecer da contadoria, acatado pelo juízo a quo, teria rediscutido o período básico de cálculo (PBC) de 24 salários-de-contribuição anteriores aos 12 últimos pela variação da ORTN/OTN, que já teria sido decidido favoravelmente à autora no processo que motivou o pedido de revisão. 3. Inicialmente, no que se refere ao cabimento do recurso interposto (apelação), considera-se a natureza jurídica da decisão atacada, examinando-se a matéria discutida, o efeito prático do ato impugnado e o cumprimento dos requisitos formais. No caso, verifica-se que a decisão recorrida extinguiu o cumprimento de sentença, sob o fundamento da inexigibilidade do título executivo, sendo cabível a aplicação do princípio da fungibilidade ao caso, viabilizando o conhecimento do apelo interposto. 4. No caso, a recorrente pleiteia o direito à revisão da RMI do seu benefício de pensão por morte com a atualização monetária dos primeiros 24 (vinte e quatro) salários-de-contribuição utilizados no período básico de cálculo pela variação da ORTN/OTN, com base na Lei nº 6.423/77 e em decorrência das decisões judiciais proferidas nos processos 0002420-88.2006.815.2001 e 0739574-65.2007.815.2001, que foram ajuizados pelo instituidor da pensão ainda em vida com objetivo de alterar a RMI da sua aposentadoria por invalidez. 5. Na presente demanda, em que pese a determinação da sentença proferida na fase de conhecimento para que o INSS revisasse a RMI da pensão por morte com a atualização monetária dos salários-de-contribuição pela variação da ORTN/OTN, a autarquia previdenciária alega que a revisão em questão não gerou efeitos práticos na renda inicial da recorrente. Segundo o INSS, \"conforme a legislação vigente na data da DIB do auxílio doença e aposentadoria por invalidez do instituidor (Decreto 83.080) o cálculo dos benefícios por incapacidade era feito apenas com base nos 12 últimos salários sem correção monetária, portanto sendo inaplicável a correção dos 24 salários-de-contribuição anteriores, uma vez que estes não integravam a base de cálculo (...) mesmo se for usado como parâmetro a data de DIB de 01/10/1980, referente à DIB da aposentadoria por invalidez, nesse caso o índice global e final a ser aplicado à RMI original seria na razão de -2,5591% (conforme fls. 04 da OI CJ Nº 01) ou seja, haveria decréscimo do valor de RMI do benefício da parte autora, motivo pelo qual também se configura como inaplicável a aplicação da referida correção nestes casos\" (id. 4058200.12749071). O parecer da contadoria concluiu que não há obrigação de fazer a ser cumprida nos autos, tendo em vista que \"(...) não existiu PBC (Período Básico de Cálculo nem na concessão nem na transformação do benefício (...) o cálculo no qual o autor fundamenta o novo valor do Benefício (R$ 1.369,37) não guarda relação com o objeto do julgado\" (id. 4058200.13334410). 6. Com efeito, verifica-se que a recorrente é beneficiária de pensão por morte desde 21/09/2007, derivada de aposentadoria por invalidez de origem acidentária, que foi concedida ao seu cônjuge em 01/10/1980 . Nesse sentido, o art. 37, inciso I, § 1º, do Decreto nº 83.080/79 (legislação vigente à época da concessão da aposentadoria por invalidez do instituidor da pensão) determinava que: \" Art. 37. O salário-de-benefício corresponde: I - para o auxílio-doença, a aposentadoria por invalidez, a pensão e o auxílio-reclusão, a 1/12 (um doze avos) da soma dos salários-de-contribuição imediatamente anteriores ao mês do afastamento da atividade, até o máximo de 12 (doze), apurados em período não superior a 18 (dezoito) meses; II - para as demais espécies de aposentadoria, 1/36 (um trinta e seis avos) da soma dos salários-de-contribuição imediatamente anteriores ao mês da entrada do requerimento ou do afastamento da atividade, até o máximo de 36 (trinta e seis), apurados em período não superior a 48 meses\". Ademais, para os benefícios de aposentadoria por invalidez, auxílio-doença, pensão e auxílio-reclusão concedidos antes da CF/88, o art. 3º da Lei nº 5.890/73, consolidado no art. 21, I, II e § 1º, do Decreto nº 89.312/84 - CLPS, também determinava que o salário-de-benefício correspondia a 1/12 (um doze avos) da soma dos salários de contribuição dos meses imediatamente anteriores ao do afastamento da atividade, até o máximo de 12 (doze), apurados em período não superior a 18 (dezoito) meses, sem atualização monetária. 7. Nesse concernente, como a legislação anterior à CF/88 não previa a incidência de correção monetária sobre os 12 (doze) últimos salários-de-contribuição anteriores ao afastamento da atividade, utilizados para o cálculo do salário-de-benefício da aposentadoria por invalidez, do auxílio-doença, da pensão e do auxílio-reclusão, inexiste suporte legal para a pretensão da recorrente de atualização monetária dos salários-de-contribuição utilizados no cálculo da aposentadoria por invalidez pela variação da ORTN/OTN, com base na Lei nº 6.423/77. 8. Apelação improvida. Sem condenação em honorários recursais, vez que ausente fixação de verba honorária na instância a quo. (PROCESSO: 08066133520184058200, APELAÇÃO CÍVEL, DESEMBARGADOR FEDERAL LEONARDO AUGUSTO NUNES COUTINHO, 7ª TURMA, JULGAMENTO: 03/06/2025)",
      "consulta_processual_url": "https://www.trf5.jus.br/index.php/consulta-processual-fisico-e-eletronico"
    },
    {
      "numero_processo": "00008517920154058102",
      "classe": "APELAÇÃO CÍVEL",
      "orgao_julgador": "3ª TURMA",
      "data_julgamento": "03/06/2025",
      "relator": "DESEMBARGADOR FEDERAL LUIZ BISPO DA SILVA NETO (CONVOCADO)",
      "ementa": "PROCESSUAL CIVIL E TRIBUTÁRIO. APELAÇÃO. EXECUÇÃO FISCAL. EXTINÇÃO. BAIXO VALOR. TEMA 1184 DO STF. REPERCUSSÃO GERAL. RESOLUÇÃO Nº 547/2024 DO CNJ. EXTINÇÃO. POSSIBILIDADE. RECURSO DESPROVIDO. (PROCESSO: 00008517920154058102, APELAÇÃO CÍVEL, DESEMBARGADOR FEDERAL LUIZ BISPO DA SILVA NETO (CONVOCADO)",
      "texto_pdf": "PROCESSO Nº: 0000851-79.2015.4.05.8102 - APELAÇÃO CÍVEL APELANTE: AGENCIA NACIONAL DE TELECOMUNICACOES - ANATEL APELADO: ASSOCIACAO COMUNITARIA JUNCO - ASCOMJU RELATOR(A): Desembargador(a) Federal Alexandre Luna Freire - 3ª Turma MAGISTRADO CONVOCADO: DESEMBARGADOR(A) FEDERAL LUIZ BISPO DA SILVA NETO JUIZ PROLATOR DA SENTENÇA (1° GRAU): Juiz(a) Federal Fabricio De Lima Borges EMENTA PROCESSUAL CIVIL E TRIBUTÁRIO. APELAÇÃO. EXECUÇÃO FISCAL. EXTINÇÃO. BAIXO VALOR. TEMA 1184 DO STF. REPERCUSSÃO GERAL. RESOLUÇÃO Nº 547/2024 DO CNJ. EXTINÇÃO. POSSIBILIDADE. RECURSO DESPROVIDO. 1. Trata-se de apelação interposta pela AGENCIA NACIONAL DE TELECOMUNICACOES - ANATEL contra sentença proferida pelo juízo da 16ª Vara Federal da SJ/CE que extinguiu o executivo fiscal, sem julgamento do mérito, sob o fundamento de ausência de interesse de agir, com base na tese do Tema 1184 do STF, que trata da possibilidade de extinção de execução fiscal de baixo valor. 2. De acordo com a sentença recorrida, no caso dos autos, o valor originário da execução, no momento do seu ajuizamento, era inferior ao piso de R$ 10.000,00 (dez mil reais) indicado no art. 1º, § 1º, da Resolução CNJ nº 547/2024, e não consta nos autos bens penhorados ou indicação concreta de bens penhoráveis. 3. Em suas razões recursais, a parte apelante alega, em síntese, que: a) conforme Tema 1184/STF, a fixação do parâmetro de baixo valor cabe a cada ente federativo, pois deve ser respeitada a competência constitucional de cada ente federado; b) a recuperação, pela via judicial, de créditos de titularidade das Autarquias e Fundações Públicas federais restou regulamentada pelos 5º a 8º da Portaria Normativa PGF/AGU 51, de 2023; c) estabelecidos limites mínimos pela União em atos normativos regulares, o primeiro requisito de validade da tramitação da execução fiscal (item 1 da tese fixada no Tema 1.184 e art. 1º, § 1º, da Resolução CNJ n. 547, de 2024) revela-se cumprido, não cabendo ao juízo fixar limites diferentes ou deixar de observá-los para a extinção da execução fiscal em curso; d) as balizas para o ajuizamento de execuções fiscais de créditos de titularidade de Autarquias e Fundações Públicas federais não se estabelecem nem podem ser analisadas apenas da perspectiva da arrecadação, tendo em vista que o escopo de tais créditos é extrafiscal, isto é, voltado à punição dos infratores administrativos. 4. No julgamento do Tema 1184 sob a sistemática da repercussão geral (RE 1.355.208/SC), o Supremo Tribunal Federal firmou a seguinte tese: \"1. É legítima a extinção de execução fiscal de baixo valor pela ausência de interesse de agir tendo em vista o princípio constitucional da eficiência administrativa, respeitada a competência constitucional de cada ente federado. 2. O ajuizamento da execução fiscal dependerá da prévia adoção das seguintes providências: a) tentativa de conciliação ou adoção de solução administrativa; e b) protesto do título, salvo por motivo de eficiência administrativa, comprovando-se a inadequação da medida. 3. O trâmite de ações de execução fiscal não impede os entes federados de pedirem a suspensão do processo para a adoção das medidas previstas no item 2, devendo, nesse caso, o juiz ser comunicado do prazo para as providências cabíveis.\" 5. Ao regulamentar a tese fixada pelo STF, o Conselho Nacional de Justiça aprovou a Resolução nº 547, de 22 de fevereiro de 2024, em que determina a extinção das execuções fiscais de valor inferior a R$ 10.000,00 (dez mil reais) quando do ajuizamento, em que não haja movimentação útil há mais de um ano sem citação do executado ou, ainda que citado, não tenham sido localizados bens penhoráveis. O valor citado serve, portanto, de parâmetro para aferir quando se trata de execução de \"baixo valor\". 6. In casu, o valor do crédito perseguido originariamente era inferior de R$ 10.000,00. 7. Com efeito, conforme estabelecido pelo artigo 1º-A da Lei 9.469/1997 e pelo artigo 19-D da Lei 10.522/2002, os créditos das Autarquias e Fundações Públicas federais apresentam notória heterogeneidade, sobretudo em razão da predominância de multas aplicadas no exercício do poder de polícia administrativa. Entretanto, importa destacar que não se discute a possibilidade de ajuizamento da execução fiscal, mas do interesse processual no prosseguimento do feito quando se trata de execução infrutífera. 8. O valor exequendo é abaixo do parâmetro estabelecido pelo Tema 1.184 do STF, possibilitando a extinção do feito, nos termos do precedente obrigatório. Ressalte-se que no recurso de apelação o ente público não discorre sobre a possibilidade de localização de bens do devedor. 9. Nessa perspectiva, a decisão judicial em análise mostra-se em consonância com a legislação aplicável, com a tese firmada pelo STF no Tema 1.184 e com a Resolução CNJ nº 547/2024. A correta aplicação da legislação e do entendimento jurisprudencial garante a segurança jurídica e a previsibilidade das decisões judiciais, contribuindo para a pacificação social e jurisdicional. 10. Desprovimento da Apelação. (PROCESSO: 00008517920154058102, APELAÇÃO CÍVEL, DESEMBARGADOR FEDERAL LUIZ BISPO DA SILVA NETO (CONVOCADO), 3ª TURMA, JULGAMENTO: 03/06/2025)",
      "consulta_processual_url": "https://www.trf5.jus.br/index.php/consulta-processual-fisico-e-eletronico"
    },
    {
      "numero_processo": "08150394020214058100",
      "classe": "APELAÇÃO / REMESSA NECESSÁRIA",
      "orgao_julgador": "3ª TURMA",
      "data_julgamento": "03/06/2025",
      "relator": "DESEMBARGADOR FEDERAL LUIZ BISPO DA SILVA NETO (CONVOCADO)",
      "ementa": "APELAÇÃO. TRIBUTÁRIO. IMUNIDADE. PARÁGRAFO 7º DO ART. 195 DA CRFB/88 (PIS E COFINS). REQUISITOS INSTITUÍDOS POR LEI ORDINÁRIA (LEI Nº 8.212/91 OU LEI Nº 12.101/09). CERTIFICADO DE ENTIDADE BENEFICENTE DE ASSISTÊNCIA SOCIAL (CEBAS). DESNECESSIDADE DE PREVISÃO EM LEI COMPLEMENTAR. RE 566.622/RS. ADI'S 2.028, 2.036, 2.228 E 2.621. ENTIDADE NÃO CERTIFICADA. IMUNIDADE TRIBUTÁRIA NÃO RECONHECIDA. TEMA EM REPERCUSSÃO GERAL Nº 32 DO STF. ADI 4.480/DF. REPETIÇÃO DE INDÉBITO TRIBUTÁRIO. PROCEDIMENTO COMUM. COMPENSAÇÃO OU PRECATÓRIO. APELAÇÃO PARCIALMENTE PROVIDA. (PROCESSO: 08150394020214058100, APELAÇÃO / REMESSA NECESSÁRIA, DESEMBARGADOR FEDERAL LUIZ BISPO DA SILVA NETO (CONVOCADO)",
      "texto_pdf": "PROCESSO Nº: 0815039-40.2021.4.05.8100 - APELAÇÃO / REMESSA NECESSÁRIA APELANTE: FUNDACAO EDSON QUEIROZ ADVOGADO: Gustavo Hitzschky Fernandes Vieira Júnior APELADO: FAZENDA NACIONAL RELATOR(A): Desembargador(a) Federal Alexandre Luna Freire - 3ª Turma MAGISTRADO CONVOCADO: DESEMBARGADOR(A) FEDERAL LUIZ BISPO DA SILVA NETO JUIZ PROLATOR DA SENTENÇA (1° GRAU): Juiz(a) Federal Niliane Meira Lima EMENTA: APELAÇÃO. TRIBUTÁRIO. IMUNIDADE. PARÁGRAFO 7º DO ART. 195 DA CRFB/88 (PIS E COFINS). REQUISITOS INSTITUÍDOS POR LEI ORDINÁRIA (LEI Nº 8.212/91 OU LEI Nº 12.101/09). CERTIFICADO DE ENTIDADE BENEFICENTE DE ASSISTÊNCIA SOCIAL (CEBAS). DESNECESSIDADE DE PREVISÃO EM LEI COMPLEMENTAR. RE 566.622/RS. ADI'S 2.028, 2.036, 2.228 E 2.621. ENTIDADE NÃO CERTIFICADA. IMUNIDADE TRIBUTÁRIA NÃO RECONHECIDA. TEMA EM REPERCUSSÃO GERAL Nº 32 DO STF. ADI 4.480/DF. REPETIÇÃO DE INDÉBITO TRIBUTÁRIO. PROCEDIMENTO COMUM. COMPENSAÇÃO OU PRECATÓRIO. APELAÇÃO PARCIALMENTE PROVIDA. 1. Apelação interposta por FUNDAÇÃO EDSON QUEIROZ contra sentença proferida pelo Juízo da 6ª VARA FEDERAL - CE que julgou procedente, em parte, o pedido autoral veiculado em ação ordinária para o fim de reconhecer o direito da autora à imunidade apenas quanto aos impostos (II e IPI) incidentes na importação dos bens desembaraçados, autorizando a devolução dos valores indevidamente recolhidos a este título, mediante a compensação. 2. Cinge-se a controvérsia em verificar a necessidade de apresentação do Certificado de Entidade Beneficente de Assistência Social (CEBAS) para fins de fruição da imunidade tributária relativa ao PIS e COFINS, bem como a possibilidade de devolução dos valores indevidamente recolhidos a título de II e IPI, mediante compensação ou restituição via precatório, a critério do contribuinte. 3. Após o julgamento das ADI's 2.028, 2.036, 2.228 e 2.621 e do RE 566.622/RS, o STF fixou a tese segundo a qual \"os requisitos para o gozo de imunidade hão de estar previstos em lei complementar\" (RE 566.622/RS), declarando, por outro lado, a inconstitucionalidade, por vício formal, de normas materiais contidas nas Leis 8.212/91 e 9.732/98, e Decretos 2.536/98 e 752/93 - dada a exigência de lei complementar, por força do art. 146, II, da CF -, mantendo, não obstante, a constitucionalidade de normas procedimentais, como a exigência do CEBAS e sua temporalidade (ADI's 2.028, 2.036, 2.228 e 2.621). 4. Do inteiro teor dos julgamentos das ADIs acima aludidas também se extrai o reconhecimento de que o conceito de entidade beneficente de assistência social (art. 195, parágrafo 7º) não é equiparável ao de entidade de assistência social sem fins lucrativos (art. 150, VI, \"c\"), asseverando, outrossim, que a CRFB/88 não reúne elementos discursivos para dar concretização segura ao que se possa entender por modo beneficente de prestar assistência social, sendo a fixação do seu conceito indispensável para garantir que a imunidade do art. 195, § 7º, da CF cumpra a finalidade que lhe é designada pelo texto constitucional. 5. Nesse contexto, a excelsa corte afirmou que a lei complementar é forma somente exigível para a definição do modo beneficente de atuação das entidades de assistência social contempladas pelo art. 195, parágrafo 7º, da CF, especialmente no que se refere à instituição de contrapartidas a serem observadas por elas, ressaltando, por outro lado, que o tratamento de aspectos meramente procedimentais pode ser estabelecido por meio de lei ordinária. Eis, no que importa, excerto do entendimento consagrado no STF sobre o tema: \"Aspectos meramente procedimentais referentes à certificação, fiscalização e controle administrativo continuam passíveis de definição em lei ordinária\". (ADI 2028, Relator(a): Min. JOAQUIM BARBOSA, Relator(a) p/ Acórdão: Min. ROSA WEBER, Tribunal Pleno, julgado em 02/03/2017, ACÓRDÃO ELETRÔNICO DJe-095 DIVULG 05-05-2017 PUBLIC 08-05-2017) 6. Por conseguinte, a interpretação consolidada pelo STF findou por afirmar que as regras procedimentais para o gozo da imunidade tributária, prevista no § 7º do art. 195 da CRFB/88, são aquelas estabelecidas na legislação ordinária, quais sejam, a Lei nº 8.212/91 ou a Lei nº 12.101/09, em suas respectivas vigências, pelo que a ausência do certificado (CEBAS) impede que o contribuinte desfrute das benesses relativas à qualificação de entidade beneficente de assistência social. 7. Registre-se, ademais, que a qualificação da autora como pessoa jurídica de direito privado, sem fins lucrativos, não dispensa a apresentação do certificado (CEBAS) acima aludido, mormente tendo em vista o reconhecimento de que o conceito de entidade beneficente de assistência social (entidade filantrópica) não é idêntico ao de entidade sem fins lucrativos. É dizer, a qualificação da entidade não implica, por si só, o reconhecimento de que se trata de entidade beneficente de assistência social apta a fazer jus à imunidade do § 7º do art. 195 da CRFB/88. Em resumo, o CEBAS nada mais é que exteriorização do benefício da imunidade, de acordo com precedentes do STF. De fato, o gozo da imunidade relativa às entidades de assistência social pressupõe o atendimento às exigências do art. 14 do CTN, bem como dos requisitos previstos na Lei nº 8.212/91 ou a Lei nº 12.101/09, em suas respectivas vigências, que dispõem sobre a certificação das entidades beneficentes de assistência social (CEBAS) e regulam os procedimentos de isenção de contribuições para a seguridade social. 8. Nesse sentido, o Superior Tribunal de Justiça possui jurisprudência firmada no sentido de que as entidades beneficentes devem preencher as condições estabelecidas pela legislação superveniente para fins de renovação do Certificado de Entidade Beneficente de Assistência Social - CEBAS e consequente fruição da imunidade tributária (Súmula 352/STJ), bem como reconhecendo que \"O certificado de entidade beneficente de assistência social (CEBAS), no prazo de sua validade, possui natureza declaratória para fins tributários, retroagindo seus efeitos à data em que demonstrado o cumprimento dos requisitos estabelecidos por lei complementar para a fruição da imunidade\" (Súmula 612/STJ). 9. Significa dizer que as exigências estabelecidas pelo art. 14 do CTN atuam como dado antecedente ao fenômeno jurídico da imunidade (pressuposto), enquanto os requisitos das leis ordinárias se reportam às circunstâncias necessárias e contemporâneas ao seu gozo. Ou seja, o atendimento do art. 14 do CTN pelo contribuinte (pressuposto) gera a presunção da qualidade de entidade beneficente de assistência social, devendo o seu efetivo gozo condicionar-se ao cumprimento dos requisitos estabelecidos pela Lei nº 8.212/91 ou Lei nº 12.101/09, em suas respectivas vigências. Disso resulta o reconhecimento de que os requisitos procedimentais do art. 55 da Lei nº 8.212/91 (à exceção do inciso III), ou do art. 29 da Lei nº 12.101/09 (à exceção do inciso VI), em suas respectivas vigências, por atuar de forma meramente suplementar às exigências previstas no § 7º do art. 195 da CRFB (discriminadas no art. 14 do CTN), não afrontam a diretiva constitucional. 10. Nesse sentido, colhe-se recente precedente da Sétima Turma desta Corte Regional, em composição ampliada: PROCESSO: 08059375720224058100, APELAÇÃO / REMESSA NECESSÁRIA, DESEMBARGADOR FEDERAL FRANCISCO ROBERTO MACHADO, 7ª TURMA, JULGAMENTO: 12/11/2024. Outros precedentes desta Corte Regional: PROCESSO: 00075581620084058100, APELAÇÃO CÍVEL, DESEMBARGADORA FEDERAL DANIELLE SOUZA DE ANDRADE E SILVA CAVALCANTI (CONVOCADA), 1ª TURMA, JULGAMENTO: 12/12/2024; PROCESSO: 08059375720224058100, APELAÇÃO / REMESSA NECESSÁRIA, DESEMBARGADOR FEDERAL FRANCISCO ROBERTO MACHADO, 7ª TURMA, JULGAMENTO: 12/11/2024; (PROCESSO: 08188700420184058100, APELAÇÃO CÍVEL, DESEMBARGADOR FEDERAL FERNANDO BRAGA DAMASCENO, 3ª TURMA, JULGAMENTO: 01/12/2022. 11. Assim, sendo a certificação da condição de entidade beneficente de assistência social (CEBAS) requisito indispensável ao gozo da imunidade do § 7º do art. 195 da CRFB/88, não infirmado pelo entendimento consolidado após o julgamento das ADI's 2.028, 2.036, 2.228 e 2.621 e do RE 566.622/RS, impõe-se afirmar que a sentença recorrida não merece rechaço neste capítulo. 12. No que tange à devolução dos valores indevidamente recolhidos, a controvérsia nos autos relativa à possibilidade de repetição de indébito reconhecida por sentença, por meio de compensação ou restituição por precatório, refere-se apenas aos valores indevidamente recolhidos a título dos impostos cuja imunidade foi reconhecida e que não foram abrangidos pelo montante depositado nos autos nº 0026484-84.2004.4.05.8100. 13. A restituição de valores pagos indevidamente encontra amparo no art. 165 do Código Tributário Nacional (CTN) e no art. 74 da Lei nº 9.430/1996. A Constituição Federal, em seu art. 100, estabelece que as obrigações pecuniárias da Fazenda Pública em virtude de sentença judicial transitada em julgado devem ser liquidadas mediante precatórios, salvo as de pequeno valor. 14. Em se tratando de ação de procedimento comum, contudo, a teor da súmula 461 do STJ, o contribuinte pode optar por receber, por meio de precatório ou por compensação, o indébito tributário certificado por sentença declaratória transitada em julgado. O STF, por ocasião do julgado no RE 1.420.691/SP (TEMA 1262, Repercussão Geral, 21/8/2023), fixou a seguinte tese jurídica: \"Não se mostra admissível a restituição administrativa do indébito reconhecido na via judicial, sendo indispensável a observância do regime constitucional de precatórios, nos termos do art. 100 da Constituição Federal\". 15. Ainda sobre o tema, colhe-se julgado em ação de procedimento comum desta Terceira Turma: \"(...) 30. Por fim, quanto à opção da parte autora entre a compensação e o recebimento do crédito por precatório, não existe óbice ao seu exercício, eis que cabe ao contribuinte munido de título executivo judicial que reconheceu a existência de indébito tributário a escolha da forma de execução do julgado. 31. Em outras palavras, não se cogita que o provimento jurisdicional imponha determinada forma de repetição do indébito, considerando-se que é direito do contribuinte a opção pela restituição dos valores indevidamente recolhidos via precatório ou pela compensação, realizada essa última no âmbito administrativo. 32. Inclusive, esse é o teor da Súmula 461 do STJ, segundo a qual \"o contribuinte pode optar por receber, por meio de precatório ou por compensação, o indébito tributário certificado por sentença declaratória transitada em julgado\". 33. Assim, deve ser assegurado à parte autora, ora apelante, o direito à realização, na seara administrativa, da compensação dos valores indevidamente recolhidos ou, ainda, o exercício da opção pela restituição do referido montante por meio de expedição de precatório. 34. Apelação da parte autora parcialmente provida, apenas para assegurar o exercício da opção pela restituição do indébito por meio de expedição de precatório\" (...) PROCESSO: 08232962520194058100, APELAÇÃO/REMESSA NECESSÁRIA, DESEMBARGADOR FEDERAL LEONARDO RESENDE MARTINS (CONVOCADO), 3ª TURMA, JULGAMENTO: 7/4/2022. 16. Assim, a restituição do indébito, no caso dos autos, poderá se dar por meio de precatório ou compensação (nos termos do art. 170-A do CTN), com atualização pela Taxa Selic, merecendo reparo a sentença quanto a este ponto. 17. Apelação provida em parte para assegurar ao autor/apelante a repetição dos valores indevidamente recolhidos a título II e IPI e reconhecidos na sentença, por meio de compensação ou restituição por precatório, com atualização pela Taxa Selic, e que não foram abrangidos pelo montante depositado nos autos nº 0026484-84.2004.4.05.8100. (PROCESSO: 08150394020214058100, APELAÇÃO / REMESSA NECESSÁRIA, DESEMBARGADOR FEDERAL LUIZ BISPO DA SILVA NETO (CONVOCADO), 3ª TURMA, JULGAMENTO: 03/06/2025)",
      "consulta_processual_url": "https://www.trf5.jus.br/index.php/consulta-processual-fisico-e-eletronico"
    },
    {
      "numero_processo": "08028215220224058000",
      "classe": "APELAÇÃO CÍVEL",
      "orgao_julgador": "3ª TURMA",
      "data_julgamento": "03/06/2025",
      "relator": "DESEMBARGADOR FEDERAL LUIZ BISPO DA SILVA NETO (CONVOCADO)",
      "ementa": "DIREITO PROCESSUAL CIVIL E EXECUÇÃO FISCAL. APELAÇÃO CÍVEL. EXTINÇÃO DE EXECUTIVO FISCAL POR AUSÊNCIA DE INTERESSE DE AGIR. TEMA 1184 DO STF E RESOLUÇÃO CNJ Nº 547/2024. EXECUÇÃO DE BAIXO VALOR. POSSIBILIDADE DE EXTINÇÃO. RECURSO DESPROVIDO. I - Apelação interposta pelo Conselho Regional de Medicina do Estado de Alagoas (CREMAL) contra Sentença que extinguiu o Executivo Fiscal, sem resolução de mérito, com fundamento na ausência de interesse de agir, nos termos do art. 485, VI, do CPC. O crédito exequendo refere-se a anuidades profissionais no valor de R$ 5.098,56 (cinco mil, noventa e oito reais e cinquenta e seis centavos). II - O Juízo de origem entendeu que a Execução Fiscal seria de baixo valor, com fundamento no Tema 1184 do STF e na Resolução CNJ nº 547/2024. O Apelante sustenta que a execução é válida, pois está amparada pela Lei nº 12.514/2011, que disciplina a cobrança de anuidades de Conselhos profissionais, e que a extinção de ofício é vedada pela Súmula 452 do STJ. III - A questão em discussão consiste em saber se o Juízo pode extinguir, de ofício, o executivo fiscal de valor inferior ao limite estabelecido pelo CNJ, com fundamento no Tema 1184 do STF e na Resolução CNJ nº 547/2024, sem o requerimento da Administração Pública. IV - No julgamento do Tema 1184 sob a sistemática da repercussão geral (RE 1.355.208/SC), o Supremo Tribunal Federal firmou a seguinte tese: \"1. É legítima a extinção de execução fiscal de baixo valor pela ausência de interesse de agir tendo em vista o princípio constitucional da eficiência administrativa, respeitada a competência constitucional de cada ente federado. 2. O ajuizamento da execução fiscal dependerá da prévia adoção das seguintes providências: a) tentativa de conciliação ou adoção de solução administrativa; e b) protesto do título, salvo por motivo de eficiência administrativa, comprovando-se a inadequação da medida. 3. O trâmite de ações de execução fiscal não impede os entes federados de pedirem a suspensão do processo para a adoção das medidas previstas no item 2, devendo, nesse caso, o juiz ser comunicado do prazo para as providências cabíveis.\" V - Ao regulamentar a tese fixada pelo STF, o Conselho Nacional de Justiça aprovou a Resolução nº 547, de 22 de fevereiro de 2024, em que determina a extinção das execuções fiscais de valor inferior a R$ 10.000,00 (dez mil reais) quando do ajuizamento, em que não haja movimentação útil há mais de um ano sem citação do executado ou, ainda que citado, não tenham sido localizados bens penhoráveis. O valor citado serve, portanto, de parâmetro para aferir quando se trata de execução de \"baixo valor\". VI - Nos termos do art. 8º da Lei nº 12.514/2011, os Conselhos Profissionais não devem ajuizar execuções fiscais para a cobrança de valores inferiores a cinco vezes o valor da anuidade prevista no inciso I do art. 6º da mesma lei. Considerando que a anuidade para profissionais de nível superior pode ser de até R$ 500,00 (quinhentos reais), o limite mínimo para a propositura da execução fiscal é de R$ 2.500,00 (dois mil e quinhentos reais). VII - In casu, o valor do crédito perseguido originariamente era de R$ 5.098,56 (cinco mil, noventa e oito reais e cinquenta e seis centavos). VIII - \"Para efeito de aplicação do Tema de Repercussão Geral nº 1.184 do STF, é irrelevante o fato de a execução fiscal ter sido proposta por Conselho Profissional, pois a medida que se opera com a aplicação do precedente em debate é a extinção do feito porque frustrada a execução, ante a sua paralisação, baixo valor da dívida e falta de medidas prévias com vistas à satisfação do débito. O julgado invocado não suspende o direito à propositura da execução, haja vista que, sob o entendimento firmado pelo STF, o feito executivo pode ser proposto, mas somente prosseguirá caso se mostre viável. Por outro lado, o art. 8º da Lei nº 12.514/2011 define tão-somente o limite financeiro para propositura do feito executivo por Conselho Profissional, possibilitando o ajuizamento da execução fiscal, desde que a obediência ao limite de propositura esteja aliada a providências prévias de cobrança (item 2 do Tema 1.184 do STF).\" (TRF5 0803564-69.2021.4.05.8300, 7ª Turma, Rel. Des. Federal Frederico Wildson da Silva Dantas, Publ. 15/08/2024). Precedentes das turmas desta Corte Regional: TRF5, 0819459-97.2021.4.05.8000, 1ª Turma, Rel. Des. Federal Roberto Wanderley Nogueira, Publ. 17/10/2024; TRF5 0803564-69.2021.4.05.8300, 7ª Turma, Rel. Des. Federal Frederico Wildson da Silva Dantas, Publ. 15/08/2024). IX - No caso, o Juízo de origem determinou a intimação da parte exequente para, no prazo de 30 (trinta) dias, requerer a suspensão do processo especificando o aludido prazo suspensivo, com vistas a cumprir comprovar a prévia tentativa de conciliação ou adoção de solução administrativa e comprovar o prévio protesto do título ou, alternativamente, outros meios, ficando advertida de que eventual decurso in albis do prazo supracitado implicaria a extinção da execução fiscal sem resolução do mérito, nos termos do art. 485, inciso VI, do CPC, em virtude da ausência de interesse de agir sob o prisma da desnecessidade de intervenção do Poder Judiciário no caso concreto. Apesar da advertência, o(a) exequente permaneceu inerte. X - O valor exequendo é abaixo do parâmetro estabelecido pelo Tema 1.184 do STF, possibilitando a extinção do feito, nos termos do precedente obrigatório e, conforme já exposto, sendo irrelevante o fato de a execução fiscal ter sido proposta por Conselho Profissional. XI - Nessa perspectiva, a decisão judicial em análise mostra-se em consonância com a legislação aplicável, com a tese firmada pelo STF no Tema 1.184 e com a Resolução CNJ nº 547/2024. A correta aplicação da legislação e do entendimento jurisprudencial garante a segurança jurídica e a previsibilidade das decisões judiciais, contribuindo para a pacificação social e jurisdicional. XII - Desprovimento da Apelação. (PROCESSO: 08028215220224058000, APELAÇÃO CÍVEL, DESEMBARGADOR FEDERAL LUIZ BISPO DA SILVA NETO (CONVOCADO)",
      "texto_pdf": "PROCESSO Nº 0802821-52.2022.4.05.8000 - APELAÇÃO CÍVEL ORIGEM: 5ª VARA FEDERAL DA SEÇÃO JUDICIÁRIA DE ALAGOAS APELANTE: CONSELHO REGIONAL DE MEDICINA DO ESTADO DE ALAGOAS ADVOGADO: YVES MAIA DE ALBUQUERQUE APELADO: VICANI - CENTRO MEDICO E REMOCOES LTDA RELATOR: DESEMBARGADOR FEDERAL ALEXANDRE LUNA FREIRE - 3ª TURMA MAGISTRADO CONVOCADO: DESEMBARGADOR(A) FEDERAL LUIZ BISPO DA SILVA NETO EMENTA DIREITO PROCESSUAL CIVIL E EXECUÇÃO FISCAL. APELAÇÃO CÍVEL. EXTINÇÃO DE EXECUTIVO FISCAL POR AUSÊNCIA DE INTERESSE DE AGIR. TEMA 1184 DO STF E RESOLUÇÃO CNJ Nº 547/2024. EXECUÇÃO DE BAIXO VALOR. POSSIBILIDADE DE EXTINÇÃO. RECURSO DESPROVIDO. I - Apelação interposta pelo Conselho Regional de Medicina do Estado de Alagoas (CREMAL) contra Sentença que extinguiu o Executivo Fiscal, sem resolução de mérito, com fundamento na ausência de interesse de agir, nos termos do art. 485, VI, do CPC. O crédito exequendo refere-se a anuidades profissionais no valor de R$ 5.098,56 (cinco mil, noventa e oito reais e cinquenta e seis centavos). II - O Juízo de origem entendeu que a Execução Fiscal seria de baixo valor, com fundamento no Tema 1184 do STF e na Resolução CNJ nº 547/2024. O Apelante sustenta que a execução é válida, pois está amparada pela Lei nº 12.514/2011, que disciplina a cobrança de anuidades de Conselhos profissionais, e que a extinção de ofício é vedada pela Súmula 452 do STJ. III - A questão em discussão consiste em saber se o Juízo pode extinguir, de ofício, o executivo fiscal de valor inferior ao limite estabelecido pelo CNJ, com fundamento no Tema 1184 do STF e na Resolução CNJ nº 547/2024, sem o requerimento da Administração Pública. IV - No julgamento do Tema 1184 sob a sistemática da repercussão geral (RE 1.355.208/SC), o Supremo Tribunal Federal firmou a seguinte tese: \"1. É legítima a extinção de execução fiscal de baixo valor pela ausência de interesse de agir tendo em vista o princípio constitucional da eficiência administrativa, respeitada a competência constitucional de cada ente federado. 2. O ajuizamento da execução fiscal dependerá da prévia adoção das seguintes providências: a) tentativa de conciliação ou adoção de solução administrativa; e b) protesto do título, salvo por motivo de eficiência administrativa, comprovando-se a inadequação da medida. 3. O trâmite de ações de execução fiscal não impede os entes federados de pedirem a suspensão do processo para a adoção das medidas previstas no item 2, devendo, nesse caso, o juiz ser comunicado do prazo para as providências cabíveis.\" V - Ao regulamentar a tese fixada pelo STF, o Conselho Nacional de Justiça aprovou a Resolução nº 547, de 22 de fevereiro de 2024, em que determina a extinção das execuções fiscais de valor inferior a R$ 10.000,00 (dez mil reais) quando do ajuizamento, em que não haja movimentação útil há mais de um ano sem citação do executado ou, ainda que citado, não tenham sido localizados bens penhoráveis. O valor citado serve, portanto, de parâmetro para aferir quando se trata de execução de \"baixo valor\". VI - Nos termos do art. 8º da Lei nº 12.514/2011, os Conselhos Profissionais não devem ajuizar execuções fiscais para a cobrança de valores inferiores a cinco vezes o valor da anuidade prevista no inciso I do art. 6º da mesma lei. Considerando que a anuidade para profissionais de nível superior pode ser de até R$ 500,00 (quinhentos reais), o limite mínimo para a propositura da execução fiscal é de R$ 2.500,00 (dois mil e quinhentos reais). VII - In casu, o valor do crédito perseguido originariamente era de R$ 5.098,56 (cinco mil, noventa e oito reais e cinquenta e seis centavos). VIII - \"Para efeito de aplicação do Tema de Repercussão Geral nº 1.184 do STF, é irrelevante o fato de a execução fiscal ter sido proposta por Conselho Profissional, pois a medida que se opera com a aplicação do precedente em debate é a extinção do feito porque frustrada a execução, ante a sua paralisação, baixo valor da dívida e falta de medidas prévias com vistas à satisfação do débito. O julgado invocado não suspende o direito à propositura da execução, haja vista que, sob o entendimento firmado pelo STF, o feito executivo pode ser proposto, mas somente prosseguirá caso se mostre viável. Por outro lado, o art. 8º da Lei nº 12.514/2011 define tão-somente o limite financeiro para propositura do feito executivo por Conselho Profissional, possibilitando o ajuizamento da execução fiscal, desde que a obediência ao limite de propositura esteja aliada a providências prévias de cobrança (item 2 do Tema 1.184 do STF).\" (TRF5 0803564-69.2021.4.05.8300, 7ª Turma, Rel. Des. Federal Frederico Wildson da Silva Dantas, Publ. 15/08/2024). Precedentes das turmas desta Corte Regional: TRF5, 0819459-97.2021.4.05.8000, 1ª Turma, Rel. Des. Federal Roberto Wanderley Nogueira, Publ. 17/10/2024; TRF5 0803564-69.2021.4.05.8300, 7ª Turma, Rel. Des. Federal Frederico Wildson da Silva Dantas, Publ. 15/08/2024). IX - No caso, o Juízo de origem determinou a intimação da parte exequente para, no prazo de 30 (trinta) dias, requerer a suspensão do processo especificando o aludido prazo suspensivo, com vistas a cumprir comprovar a prévia tentativa de conciliação ou adoção de solução administrativa e comprovar o prévio protesto do título ou, alternativamente, outros meios, ficando advertida de que eventual decurso in albis do prazo supracitado implicaria a extinção da execução fiscal sem resolução do mérito, nos termos do art. 485, inciso VI, do CPC, em virtude da ausência de interesse de agir sob o prisma da desnecessidade de intervenção do Poder Judiciário no caso concreto. Apesar da advertência, o(a) exequente permaneceu inerte. X - O valor exequendo é abaixo do parâmetro estabelecido pelo Tema 1.184 do STF, possibilitando a extinção do feito, nos termos do precedente obrigatório e, conforme já exposto, sendo irrelevante o fato de a execução fiscal ter sido proposta por Conselho Profissional. XI - Nessa perspectiva, a decisão judicial em análise mostra-se em consonância com a legislação aplicável, com a tese firmada pelo STF no Tema 1.184 e com a Resolução CNJ nº 547/2024. A correta aplicação da legislação e do entendimento jurisprudencial garante a segurança jurídica e a previsibilidade das decisões judiciais, contribuindo para a pacificação social e jurisdicional. XII - Desprovimento da Apelação. (PROCESSO: 08028215220224058000, APELAÇÃO CÍVEL, DESEMBARGADOR FEDERAL LUIZ BISPO DA SILVA NETO (CONVOCADO), 3ª TURMA, JULGAMENTO: 03/06/2025)",
      "consulta_processual_url": "https://www.trf5.jus.br/index.php/consulta-processual-fisico-e-eletronico"
    },
    {
      "numero_processo": "08104857420174058400",
      "classe": "APELAÇÃO CÍVEL",
      "orgao_julgador": "4ª TURMA",
      "data_julgamento": "03/06/2025",
      "relator": "DESEMBARGADOR FEDERAL MANOEL DE OLIVEIRA ERHARDT",
      "ementa": "PROCESSUAL CIVIL. EMBARGOS DE DECLARAÇÃO. CONSTITUIÇÃO DE NOVOS CAUSÍDICOS. SUPERVENIÊNCIA DE JULGAMENTO COLEGIADO. AUSÊNCIA DE INTIMAÇÃO DOS ADVOGADOS DO RECORRENTE. NULIDADE. PREJUÍZO À AMPLA DEFESA E AO CONTRADITÓRIO. ACLARATÓRIOS PROVIDOS, COM EFEITOS INFRINGENTES. (PROCESSO: 08104857420174058400, APELAÇÃO CÍVEL, DESEMBARGADOR FEDERAL MANOEL DE OLIVEIRA ERHARDT, 4ª TURMA, JULGAMENTO: 03/06/2025)",
      "texto_pdf": "PROCESSO Nº: 0810485-74.2017.4.05.8400 - APELAÇÃO CÍVEL APELANTE: FOSS & CONSULTORES LTDA ADVOGADO: Jose Willamy De Medeiros Costa APELADO: CAIXA ECONOMICA FEDERAL - CEF ADVOGADO: Rogerio William Barboza De Oliveira RELATOR(A): Desembargador(a) Federal Manoel de Oliveira Erhardt - 4ª Turma JUIZ PROLATOR DA SENTENÇA (1° GRAU): Juiz(a) Federal Magnus Augusto Costa Delgado EMENTA PROCESSUAL CIVIL. EMBARGOS DE DECLARAÇÃO. CONSTITUIÇÃO DE NOVOS CAUSÍDICOS. SUPERVENIÊNCIA DE JULGAMENTO COLEGIADO. AUSÊNCIA DE INTIMAÇÃO DOS ADVOGADOS DO RECORRENTE. NULIDADE. PREJUÍZO À AMPLA DEFESA E AO CONTRADITÓRIO. ACLARATÓRIOS PROVIDOS, COM EFEITOS INFRINGENTES. 1. Cuida-se de embargos de declaração opostos por Foss & Consultores LTDA em face de acórdão da Quarta Turma que negou provimento à sua apelação, para manter sentença que julgou improcedentes os pedidos autorais, consistentes na condenação da ré \"a ressarcir, em dobro, os valores indevidamente descontados após a fase da conclusão da obra\", bem como na compensação por danos morais. 2. O embargante narra que \"em 18/01/2023, por intermédio da petição de id. 4050000.35828619, o advogado José Willamy de Medeiros Costa informou a renúncia do seu mandato e, em 27/01/2023, os atuais procuradores da embargante atravessaram aos autos a nova procuração de id. 4050000.35950348. Ocorre que, em 27/02/2023, a intimação da inclusão do presente feito na sessão virtual do dia 28/03/2023 foi, por equívoco, dirigida exclusivamente ao antigo advogado da embargante, inquinando o referido ato de nulidade insanável, assim como o próprio julgamento [...]. A ausência do nome dos novos advogados do embargante na intimação da pauta de julgamento de sua apelação - impedindo-os, assim, de manifestar interesse na realização de sustentação oral -, encerra circunstância que, induvidosamente, impõe o reconhecimento da nulidade da referida intimação\". 3. Compulsando os autos, observa-se que Holanda & Medeiros Advogados e Consultores Associados e José Willamy de Medeiros Costa, então representantes de Foss & Consultores LTDA, apresentaram renúncia ao mandato (Id. 4050000.35828619). Em seguida, Foss & Consultores LTDA juntou instrumento particular de procuração, constituindo e requerendo a habilitação de seus novos procuradores judiciais (Id. 4050000.35950348). Após, o feito foi incluído na sessão virtual do dia 28/03/2023 da Quarta Turma. 4. Entretanto, por equívoco, a intimação da pauta do respectivo julgamento colegiado recaiu apenas sobre os antigos causídicos, sem qualquer referência aos novos patronos do recorrente. 5. Nesse contexto, já se manifestou o Superior Tribunal de Justiça: \"configura nulidade absoluta, por cerceamento do direito de defesa, a intimação realizada em nome de advogado que, em momento processual anterior, substabeleceu, sem reservas, os poderes conferidos pela parte a novos causídicos\" (AgInt no REsp 1.402.939/SP, Rel. Ministro GURGEL DE FARIA, PRIMEIRA TURMA, DJe 6/6/2019). 6. Sendo assim, presente prejuízo à produção da defesa, há de se acolher a insurgência, pelo que se dá provimento aos embargos declaratórios para anular o julgamento proferido na sessão de julgamento virtual de 28/03/2023, determinando-se o cadastramento dos causídicos constantes na petição de Id. 4050000.35950348 e, ato contínuo, a inclusão do presente feito em nova pauta ordinária ou telepresencial. 7. Embargos de declaração providos, com efeitos infringentes. LL (PROCESSO: 08104857420174058400, APELAÇÃO CÍVEL, DESEMBARGADOR FEDERAL MANOEL DE OLIVEIRA ERHARDT, 4ª TURMA, JULGAMENTO: 03/06/2025)",
      "consulta_processual_url": "https://www.trf5.jus.br/index.php/consulta-processual-fisico-e-eletronico"
    },
    {
      "numero_processo": "08015290820224058202",
      "classe": "APELAÇÃO CÍVEL",
      "orgao_julgador": "7ª TURMA",
      "data_julgamento": "03/06/2025",
      "relator": "DESEMBARGADOR FEDERAL LEONARDO HENRIQUE DE CAVALCANTE CARVALHO",
      "ementa": "PREVIDENCIÁRIO. APOSENTADORIA POR IDADE DE SEGURADO ESPECIAL. IDADE MÍNIMA RESPEITADA. INÍCIO DE PROVA MATERIAL CORROBORADO PELA PROVA TESTEMUNHAL. REQUISITOS SATISFEITOS. TERMO INICIAL. JUROS E CORREÇÃO MONETÁRIA. HONORÁRIOS ADVOCATÍCIOS. APELAÇÃO PROVIDA. PROCEDÊNCIA DO PEDIDO. (PROCESSO: 08015290820224058202, APELAÇÃO CÍVEL, DESEMBARGADOR FEDERAL LEONARDO HENRIQUE DE CAVALCANTE CARVALHO, 7ª TURMA, JULGAMENTO: 03/06/2025)",
      "texto_pdf": "PROCESSO Nº: 0801529-08.2022.4.05.8202 - APELAÇÃO CÍVEL APELANTE: DIVANILDA ABILIO DE SOUSA ADVOGADO: Leandra Ramos De Figueiredo e outro APELADO: INSTITUTO NACIONAL DO SEGURO SOCIAL - INSS RELATOR(A): Desembargador(a) Federal Leonardo Henrique de Cavalcante Carvalho - 7ª Turma JUIZ PROLATOR DA SENTENÇA (1° GRAU): Juiz(a) Federal Andre Vieira De Lima EMENTA: PREVIDENCIÁRIO. APOSENTADORIA POR IDADE DE SEGURADO ESPECIAL. IDADE MÍNIMA RESPEITADA. INÍCIO DE PROVA MATERIAL CORROBORADO PELA PROVA TESTEMUNHAL. REQUISITOS SATISFEITOS. TERMO INICIAL. JUROS E CORREÇÃO MONETÁRIA. HONORÁRIOS ADVOCATÍCIOS. APELAÇÃO PROVIDA. PROCEDÊNCIA DO PEDIDO. 1. Trata-se de apelação interposta por DIVANILDA ABÍLIO DE SOUSA em face de sentença proferida pelo Juízo da 8ª Vara Federal da Seção Judiciária da Paraíba, que julgou improcedente o pedido de concessão de aposentadoria por idade de segurado especial, sob o fundamento de que a apelante não possuía a qualidade de segurado especial na época em que completou o requisito etário e/ou apresentou o primeiro ou o segundo requerimento administrativo. A sentença também condenou a apelante ao pagamento de honorários advocatícios, fixados em 10% sobre o valor da causa (R$ 93.324,00), com exigibilidade suspensa em razão da gratuidade de justiça deferida. 2. Em suas razões recursais, a apelante argumentou que: 1) a sentença recorrida desconsiderou diversas provas documentais que comprovam o exercício da atividade rural no período em que foram cumpridos os requisitos para a concessão da aposentadoria rural e da data do requerimento administrativo (DER); 2) conforme a CTPS e o extrato CNIS, nunca houve vínculo urbano, sendo que exerceu atividade de agricultura familiar desde muito jovem; 3) a prova testemunhal foi desconsiderada. 3. O ponto central da presente demanda é verificar se a apelante comprovou ou não sua condição de segurada especial, para fins de concessão da aposentadoria rural por idade. A concessão de aposentadoria por idade ao trabalhador rural depende do cumprimento dos requisitos estabelecidos nos parágrafos 2º e 3º do artigo 48 da Lei nº 8.213/91, quais sejam: completar 60 (sessenta) anos de idade para os homens e 55 (cinquenta e cinco) anos para as mulheres, além de comprovar o efetivo exercício de atividade rural, mesmo que de forma descontínua, no período imediatamente anterior ao pedido do benefício. 4. Em relação ao requisito etário, observa-se que, na data do requerimento administrativo (05/05/2021), a apelante já havia completado 55 anos, conforme consta em seu documento de identidade (data de nascimento: 14/11/1960), atendendo, portanto, ao disposto no artigo 201, §7º, II, da Constituição Federal e no artigo 48, §1º, da Lei nº 8.213/91. 5. Em relação ao requisito início de prova material, foram apresentados os seguintes documentos: 1) Carta de indeferimento do INSS que consta indício de atividade rural, do ano de 2021; 2) declaração eleitoral emitida em 05/05/2021, com ocupação autodeclarada de agricultor; 3) autodeclaração de atividade rural referente aos períodos de 25/08/1986 a 05/03/2000 e 04/05/2021 a 18/03/2022; 4) atas de reuniões de produtores rurais dos anos de 1995, 2001 e 2006; 5) Comprovante de cadastro no programa governamental de emergência - 1999; 6) Ficha de associação dos produtores rurais - 05/03/2000; 7) Declaração de Aptidão Pronaf - emitidas em 2014; 2017-2019 e 2020-2022. 8) Cadastro domiciliar de saúde - 2000, 2012 e 2013; 9) Declaração STR - período homologado -2000 - 2018; 10) Comprovante do Programa de Distribuição de sementes - 2014- 2019; 11) Contrato de Parceria 2000 - 2016, 2020-2025; 12) Programa de Distribuição de sementes - 2014- 2019; 13) Comprovante de compra de produto agrícola - 2015; 14) Recibo de Garantia Safra - 2015-2016; 15) Carteira sindical- STRSanta Inês - 2015; 16) Vigilância sanitária - Estado da PB - 2015 - 2016; 17) Ficha Agropecuária - 2016; 18) Empréstimo Banco do Nordeste - 2016; 19) Escritura Pública - ITR. 6. Essa Turma Julgadora já decidiu, em hipótese semelhante, que a garantia SAFRA e a Declaração de Aptidão Pronaf, trazidas pela autora, são documentos aptos à satisfação do requisito de início de prova material. Precedente: PROCESSO: 00087369420178060122, APELAÇÃO CÍVEL, DESEMBARGADOR FEDERAL FREDERICO WILDSON DA SILVA DANTAS, 7ª TURMA, JULGAMENTO: 18/06/2024. 7. Quanto ao depoimento pessoal e à prova testemunhal, eles também se revelaram suficientes para sustentar as alegações da apelante. Em audiência, a autora afirmou que desenvolve atividade de agricultura no Sítio Quixabeira, pertencente ao Sr. Luis Pereira, local onde também reside. Além disso, a compleição da autora é condizente com características típicas da pessoa que exerce labor no campo, exposta ao sol. 8. A testemunha José Pereira dos Reis, por sua vez, corroborou com as informações fornecidas pela requerente, trazendo fatos consistentes que substanciam a versão apresentada. Ressalte-se, ainda, que a advogada da autora dispensou duas testemunhas. 9. Dessa forma, verifica-se que restou comprovada a qualidade de segurada especial da recorrente, durante o período de carência (DER - 05/05/2021), para fins de concessão da aposentadoria por idade rural. 10. Fixa-se o termo inicial da condenação no segundo requerimento administrativo (DER - 05/05/2021), com correção monetária e juros de mora em consonância com o Manual de Cálculos da Justiça Federal. 11. Em virtude da inversão do ônus da sucumbência, condena-se o INSS em honorários advocatícios de 10% (dez por cento) sobre o valor da condenação, nos termos do art. 85, parágrafo 3º, I do CPC. 12. Apelação provida para julgar procedente o pedido de aposentadoria rural por idade. [16.2] (PROCESSO: 08015290820224058202, APELAÇÃO CÍVEL, DESEMBARGADOR FEDERAL LEONARDO HENRIQUE DE CAVALCANTE CARVALHO, 7ª TURMA, JULGAMENTO: 03/06/2025)",
      "consulta_processual_url": "https://www.trf5.jus.br/index.php/consulta-processual-fisico-e-eletronico"
    },
    {
      "numero_processo": "08057831920204058000",
      "classe": "APELAÇÃO CRIMINAL",
      "orgao_julgador": "7ª TURMA",
      "data_julgamento": "03/06/2025",
      "relator": "DESEMBARGADOR FEDERAL LEONARDO HENRIQUE DE CAVALCANTE CARVALHO",
      "ementa": "PENAL. APELAÇÃO CRIMINAL. USO DE DOCUMENTO FALSO (ART. 304 C/C ART. 297 DO CP). CARTEIRA NACIONAL DE HABILITAÇÃO. APRESENTAÇÃO A POLICIAIS RODOVIÁRIOS FEDERAIS. MATERIALIDADE E AUTORIA COMPROVADAS. DOLO CONFIGURADO. ERRO DE TIPO NÃO CARACTERIZADO. DISPENSABILIDADE DE LAUDO PERICIAL. ATENUANTE DE CONFISSÃO ESPONTÂNEA NÃO RECONHECIDA. MANUTENÇÃO DA CONDENAÇÃO. DESPROVIMENTO. (PROCESSO: 08057831920204058000, APELAÇÃO CRIMINAL, DESEMBARGADOR FEDERAL LEONARDO HENRIQUE DE CAVALCANTE CARVALHO, 7ª TURMA, JULGAMENTO: 03/06/2025)",
      "texto_pdf": "PROCESSO Nº: 0805783-19.2020.4.05.8000 - APELAÇÃO CRIMINAL APELANTE: JOSE ADILSON DA SILVA REPRESENTANTE: DEFENSORIA PÚBLICA DA UNIÃO APELADO: MINISTÉRIO PÚBLICO FEDERAL RELATOR(A): Desembargador(a) Federal Leonardo Henrique de Cavalcante Carvalho - 7ª Turma JUIZ PROLATOR DA SENTENÇA (1° GRAU): Juiz(a) Federal Frederico Wildson Da Silva Dantas EMENTA: PENAL. APELAÇÃO CRIMINAL. USO DE DOCUMENTO FALSO (ART. 304 C/C ART. 297 DO CP). CARTEIRA NACIONAL DE HABILITAÇÃO. APRESENTAÇÃO A POLICIAIS RODOVIÁRIOS FEDERAIS. MATERIALIDADE E AUTORIA COMPROVADAS. DOLO CONFIGURADO. ERRO DE TIPO NÃO CARACTERIZADO. DISPENSABILIDADE DE LAUDO PERICIAL. ATENUANTE DE CONFISSÃO ESPONTÂNEA NÃO RECONHECIDA. MANUTENÇÃO DA CONDENAÇÃO. DESPROVIMENTO. 1. Apelação interposta contra sentença, proferida em 17/12/2021, que julgou procedente a denúncia para condenar JOSÉ ADILSON DA SILVA pelo delito tipificado no artigo 304 c/c art. 297 do Código Penal, às penas de 2 (dois) anos de reclusão, em regime de cumprimento inicialmente aberto, substituída por duas restritivas de direitos (prestação pecuniária no valor de um salário-mínimo e prestação de serviços à comunidade), e 10 dias-multa, no valor de 1/30 do salário-mínimo vigente à época dos fatos. 2. Diz a denúncia, inicialmente oferecida pelo Ministério Público Estadual (recebida em 10/09/2014) e posteriormente ratificada pelo Ministério Público Federal (recebida em 28/08/2020), que o acusado, no dia 12/08/2014, apresentou Carteira Nacional de Habilitação (CNH) falsa de nº 03809157266 a agentes da Polícia Rodoviária Federal, durante abordagem na rodovia BR 101, km 75, Rio Largo/AL. A falsidade do documento foi constatada após consulta ao sistema central da PRF e à Rede INFOSEG do Ministério da Justiça, que confirmaram a inexistência de registro de CNH em nome do acusado. 3. Em suas razões recursais, aduz a defesa: a) inexistência de dolo específico, pois o acusado não tinha ciência da falsidade do documento; b) ocorrência de erro de tipo determinado por terceiro, uma vez que o acusado pagou R$ 1.700,00 (mil e setecentos reais) a uma pessoa chamada Cícero Lima para obtenção do documento que acreditava ser autêntico; c) insuficiência probatória para condenação, ante a ausência de laudo pericial do documento supostamente falsificado; d) aplicação da teoria da perda de uma chance probatória; e) reconhecimento da atenuante da confissão espontânea; f) consideração do baixo grau de instrução do acusado; g) consideração do fato de o acusado ter se dirigido voluntariamente ao local onde havia policiais. 4. A proposta de Acordo de Não Persecução Penal foi rejeitada pelo acusado. 5. A competência para processamento e julgamento do feito foi corretamente fixada na Justiça Federal, com fundamento na Súmula 546 do STJ, que estabelece: \"A competência para processar e julgar o crime de uso de documento falso é firmada em razão da entidade ou órgão ao qual foi apresentado o documento público, não importando a qualificação do órgão expedidor.\" 6. A materialidade e autoria do delito encontram-se demonstradas pelo conjunto probatório, especialmente pelos depoimentos dos policiais rodoviários federais que realizaram a abordagem, pela consulta à Rede INFOSEG que comprovou a inexistência de registro de CNH em nome do acusado e pela própria admissão do réu de que adquiriu o documento através de meios não convencionais. 7. A configuração do crime de uso de documento falso (art. 304 do CP) exige apenas o dolo genérico, consistente na vontade livre e consciente de utilizar documento falsificado com conhecimento da falsidade. No caso em apreço, o dolo resta evidenciado pelo fato de o acusado ter adquirido a CNH mediante pagamento a terceiro particular, sem se submeter aos procedimentos regulares exigidos para emissão do documento (aulas teóricas e práticas, exames, etc.). 8. Não se sustenta a alegação de erro de tipo determinado por terceiro. O acusado, na condição de mototaxista, ou seja, profissional do setor de transportes de passageiros, não poderia desconhecer os trâmites burocráticos para obtenção da CNH. O fato de ter optado por adquirir o documento de forma irregular, mediante pagamento a terceiro, sem realizar os procedimentos legalmente exigidos, demonstra ciência da ilicitude da conduta. 9. A alegação de baixo grau de instrução não tem o condão de afastar o dolo na conduta do agente. A própria profissão exercida pelo réu (mototaxista) pressupõe o conhecimento das regras e procedimentos para habilitação de condutores, sendo inviável que desconhecesse a necessidade de realização de aulas e exames para obtenção regular da CNH. 10. O fato de o acusado ter se dirigido voluntariamente ao local onde havia policiais e apresentado o documento sem hesitação não afasta, por si só, o dolo na conduta. Esse comportamento pode indicar apenas a confiança na aparente autenticidade do documento falsificado, não sendo suficiente para elidir os demais elementos probatórios que evidenciam a ciência da falsidade. 11. A ausência de laudo pericial não compromete a comprovação da materialidade delitiva, conforme pacífica jurisprudência do Superior Tribunal de Justiça, que admite a demonstração da falsidade por outros meios de prova. No caso concreto, a consulta aos sistemas oficiais que atestaram a inexistência de registro da CNH é prova suficiente da falsidade do documento apresentado. Nesse sentido: \"a ausência de perícia não acarreta, por si só, nulidade do feito, pois se mostra desnecessária a realização de exame pericial quando a falsidade pode ser verificada por outros meios de prova\" (AGARESP 1040096, Rel. Min. JOEL ILAN PACIORNIK, STJ - Quinta Turma, DJE: 28/04/2017). 12. Não há que se falar em aplicação da teoria da perda de uma chance probatória, ume vez que apenas é cabível quando a acusação deixar de produzir todas as provas essenciais para a elucidação dos fatos, capazes de, em tese, levar à absolvição do réu ou confirmar a narrativa acusatória caso produzidas. No caso concreto, o acervo probatório dos autos é suficiente para a formação do convencimento do julgador, com a demonstração inequívoca da materialidade e autoria delitivas. A produção de prova pericial, cuja ausência é alegada pela defesa, não seria determinante para o deslinde da causa, considerando os demais elementos de convicção disponíveis. 13. Não se reconhece a atenuante da confissão espontânea, uma vez que o acusado apenas admitiu ter adquirido o documento mediante pagamento a terceiro, sem, contudo, confessar que tinha conhecimento da falsidade. Ademais, o fato de ter recusado proposta de acordo de não persecução penal, que exigiria confissão, corrobora a ausência de confissão plena. 14. Quanto à dosimetria da pena, verifica-se que foi fixada no mínimo legal (2 anos de reclusão), considerando-se a inexistência de circunstâncias judiciais desfavoráveis, não havendo reparo a ser feito. 15. Apelação desprovida, mantida a condenação em todos os seus termos. [13] (PROCESSO: 08057831920204058000, APELAÇÃO CRIMINAL, DESEMBARGADOR FEDERAL LEONARDO HENRIQUE DE CAVALCANTE CARVALHO, 7ª TURMA, JULGAMENTO: 03/06/2025)",
      "consulta_processual_url": "https://www.trf5.jus.br/index.php/consulta-processual-fisico-e-eletronico"
    }
  ]
}