{
  "2025": [
    {
      "numero_processo": "08004256920224058205",
      "classe": "APELAÇÃO CRIMINAL",
      "orgao_julgador": "1ª TURMA",
      "data_julgamento": "03/07/2025",
      "relator": "DESEMBARGADOR FEDERAL EDVALDO BATISTA DA SILVA JÚNIOR",
      "ementa": "PENAL. PROCESSUAL PENAL. SENTENÇA ABSOLUTÓRIA. APELO INTERPOSTO PELA ACUSAÇÃO. DENÚNCIA DE PRÁTICA DO DELITO LICITATÓRIO PREVISTO NA ANTIGA LEI Nº 8.666/93. DESMEMBRAMENTO DA AÇÃO PENAL ORIGINÁRIA DE AMPLO ESPECTRO: ENVOLVIMENTO DE AGENTES POLÍTICOS - PREFEITOS - SERVIDORES MUNICIPAIS, EMPRESÁRIOS, E PARTICULARES COM VÍNCULOS DE PARENTESCO ENTRE SI. FISCALIZAÇÃO ENCETADA, PRINCIPALMENTE, PELA CONTROLADORIA GERAL DA UNIÃO - CGU SOBRE IRREGULARIDADES EM CONTRATOS PÚBLICOS FIRMADOS ENTRE AS MUNICIPALIDADES E LOCADORAS DE VEÍCULOS PARA PRESTAR SERVIÇOS DE TRANSPORTE ESCOLAR - \"OPERAÇÃO VEICULAÇÃO\". OBJETO DESTA PERSECUÇÃO RESTRITO A TÓPICO ESPECÍFICO DA PEÇA ACUSATÓRIA - \"FATO 07 - FRAUDE AO PREGÃO PRESENCIAL Nº 003/2015/PM DE EMAS/PB\". ESCORREITA ABSOLVIÇÃO, ARRIMADA NO ART. 386, VII, DO CÓDIGO DE PROCESSO PENAL, DIANTE DA INEXISTÊNCIA DE PROVA IRREFUTÁVEL PARA ALICERÇAR CONDENAÇÃO. AUSENTE A DEMONSTRAÇÃO DO OBRIGATÓRIO ANIMUS - ELEMENTO SUBJETIVO DO INJUSTO PENAL LICITATÓRIO - DOS ACUSADOS EM FRUSTRAR O CARÁTER COMPETITIVO DO CERTAME. IRREGULARIDADES PROCEDIMENTAIS - \"DESORGANIZAÇÃO ADMINISTRATIVA\" - QUE NÃO DEVEM SER TRANSMUTADAS, OBRIGATORIAMENTE, EM ILÍCITO PENAL, À MÍNGUA DE PROVA - EXTREME DE DUBIEDADES - DE CONLUIO E AJUSTE DOS ACUSADOS VOLTADOS A FRAUDAR A REGULAR COMPETITIVIDADE DO PREGÃO EM COMENTO. IMPROCEDÊNCIA DA CORRESPONDENTE AÇÃO CIVIL PÚBLICA DE IMPROBIDADE ADMINISTRATIVA - MANTIDA NESTE REGIONAL -, PELOS MESMOS FATOS OBJETO DESTA PERSECUÇÃO PENAL. MANTIDA A SENTENÇA ABSOLUTÓRIA. APELO MINISTERIAL IMPROVIDO. (PROCESSO: 08004256920224058205, APELAÇÃO CRIMINAL, DESEMBARGADOR FEDERAL EDVALDO BATISTA DA SILVA JÚNIOR, 1ª TURMA, JULGAMENTO: 03/07/2025)",
      "texto_pdf": "PROCESSO Nº: 0800425-69.2022.4.05.8205 - APELAÇÃO CRIMINAL APELANTE: MINISTÉRIO PÚBLICO FEDERAL APELADO: CARLOS ALEXANDRE FERNANDES MALTA E OUTROS ADVOGADO: FRANCISCO DE ASSIS REMIGIO II E OUTROS JUIZ PROLATOR DA SENTENÇA (1° GRAU): JUIZ(A) FEDERAL THIAGO BATISTA DE ATAIDE. 14ª VF/PB. RELATOR(A): DESEMBARGADOR(A) FEDERAL EDVALDO BATISTA DA SILVA JÚNIOR - 1ª TURMA EMENTA: PENAL. PROCESSUAL PENAL. SENTENÇA ABSOLUTÓRIA. APELO INTERPOSTO PELA ACUSAÇÃO. DENÚNCIA DE PRÁTICA DO DELITO LICITATÓRIO PREVISTO NA ANTIGA LEI Nº 8.666/93. DESMEMBRAMENTO DA AÇÃO PENAL ORIGINÁRIA DE AMPLO ESPECTRO: ENVOLVIMENTO DE AGENTES POLÍTICOS - PREFEITOS - SERVIDORES MUNICIPAIS, EMPRESÁRIOS, E PARTICULARES COM VÍNCULOS DE PARENTESCO ENTRE SI. FISCALIZAÇÃO ENCETADA, PRINCIPALMENTE, PELA CONTROLADORIA GERAL DA UNIÃO - CGU SOBRE IRREGULARIDADES EM CONTRATOS PÚBLICOS FIRMADOS ENTRE AS MUNICIPALIDADES E LOCADORAS DE VEÍCULOS PARA PRESTAR SERVIÇOS DE TRANSPORTE ESCOLAR - \"OPERAÇÃO VEICULAÇÃO\". OBJETO DESTA PERSECUÇÃO RESTRITO A TÓPICO ESPECÍFICO DA PEÇA ACUSATÓRIA - \"FATO 07 - FRAUDE AO PREGÃO PRESENCIAL Nº 003/2015/PM DE EMAS/PB\". ESCORREITA ABSOLVIÇÃO, ARRIMADA NO ART. 386, VII, DO CÓDIGO DE PROCESSO PENAL, DIANTE DA INEXISTÊNCIA DE PROVA IRREFUTÁVEL PARA ALICERÇAR CONDENAÇÃO. AUSENTE A DEMONSTRAÇÃO DO OBRIGATÓRIO ANIMUS - ELEMENTO SUBJETIVO DO INJUSTO PENAL LICITATÓRIO - DOS ACUSADOS EM FRUSTRAR O CARÁTER COMPETITIVO DO CERTAME. IRREGULARIDADES PROCEDIMENTAIS - \"DESORGANIZAÇÃO ADMINISTRATIVA\" - QUE NÃO DEVEM SER TRANSMUTADAS, OBRIGATORIAMENTE, EM ILÍCITO PENAL, À MÍNGUA DE PROVA - EXTREME DE DUBIEDADES - DE CONLUIO E AJUSTE DOS ACUSADOS VOLTADOS A FRAUDAR A REGULAR COMPETITIVIDADE DO PREGÃO EM COMENTO. IMPROCEDÊNCIA DA CORRESPONDENTE AÇÃO CIVIL PÚBLICA DE IMPROBIDADE ADMINISTRATIVA - MANTIDA NESTE REGIONAL -, PELOS MESMOS FATOS OBJETO DESTA PERSECUÇÃO PENAL. MANTIDA A SENTENÇA ABSOLUTÓRIA. APELO MINISTERIAL IMPROVIDO. 1.Depreende-se que a presente persecução penal, originariamente processada perante esta Corte Regional devido à prerrogativa de foro especial reconhecida, à época, em prol de alguns dos codenunciados, teve o desmembramento dos autos (Ação Penal nº 0002058-38.2016.4.05.0000, derivada das investigações emanadas da \"Operação Veiculação\") operado pela proclamação de decisum na origem, em 04 (quatro) processos criminais, restando o espectro da presente Ação Penal nº 0800425-69.2022.4.05.8205 limitado, tão-somente, ao objeto indicado no subtópico contido na Denúncia, como sendo, \"FATO 07 - Fraude ao Pregão Presencial nº 003/2015/PM de Emas/PB\". 2. Restringe-se, pois, o espectro desta Ação Penal nº 0800425-69.2022.4.05.8205 à apuração da prática, em tese, das condutas relacionadas ao crime licitatório previsto no art. 90, da Lei nº 8.666/93, cuja síntese das imputações - \"FATO 07\" - lançadas em desfavor dos codenunciados, ora apelados, foi assim sintetizada pelo juízo de primeiro grau, verbis: \"Aduz o MPF que, no período de 03 de janeiro a 20 de janeiro de 2015, J.W.S.M. (então prefeito de Emas/PB), R.G.C.S. (proprietário da empresa contratada), C.A.M. (proprietário da empresa contratada) e E.R.A.(pregoeiro) fraudaram, mediante ajuste e combinação, o caráter competitivo do Pregão Presencial nº 003/2015 (7º fato), com o fim de possibilitar vantagem para a organização criminosa, mediante a contratação da empresa M.L., para prestar serviços de locação de veículos à Prefeitura Municipal de Emas-PB.\" 3.Sustenta, em síntese, o apelo ministerial a necessidade de reforma, in totum, do decreto absolutório, por entender como mais que satisfatório o plexo das provas indicadas na peça acusatória e das demais que exsurgiram da instrução processual, voltadas à comprovação da autoria e materialidade delituosas quanto ao crime licitatório em comento, em desfavor de cada um dos apelados, servíveis à responsabilização penal dos recorridos pelo cometimento das condutas previstas no tipo penal do art. 90, da Lei nº 8.666/93, vigente à época dos fatos (revogada por força da Lei nº 14.133/21). 4.Todavia, em sentido oposto ao desiderato recursal de viés condenatório encampado pelo Parquet, expôs o sentenciante, de forma percuciente, através de hígidas razões fático-jurídicas, a motivação absolutória para rechaçar a imputação de cometimento do delito licitatório lançada em desfavor dos então denunciados, ora apelados, merecendo destacar os excertos dos fundamentos adotados no veredicto, reproduzidos neste Voto, sedimentados na inexistência de comprovação da materialidade delituosa das condutas delineadas nos autos, nos moldes do art. 386, VII, do Código de Processo Penal (\"não existir prova suficiente para a condenação\"). 5. Da análise da instrução probatória, ricamente delineada pelo sentenciante, em que salientada, inclusive, a fragilidade e inconsistência das provas testemunhais, depreende-se que não foi comprovado, nas condutas dos denunciados - para além de inexistir prova da materialidade delituosa -, o dolo específico de fraudar o certame licitatório, exigível, consoante pacificada jurisprudência do Superior Tribunal de Justiça - STJ, ao perfazimento das elementares do tipo penal do art. 90 da Lei nº 8.666/93, vigente à época dos fatos - transferido para o tipo do art. 337-F do CP, pela incidência do princípio da continuidade típico-normativa. 6. Nesse sentido - necessidade de comprovação do elemento subjetivo do tipo penal em específico -, bem se vê que o dominus litis não se desincumbiu do seu exclusivo ônus de demonstrar, de forma pontual e extreme de dubiedades, que houve, real e efetivamente, conluio entre os denunciados J.W.S.M. (então prefeito de Emas/PB), R.G.C.S. (proprietário da empresa contratada), C.A.M. (proprietário da empresa contratada) e E.R.A. (pregoeiro) direcionado ao objetivo de fraudar, mediante ajuste ou combinação, o caráter competitivo do Pregão Presencial nº 003/2015 (7º fato), com o casuístico propósito de viabilizar a contratação pública da empresa vencedora do certame, para prestar serviços de locação de veículos à Prefeitura Municipal de Emas-PB. 7.Como bem salientado pelo sentenciante, patenteou-se certa \"desorganização administrativa\" na condução de algumas etapas do processo licitatório do Pregão Presencial nº 003/2015 (7º fato), devido à inobservância, pelos agentes públicos, da liturgia ínsita à regularidade dos atos administrativos, sem que se possa conceber que tais irregularidades procedimentais devam, obrigatoriamente, ser transmutadas em ilícito penal, diante da ausência de demonstração factual do animus, da teleologia, da intencionalidade dos agentes mais diretamente envolvidos no certame, aqui denunciados, em fraudar ou frustrar o caráter competitivo entre os eventuais licitantes interessados em contratar com a Administração Pública, através de conluio e união de desígnios dirigidos à obtenção de vantagem derivada da adjudicação do objeto licitado, de modo a privilegiar a participação de, tão-somente, única empresa licitante, o que, ao fim e ao cabo da instrução processual, não se demonstrou. 8. Daí que a insurgência recursal ministerial não deve prosperar, visto que os fundamentos da Sentença recorrida decorreram de apurada análise lógica das provas que redundaram na absolvição dos denunciados na presente seara penal, importando em resposta estatal longe de qualquer desconformidade jurídica, por não haver o órgão acusador se desincumbido, satisfatoriamente, de comprovar, para além dos elementos que se revelaram, finda a instrução, unicamente indiciários, o cometimento das condutas supostamente típicas delineadas na peça acusatória. 9. Nesse sentido - necessidade de comprovação do elemento subjetivo do tipo penal em específico -, bem se vê que o dominus litis não se desincumbiu do seu exclusivo ônus de demonstrar, de forma pontual e extreme de dubiedades, que houve, real e efetivamente, conluio entre os denunciados J.W.S.M. (então prefeito de Emas/PB), R.G.C.S. (proprietário da empresa contratada), C.A.M. (proprietário da empresa contratada) e E.R.A. (pregoeiro) direcionado ao objetivo de fraudar, mediante ajuste ou combinação, o caráter competitivo do Pregão Presencial nº 003/2015 (7º fato), com o casuístico propósito de viabilizar a contratação pública da empresa vencedora do certame, para prestar serviços de locação de veículos à Prefeitura Municipal de Emas-PB. 10. Como bem salientado pelo sentenciante, patenteou-se certa \"desorganização administrativa\" na condução de algumas etapas do processo licitatório do Pregão Presencial nº 003/2015 (7º fato), devido à inobservância, pelos agentes públicos, da liturgia ínsita à regularidade dos atos administrativos, sem que se possa conceber que tais irregularidades procedimentais devam, obrigatoriamente, ser transmutadas em ilícito penal, diante da ausência de demonstração factual do animus, da teleologia, da intencionalidade dos agentes mais diretamente envolvidos no certame, aqui denunciados, em fraudar ou frustrar o caráter competitivo entre os eventuais licitantes interessados em contratar com a Administração Pública, através de conluio e união de desígnios dirigidos à obtenção de vantagem derivada da adjudicação do objeto licitado, de modo a privilegiar a participação de, tão-somente, única empresa licitante, o que, ao fim e ao cabo da instrução processual, não se demonstrou. 11. Daí que a insurgência recursal ministerial não deve prosperar, visto que os fundamentos da Sentença recorrida decorreram de apurada análise lógica das provas que redundaram na absolvição dos denunciados na presente seara penal, importando em resposta estatal longe de qualquer desconformidade jurídica, por não haver o órgão acusador se desincumbido, satisfatoriamente, de comprovar, para além dos elementos que se revelaram, finda a instrução, unicamente indiciários, o cometimento das condutas supostamente típicas delineadas na peça acusatória. 12. Aliás, também na esfera administrativa não prosperou, quer na primeira instância judicial, tanto quanto neste Regional, a respectiva Ação Civil Pública por ato de Improbidade Administrativa outrora movida pelo Ministério Público Federal (PJE nº 0800145-35.2021.4.05.8205), devendo ser integrado à fundamentação deste Voto a suma do teor do respeitável Acórdão proferido em sede de julgamento - não transitado em julgado - perante a Segunda Turma desta egrégia Corte, Sessão ordinária de 22.10.2024 (Relator Desembargador Federal PAULO ROBERTO DE OLIVEIRA LIMA), em que negado provimento ao apelo do Parquet, restando mantida a Sentença que julgou improcedente o pedido de condenação por ato ímprobo, nos moldes do art. 487, I, do NCPC, relacionado ao \"FATO Nº 07 - Pregão Presencial nº 003/2015 - PM de Emas-PB\", como se infere dos excertos da ementa do julgado colegiado transcritos neste Voto. 13. Assim, ainda que considerada a independência entre as instâncias cível e penal - e suas relativizações legais -, não há que se falar, na delimitada hipótese dos autos, em remanescer, para além do que já fora descartado na aludida Ação de Improbidade Administrativa - e respectivo Acórdão -, e, tanto quanto, no veredicto penal absolutório, qualquer fato punível juridicamente significante à incidência da norma penal incriminadora e de suas respectivas sanções. 14. Como visto, houve, nesta persecução penal, adequada resposta estatal, ainda que não sancionatória, à aludida prática descrita na Denúncia penal, assim como, na deflagração, também, da mencionada Ação de Improbidade Administrativa, sem, contudo, haver sido revelado qualquer significativo desvalor jurídico punível nas condutas dos codenunciados, aqui apelados, a ter lugar nas idênticas situações fáticas analisadas em ambas as instâncias - cível e penal -, sobre o mesmo \"FATO Nº 07 - Pregão Presencial nº 003/2015 - PM de Emas-PB\". 15. Apesar da prescindibilidade da demonstração de prejuízo ao erário, conforme a diretiva da Súmula nº 645/STJ (\"O crime de fraude à licitação é formal, e sua consumação prescinde da comprovação do prejuízo ou da obtenção de vantagem.\"), sendo despicienda, portanto, a produção de resultado naturalístico por se tratar de delito formal, fato é que, in casu, as condutas dos agentes, ora apelados, não restaram substancialmente subsumíveis às elementares do delito licitatório inserto no art. 90, da Lei nº 8.666/93, sendo acertadas suas respectivas absolvições pormenorizadamente justificadas no art. 386, VII, do Código de Processo Penal (\"não existir prova suficiente para a condenação\"). 16. Sentença mantida. Negado provimento ao apelo do Ministério Público Federal. LSJ (PROCESSO: 08004256920224058205, APELAÇÃO CRIMINAL, DESEMBARGADOR FEDERAL EDVALDO BATISTA DA SILVA JÚNIOR, 1ª TURMA, JULGAMENTO: 03/07/2025)",
      "consulta_processual_url": "https://www.trf5.jus.br/index.php/consulta-processual-fisico-e-eletronico",
      "texto_pdf_html": "data\\docs\\2025_08004256920224058205_03-07-2025.html"
    },
    {
      "numero_processo": "08056006620214058500",
      "classe": "APELAÇÃO CÍVEL",
      "orgao_julgador": "1ª TURMA",
      "data_julgamento": "03/07/2025",
      "relator": "DESEMBARGADOR FEDERAL EDVALDO BATISTA DA SILVA JÚNIOR",
      "ementa": "TRIBUTÁRIO. IMPOSTO DE RENDA SOBRE COMPLEMENTAÇÃO DE APOSENTADORIA. RESTITUIÇÃO DOS VALORES CORRESPONDENTES ÀS CONTRIBUIÇÕES VERTIDAS PELO EMPREGADO AO FUNDO DE PREVIDÊNCIA PRIVADA, DURANTE A VIGÊNCIA DA LEI N. 7.713/88. PRECEDENTES DO STJ EM SEDE DE RECURSO REPETITIVO (RESP 1.012.903 - TEMA 62). ESGOTAMENTO COMO MÉTODO DO CÁLCULO. (PROCESSO: 08056006620214058500, APELAÇÃO CÍVEL, DESEMBARGADOR FEDERAL EDVALDO BATISTA DA SILVA JÚNIOR, 1ª TURMA, JULGAMENTO: 03/07/2025)",
      "texto_pdf": "PROCESSO Nº: 0805600-66.2021.4.05.8500 - APELAÇÃO CÍVEL APELANTE: FAZENDA NACIONAL APELADO: CELSON SOUZA ADVOGADO: Antonio Paes De Araujo Junior RELATOR(A): Desembargador(a) Federal Edvaldo Batista da Silva Júnior - 1ª Turma JUIZ PROLATOR DA SENTENÇA (1° GRAU): Juiz(a) Federal Edmilson Da Silva Pimenta EMENTA: TRIBUTÁRIO. IMPOSTO DE RENDA SOBRE COMPLEMENTAÇÃO DE APOSENTADORIA. RESTITUIÇÃO DOS VALORES CORRESPONDENTES ÀS CONTRIBUIÇÕES VERTIDAS PELO EMPREGADO AO FUNDO DE PREVIDÊNCIA PRIVADA, DURANTE A VIGÊNCIA DA LEI N. 7.713/88. PRECEDENTES DO STJ EM SEDE DE RECURSO REPETITIVO (RESP 1.012.903 - TEMA 62). ESGOTAMENTO COMO MÉTODO DO CÁLCULO. 1. Apelação interposta pela Fazenda Nacional em face de sentença que julgou a Ação Ordinária procedente para condenar a ré a restituir ao autor o montante por ele recolhido, no período de 01/01/1989 a 31/12/1995, a título de Imposto de Renda, na hipótese impugnada nos autos, descontando-se os valores já compensados administrativamente, devidamente corrigidos, pelos índices aplicáveis. Honorários advocatícios fixados em 10% (dez por cento) sobre o proveito econômico obtido pelo autor, ora Apelado. 2. Em suas razões recursais, a Apelante aduz, em síntese, que qualquer discussão a respeito do direito à isenção pleiteada teria que se limitar aos fatos geradores ocorridos antes da vigência da Lei nº 9.250/95, bem como que o direito de ação, quer em relação ao imposto de renda retido na fonte sobre as parcelas vertidas à Previdência Privada durante os anos de 1989 a 1995, quer em relação ao tributo incidente sobre as complementações de aposentadoria recebidas no ano de 1995, está fulminado pela prescrição. 3. Tal problemática já foi apreciada pelo STJ, em Recurso Representativo de Controvérsia, no julgamento do REsp 1.012.903 (Tema 62), o qual concluiu que \"Por força da isenção concedida pelo art. 6º, VII, b, da Lei 7.713/88, na redação anterior à que lhe foi dada pela Lei 9.250/95, é indevida a cobrança de imposto de renda sobre o valor da complementação de aposentadoria e o do resgate de contribuições correspondentes a recolhimentos para entidade de previdência privada ocorridos no período de 1º.01.1989 a 31.12.1995.\" (Rel. Ministro Teori Albino Zavascki, DJe 13/10/2008). 4. Conforme assentado na jurisprudência do STJ, a cobrança indevida do Imposto de Renda sobre os valores recebidos a título de complementação de aposentadoria deve corresponder aos valores cujo ônus foi suportado pelo beneficiário no período de vigência da Lei n. 7.713/1988 (de janeiro de 1989 a dezembro de 1995). Nesse sentido, destaca-se o seguinte precedente da Corte Superior: STJ - AgRg no Ag 1292434/BA, Rel. Ministro Napoleão Nunes Maia Filho, Primeira Turma, DJe 19/12/2019. 5. No que concerne à forma de cálculo, o critério a ser utilizado é o do esgotamento. Sobre este tema, devem ser adotados os seguintes precedentes desta Corte Regional e da Corte Superior: PROCESSO APELREEX 200981000009762, REL. DESEMBARGADOR FEDERAL MANOEL ERHARDT, TRF5 - 1ª TURMA, TRF5, DJE 12/09/2013 - PÁGINA 88; PROCESSO APELREEX 0802844-24.2015.4.05.8200, REL. DESEMBARGADOR FEDERAL CID MARCONI GURGEL DE SOUZA - 3ª TURMA, TRF5, DJE 07/04/2022; RESP N. 1.375.290/PE, RELATOR MINISTRO OG FERNANDES, SEGUNDA TURMA, JULGADO EM 10/11/2016, DJE DE 18/11/2016; AGRG NO RESP N. 1.212.993/PR, RELATOR MINISTRO SÉRGIO KUKINA, PRIMEIRA TURMA, JULGADO EM 12/5/2015, DJE DE 22/5/2015; AGRG NO RESP N. 1.471.754/PE, RELATOR MINISTRO MAURO CAMPBELL MARQUES, SEGUNDA TURMA, JULGADO EM 2/10/2014, DJE DE 8/10/2014; E RESP N. 1.221.055/RS, RELATOR MINISTRO MAURO CAMPBELL MARQUES, SEGUNDA TURMA, JULGADO EM 27/11/2012, DJE DE 5/12/2012. 6. Considerando-se o prazo prescricional quinquenal, contando-se retroativamente a partir do ajuizamento da presente demanda (06/11/2021), se o montante exaurido ainda possuir saldo após a data de 06/11/2016, este será o valor a ser devolvido ao Apelado, nos mesmos moldes consignados na sentença vergastada. 7. Apelação improvida. A título de honorários recursais, fica majorado em 1% (um por cento) o percentual aplicado na sentença, nos termos do art. 85, § 11, do CPC. mlca (PROCESSO: 08056006620214058500, APELAÇÃO CÍVEL, DESEMBARGADOR FEDERAL EDVALDO BATISTA DA SILVA JÚNIOR, 1ª TURMA, JULGAMENTO: 03/07/2025)",
      "consulta_processual_url": "https://www.trf5.jus.br/index.php/consulta-processual-fisico-e-eletronico",
      "texto_pdf_html": "data\\docs\\2025_08056006620214058500_03-07-2025.html"
    },
    {
      "numero_processo": "08098018520244050000",
      "classe": "AGRAVO DE INSTRUMENTO",
      "orgao_julgador": "1ª TURMA",
      "data_julgamento": "03/07/2025",
      "relator": "DESEMBARGADOR FEDERAL EDVALDO BATISTA DA SILVA JÚNIOR",
      "ementa": "PREVIDENCIÁRIO. AGRAVO DE INSTRUMENTO. INDEFERIMENTO DE ESCLARECIMENTOS AO LAUDO PERICIAL. AUSÊNCIA DE CERCEAMENTO DE DEFESA. AGRAVO IMPROVIDO. (PROCESSO: 08098018520244050000, AGRAVO DE INSTRUMENTO, DESEMBARGADOR FEDERAL EDVALDO BATISTA DA SILVA JÚNIOR, 1ª TURMA, JULGAMENTO: 03/07/2025)",
      "texto_pdf": "PROCESSO Nº: 0809801-85.2024.4.05.0000 - AGRAVO DE INSTRUMENTO AGRAVANTE: JOSEFA FELIX FERREIRA DA SILVA ADVOGADO: Gefferson Da Silva Miguel AGRAVADO: INSTITUTO NACIONAL DO SEGURO SOCIAL - INSS RELATOR(A): Desembargador(a) Federal Edvaldo Batista da Silva Júnior - 1ª Turma MAGISTRADO CONVOCADO: Desembargador(a) Federal Roberta Walmsley S. C. Porto De Barros JUIZ PROLATOR DA SENTENÇA (1° GRAU): Juiz(a) Federal PREVIDENCIÁRIO. AGRAVO DE INSTRUMENTO. INDEFERIMENTO DE ESCLARECIMENTOS AO LAUDO PERICIAL. AUSÊNCIA DE CERCEAMENTO DE DEFESA. AGRAVO IMPROVIDO. 1. Agravo de instrumento interposto por JOSEFA FELIX FERREIRA DA SILVA contra decisão interlocutória proferida pelo Juízo da Vara Única da Comarca de Conceição/PB, nos autos do processo nº 0801421-30.2023.8.15.0151, que indeferiu pedido de esclarecimentos ao laudo pericial. 2. Não constitui cerceamento de defesa o indeferimento de pedido de esclarecimentos ao laudo pericial quando este se apresenta claro e conclusivo, ainda que a conclusão não coincida com a expectativa da parte interessada. 3. Os esclarecimentos ao laudo pericial destinam-se a esclarecer pontos obscuros, contraditórios ou duvidosos, e não a promover nova análise de documentos ou rediscussão de conclusões já firmadas pelo expert. 4. O magistrado possui discricionariedade técnica para indeferir a produção de prova considerada desnecessária ao deslinde da controvérsia, nos termos do artigo 370, parágrafo único, do CPC.. 5. Agravo de instrumento improvido. (PROCESSO: 08098018520244050000, AGRAVO DE INSTRUMENTO, DESEMBARGADOR FEDERAL EDVALDO BATISTA DA SILVA JÚNIOR, 1ª TURMA, JULGAMENTO: 03/07/2025)",
      "consulta_processual_url": "https://www.trf5.jus.br/index.php/consulta-processual-fisico-e-eletronico",
      "texto_pdf_html": "data\\docs\\2025_08098018520244050000_03-07-2025.html"
    },
    {
      "numero_processo": "08121081220244050000",
      "classe": "AGRAVO DE INSTRUMENTO",
      "orgao_julgador": "1ª TURMA",
      "data_julgamento": "03/07/2025",
      "relator": "DESEMBARGADOR FEDERAL EDVALDO BATISTA DA SILVA JÚNIOR",
      "ementa": "AGRAVO DE INSTRUMENTO. DIREITO PREVIDENCIÁRIO. CUMPRIMENTO DE SENTENÇA. IMPUGNAÇÃO ACOLHIDA. DIVERGÊNCIA DE CÁLCULOS. REMESSA À CONTADORIA. DESNECESSIDADE. AGRAVO IMPROVIDO. (PROCESSO: 08121081220244050000, AGRAVO DE INSTRUMENTO, DESEMBARGADOR FEDERAL EDVALDO BATISTA DA SILVA JÚNIOR, 1ª TURMA, JULGAMENTO: 03/07/2025)",
      "texto_pdf": "PROCESSO Nº: 0812108-12.2024.4.05.0000 - AGRAVO DE INSTRUMENTO AGRAVANTE: TANIA MARIA CRUZ SILVA SOUSA ADVOGADO: Alane Lucia De Souza Lima e outro AGRAVADO: INSTITUTO NACIONAL DO SEGURO SOCIAL - INSS RELATOR(A): Desembargador(a) Federal Edvaldo Batista da Silva Júnior - 1ª Turma MAGISTRADO CONVOCADO: Desembargador(a) Federal Roberta Walmsley S. C. Porto De Barros JUIZ PROLATOR DA SENTENÇA (1° GRAU): Juiz(a) Federal AGRAVO DE INSTRUMENTO. DIREITO PREVIDENCIÁRIO. CUMPRIMENTO DE SENTENÇA. IMPUGNAÇÃO ACOLHIDA. DIVERGÊNCIA DE CÁLCULOS. REMESSA À CONTADORIA. DESNECESSIDADE. AGRAVO IMPROVIDO. 1. Agravo de Instrumento interposto por TÂNIA MARIA CRUZ SILVA SOUSA contra decisão proferida pelo Juiz Federal da 4ª Vara Federal de Campina Grande-PB, nos autos do processo nº 0800331-65.2024.4.05.8201, em face do INSTITUTO NACIONAL DO SEGURO SOCIAL - INSS. 2. Nas razões recursais, sustenta ser imprescindível a remessa à contadoria diante da divergência entre os cálculos das partes, citando precedentes do Superior Tribunal de Justiça no sentido de que o magistrado pode utilizar-se do contador quando houver necessidade de adequar os cálculos ao comando da sentença. 3. A remessa dos autos à contadoria judicial justifica-se quando há dúvida objetiva sobre a aplicação de critérios técnicos de cálculo, não se prestando para solucionar questões jurídicas como marco temporal da prescrição ou termo final da execução. 4. Identificados pelo magistrado vícios específicos nos cálculos da exequente (inclusão de parcelas prescritas e valores já pagos administrativamente), e observados pelo executado a RMI fixada judicialmente e os critérios de atualização estabelecidos na sentença, desnecessária a perícia contábil. 5. Agravo de instrumento improvido. (PROCESSO: 08121081220244050000, AGRAVO DE INSTRUMENTO, DESEMBARGADOR FEDERAL EDVALDO BATISTA DA SILVA JÚNIOR, 1ª TURMA, JULGAMENTO: 03/07/2025)",
      "consulta_processual_url": "https://www.trf5.jus.br/index.php/consulta-processual-fisico-e-eletronico",
      "texto_pdf_html": "data\\docs\\2025_08121081220244050000_03-07-2025.html"
    },
    {
      "numero_processo": "08102253020244050000",
      "classe": "AGRAVO DE INSTRUMENTO",
      "orgao_julgador": "1ª TURMA",
      "data_julgamento": "03/07/2025",
      "relator": "DESEMBARGADOR FEDERAL EDVALDO BATISTA DA SILVA JÚNIOR",
      "ementa": "PROCESSUAL CIVIL E ADMINISTRATIVO. AGRAVO DE INSTRUMENTO. CUMPRIMENTO DE SENTENÇA CONTRA A FAZENDA PÚBLICA. EXPEDIÇÃO DE REQUISIÇÃO DE PAGAMENTO. SERVIDOR NÃO INCLUÍDO NO PEDIDO ORIGINÁRIO. OMISSÃO DA PARTE REQUERENTE. IMPOSSIBILIDADE DE AMPLIAÇÃO DO TÍTULO EXECUTIVO. AGRAVO IMPROVIDO. (PROCESSO: 08102253020244050000, AGRAVO DE INSTRUMENTO, DESEMBARGADOR FEDERAL EDVALDO BATISTA DA SILVA JÚNIOR, 1ª TURMA, JULGAMENTO: 03/07/2025)",
      "texto_pdf": "PROCESSO Nº: 0810225-30.2024.4.05.0000 - AGRAVO DE INSTRUMENTO AGRAVANTE: CARLITO SANTOS DE OLIVEIRA JUNIOR e outros ADVOGADO: Jorge Fernando Machado Pereira AGRAVADO: FUNDACAO NACIONAL DE SAUDE - FUNASA RELATOR(A): Desembargador(a) Federal Edvaldo Batista da Silva Júnior - 1ª Turma MAGISTRADO CONVOCADO: Desembargador(a) Federal Roberta Walmsley S. C. Porto De Barros PROCESSO ORIGINÁRIO: 0005838-09.1997.4.05.8000 - 2ª VARA FEDERAL - AL JUIZ PROLATOR DA SENTENÇA (1° GRAU): Juiz(a) Federal PROCESSUAL CIVIL E ADMINISTRATIVO. AGRAVO DE INSTRUMENTO. CUMPRIMENTO DE SENTENÇA CONTRA A FAZENDA PÚBLICA. EXPEDIÇÃO DE REQUISIÇÃO DE PAGAMENTO. SERVIDOR NÃO INCLUÍDO NO PEDIDO ORIGINÁRIO. OMISSÃO DA PARTE REQUERENTE. IMPOSSIBILIDADE DE AMPLIAÇÃO DO TÍTULO EXECUTIVO. AGRAVO IMPROVIDO. 1. Agravo de Instrumento interposto por CICERO FRANCISCO DA SILVA e outros contra decisão proferida pela 2ª Vara Federal de Alagoas, nos autos do processo nº 0005838-09.1997.4.05.8000, que indeferiu pedido de expedição de requisição em favor do servidor CARLOS CONDE. 2. O cumprimento de sentença deve observar rigorosamente os limites objetivos e subjetivos do título executivo, não sendo admissível sua ampliação para contemplar beneficiários não originariamente incluídos no pedido. 3. A ausência de inclusão de servidor na relação de beneficiários de requisições de pagamento, quando decorrente de omissão da própria parte requerente tanto na elaboração dos cálculos quanto na delimitação do objeto da execução, impede sua posterior inclusão em sede de agravo de instrumento. 4. O princípio da correlação entre o pedido e a prestação jurisdicional veda ao Poder Judiciário conceder mais do que foi efetivamente requerido pelas partes. 5. Agravo de instrumento improvido. (PROCESSO: 08102253020244050000, AGRAVO DE INSTRUMENTO, DESEMBARGADOR FEDERAL EDVALDO BATISTA DA SILVA JÚNIOR, 1ª TURMA, JULGAMENTO: 03/07/2025)",
      "consulta_processual_url": "https://www.trf5.jus.br/index.php/consulta-processual-fisico-e-eletronico",
      "texto_pdf_html": "data\\docs\\2025_08102253020244050000_03-07-2025.html"
    },
    {
      "numero_processo": "08058431420244058400",
      "classe": "APELAÇÃO CÍVEL",
      "orgao_julgador": "1ª TURMA",
      "data_julgamento": "03/07/2025",
      "relator": "DESEMBARGADOR FEDERAL EDVALDO BATISTA DA SILVA JÚNIOR",
      "ementa": "PROCESSUAL CIVIL. APELAÇÃO. CUMPRIMENTO PROVISÓRIO DE SENTENÇA. FAZENDA PÚBLICA. EXECUÇÃO DE ASTREINTES. IMPOSSIBILIDADE. TRÂNSITO EM JULGADO. EXIGÊNCIA. PERDA DO OBJETO. JUSTIÇA GRATUITA. PREENCHIMENTO DOS REQUISITOS. APELAÇÃO PROVIDA EM PARTE. (PROCESSO: 08058431420244058400, APELAÇÃO CÍVEL, DESEMBARGADOR FEDERAL EDVALDO BATISTA DA SILVA JÚNIOR, 1ª TURMA, JULGAMENTO: 03/07/2025)",
      "texto_pdf": "PROCESSO Nº: 0805843-14.2024.4.05.8400 - APELAÇÃO CÍVEL APELANTE: COMERCIAL NOVA REPUBLICA LTDA ADVOGADO: Silvio Mayronne Soares Mendonca APELADO: FAZENDA NACIONAL RELATOR(A): Desembargador(a) Federal Edvaldo Batista da Silva Júnior - 1ª Turma MAGISTRADO CONVOCADO: Desembargador(a) Federal Roberta Walmsley S. C. Porto De Barros JUIZ PROLATOR DA SENTENÇA (1° GRAU): Juiz(a) Federal Janine De Medeiros Souza Bezerra PROCESSUAL CIVIL. APELAÇÃO. CUMPRIMENTO PROVISÓRIO DE SENTENÇA. FAZENDA PÚBLICA. EXECUÇÃO DE ASTREINTES. IMPOSSIBILIDADE. TRÂNSITO EM JULGADO. EXIGÊNCIA. PERDA DO OBJETO. JUSTIÇA GRATUITA. PREENCHIMENTO DOS REQUISITOS. APELAÇÃO PROVIDA EM PARTE. 1. Apelação cível interposta por COMERCIAL NOVA REPÚBLICA LTDA contra sentença proferida pelo MM. Juiz Federal da 6ª Vara Federal da Seção Judiciária do Rio Grande do Norte, nos autos de cumprimento provisório de sentença, que julgou extinto o feito nos termos do art. 485, inciso IV, do Código de Processo Civil. 2. A execução provisória de astreintes contra a Fazenda Pública não é admitida, equiparando-se à execução por quantia certa, que exige o trânsito em julgado da decisão condenatória. 3. Verificada a perda superveniente do objeto da demanda em razão do cumprimento da obrigação pela Fazenda Nacional, impõe-se a extinção do feito nos termos do art. 485, IV, do CPC.. 4. Precedente recente desta Corte: PROCESSO: 08034287320244058201, APELAÇÃO CÍVEL, DESEMBARGADOR FEDERAL MANOEL DE OLIVEIRA ERHARDT, 4ª TURMA, JULGAMENTO: 22/04/2025. 5. Deferidos os benefícios da justiça gratuita, dada a demonstração documental das dificuldades financeiras enfrentadas pela empresa. 6. Apelação provida, em parte, apenas para conceder o benefício da justiça gratuita ao recorrente. (PROCESSO: 08058431420244058400, APELAÇÃO CÍVEL, DESEMBARGADOR FEDERAL EDVALDO BATISTA DA SILVA JÚNIOR, 1ª TURMA, JULGAMENTO: 03/07/2025)",
      "consulta_processual_url": "https://www.trf5.jus.br/index.php/consulta-processual-fisico-e-eletronico",
      "texto_pdf_html": "data\\docs\\2025_08058431420244058400_03-07-2025.html"
    },
    {
      "numero_processo": "08138864620244058300",
      "classe": "APELAÇÃO CÍVEL",
      "orgao_julgador": "1ª TURMA",
      "data_julgamento": "03/07/2025",
      "relator": "DESEMBARGADOR FEDERAL EDVALDO BATISTA DA SILVA JÚNIOR",
      "ementa": "PROCESSUAL CIVIL E ADMINISTRATIVO. CUMPRIMENTO DE SENTENÇA. AÇÃO CIVIL PÚBLICA. REAJUSTE DE 28,86%. LEIS Nºs 8.622 E 8.627/1993. LEGITIMIDADE ATIVA. LIMITAÇÃO TERRITORIAL. INEXISTÊNCIA. EFEITOS ERGA OMNES DA SENTENÇA COLETIVA. DIREITOS INDIVIDUAIS HOMOGÊNEOS. APELAÇÃO PROVIDA. (PROCESSO: 08138864620244058300, APELAÇÃO CÍVEL, DESEMBARGADOR FEDERAL EDVALDO BATISTA DA SILVA JÚNIOR, 1ª TURMA, JULGAMENTO: 03/07/2025)",
      "texto_pdf": "PROCESSO Nº: 0813886-46.2024.4.05.8300 - APELAÇÃO CÍVEL APELANTE: ALDA LOPES DE ARAUJO e outros ADVOGADO: Joaquim Pedro Carneiro Campello Filho e outros APELADO: UNIÃO FEDERAL RELATOR(A): Desembargador(a) Federal Edvaldo Batista da Silva Júnior - 1ª Turma MAGISTRADO CONVOCADO: Desembargador(a) Federal Roberta Walmsley S. C. Porto De Barros JUIZ PROLATOR DA SENTENÇA (1° GRAU): Juiz(a) Federal Amanda Torres De Lucena Diniz Araujo PROCESSUAL CIVIL E ADMINISTRATIVO. CUMPRIMENTO DE SENTENÇA. AÇÃO CIVIL PÚBLICA. REAJUSTE DE 28,86%. LEIS Nºs 8.622 E 8.627/1993. LEGITIMIDADE ATIVA. LIMITAÇÃO TERRITORIAL. INEXISTÊNCIA. EFEITOS ERGA OMNES DA SENTENÇA COLETIVA. DIREITOS INDIVIDUAIS HOMOGÊNEOS. APELAÇÃO PROVIDA. 1. Apelação interposta por pelo Sindicato dos Trabalhadores em Empresas Ferroviárias do Nordeste e outros contra sentença que julgou improcedente o cumprimento de sentença, fundamentando-se na ilegitimidade ativa dos exequentes que não trabalhavam no Estado do Mato Grosso do Sul. 2. A sentença proferida na Ação Civil Pública nº 0005019-15.1997.4.03.6000 reconheceu genericamente o direito ao reajuste de 28,86% aos servidores públicos federais que se enquadrassem nas hipóteses das Leis nºs 8.622 e 8.627/1993, sem estabelecer limitação geográfica expressa. 3. Nas ações civis públicas que versam sobre direitos individuais homogêneos de servidores públicos, a sentença de procedência produz efeitos erga omnes, beneficiando todos aqueles que se encontrem na mesma situação jurídica, independentemente de limitação territorial, salvo se expressamente estabelecida na decisão. 4. A execução de sentença genérica sobre direitos individuais homogêneos pode ser promovida individualmente pelo interessado ou coletivamente pelos legitimados legais, cabendo ao credor a opção pela modalidade executiva, em atenção ao princípio da integral liberdade de adesão. 5. Os apelantes demonstraram enquadramento na categoria de servidores contemplados pela sentença coletiva, possuindo legitimidade ativa para promover o cumprimento individual da sentença. 6. Apelação provida, para determinar o retorno dos autos ao juízo de origem para o prosseguimento do cumprimento de sentença. (PROCESSO: 08138864620244058300, APELAÇÃO CÍVEL, DESEMBARGADOR FEDERAL EDVALDO BATISTA DA SILVA JÚNIOR, 1ª TURMA, JULGAMENTO: 03/07/2025)",
      "consulta_processual_url": "https://www.trf5.jus.br/index.php/consulta-processual-fisico-e-eletronico",
      "texto_pdf_html": "data\\docs\\2025_08138864620244058300_03-07-2025.html"
    },
    {
      "numero_processo": "08137375020244058300",
      "classe": "APELAÇÃO CÍVEL",
      "orgao_julgador": "1ª TURMA",
      "data_julgamento": "03/07/2025",
      "relator": "DESEMBARGADOR FEDERAL EDVALDO BATISTA DA SILVA JÚNIOR",
      "ementa": "PROCESSUAL CIVIL E ADMINISTRATIVO. CUMPRIMENTO DE SENTENÇA. AÇÃO CIVIL PÚBLICA. REAJUSTE DE 28,86%. LEIS Nºs 8.622 E 8.627/1993. LEGITIMIDADE ATIVA. LIMITAÇÃO TERRITORIAL. INEXISTÊNCIA. EFEITOS ERGA OMNES DA SENTENÇA COLETIVA. DIREITOS INDIVIDUAIS HOMOGÊNEOS. APELAÇÃO PROVIDA. APELAÇÃO PROVIDA. (PROCESSO: 08137375020244058300, APELAÇÃO CÍVEL, DESEMBARGADOR FEDERAL EDVALDO BATISTA DA SILVA JÚNIOR, 1ª TURMA, JULGAMENTO: 03/07/2025)",
      "texto_pdf": "PROCESSO Nº: 0813737-50.2024.4.05.8300 - APELAÇÃO CÍVEL APELANTE: ELIETE GOMES DE ALMEIDA e outros ADVOGADO: Joaquim Pedro Carneiro Campello Filho e outros APELADO: UNIÃO FEDERAL RELATOR(A): Desembargador(a) Federal Edvaldo Batista da Silva Júnior - 1ª Turma MAGISTRADO CONVOCADO: Desembargador(a) Federal Roberta Walmsley S. C. Porto De Barros JUIZ PROLATOR DA SENTENÇA (1° GRAU): Juiz(a) Federal Amanda Torres De Lucena Diniz Araujo PROCESSUAL CIVIL E ADMINISTRATIVO. CUMPRIMENTO DE SENTENÇA. AÇÃO CIVIL PÚBLICA. REAJUSTE DE 28,86%. LEIS Nºs 8.622 E 8.627/1993. LEGITIMIDADE ATIVA. LIMITAÇÃO TERRITORIAL. INEXISTÊNCIA. EFEITOS ERGA OMNES DA SENTENÇA COLETIVA. DIREITOS INDIVIDUAIS HOMOGÊNEOS. APELAÇÃO PROVIDA. APELAÇÃO PROVIDA. 1. Apelação interposta por SINDICATO DOS TRABALHADORES EM EMPRESAS FERROVIÁRIAS DO NORDESTE - SINDFER/NE, GRAZIELA MARTINS VIEGAS, MIDIAN VELOSO FERREIRA, ADELMA FERREIRA DA SILVA, ADENI BENJAMIM DA CRUZ, ALDA DOMINGOS DOS SANTOS, AMINADAB DOS ANJOS NOGUEIRA, CRISTIANE FRANCISCA DOS SANTOS, EDINEIDE DANTAS DA SILVA, ELIANE BELO DA SILVA e ELIETE GOMES DE ALMEIDA contra sentença prolatada pelo Juízo da 7ª Vara Federal da Seção Judiciária de Pernambuco, que extinguiu o cumprimento de sentença sem resolução do mérito, por ilegitimidade ativa. 2. A sentença proferida na Ação Civil Pública nº 0005019-15.1997.4.03.6000 reconheceu genericamente o direito ao reajuste de 28,86% aos servidores públicos federais que se enquadrassem nas hipóteses das Leis nºs 8.622 e 8.627/1993, sem estabelecer limitação geográfica expressa. 3. Nas ações civis públicas que versam sobre direitos individuais homogêneos de servidores públicos, a sentença de procedência produz efeitos erga omnes, beneficiando todos aqueles que se encontrem na mesma situação jurídica, independentemente de limitação territorial, salvo se expressamente estabelecida na decisão. 4. A execução de sentença genérica sobre direitos individuais homogêneos pode ser promovida individualmente pelo interessado ou coletivamente pelos legitimados legais, cabendo ao credor a opção pela modalidade executiva, em atenção ao princípio da integral liberdade de adesão. 5. Os apelantes demonstraram enquadramento na categoria de servidores contemplados pela sentença coletiva, possuindo legitimidade ativa para promover o cumprimento individual da sentença. 6. Apelação provida, para determinar o retorno dos autos ao juízo de origem para o prosseguimento do cumprimento de sentença. (PROCESSO: 08137375020244058300, APELAÇÃO CÍVEL, DESEMBARGADOR FEDERAL EDVALDO BATISTA DA SILVA JÚNIOR, 1ª TURMA, JULGAMENTO: 03/07/2025)",
      "consulta_processual_url": "https://www.trf5.jus.br/index.php/consulta-processual-fisico-e-eletronico",
      "texto_pdf_html": "data\\docs\\2025_08137375020244058300_03-07-2025.html"
    },
    {
      "numero_processo": "08184546020234058100",
      "classe": "APELAÇÃO CÍVEL",
      "orgao_julgador": "1ª TURMA",
      "data_julgamento": "03/07/2025",
      "relator": "DESEMBARGADOR FEDERAL EDVALDO BATISTA DA SILVA JÚNIOR",
      "ementa": "PROCESSUAL CIVIL. MANDADO DE SEGURANÇA. CUMPRIMENTO DE SENTENÇA. HONORÁRIOS ADVOCATÍCIOS. IMPOSSIBILIDADE. ART. 25 DA LEI N. 12.016/2009. SÚMULA 105/STJ.. APELAÇÃO PROVIDA. (PROCESSO: 08184546020234058100, APELAÇÃO CÍVEL, DESEMBARGADOR FEDERAL EDVALDO BATISTA DA SILVA JÚNIOR, 1ª TURMA, JULGAMENTO: 03/07/2025)",
      "texto_pdf": "PROCESSO Nº: 0818454-60.2023.4.05.8100 - APELAÇÃO CÍVEL APELANTE: LAMPPIT SOLUTIONS TECNOLOGIA LTDA ADVOGADO: Ricardo Wagner Oliveira Santos APELADO: FAZENDA NACIONAL RELATOR(A): Desembargador(a) Federal Edvaldo Batista da Silva Júnior - 1ª Turma MAGISTRADO CONVOCADO: Desembargador(a) Federal Roberta Walmsley S. C. Porto De Barros JUIZ PROLATOR DA SENTENÇA (1° GRAU): Juiz(a) Federal Heloisa Silva De Melo PROCESSUAL CIVIL. MANDADO DE SEGURANÇA. CUMPRIMENTO DE SENTENÇA. HONORÁRIOS ADVOCATÍCIOS. IMPOSSIBILIDADE. ART. 25 DA LEI N. 12.016/2009. SÚMULA 105/STJ.. APELAÇÃO PROVIDA. 1. Apelação cível interposta por Lamppit Solutions Tecnologia Ltda. contra sentença proferida pela 10ª Vara Federal da Seção Judiciária do Ceará, nos autos de cumprimento provisório de sentença derivado do Mandado de Segurança nº 0815178-55.2022.4.05.8100. 2. O art. 25 da Lei n. 12.016/2009 veda expressamente a condenação ao pagamento de honorários advocatícios no processo de mandado de segurança. 3. A vedação legal aplica-se tanto à fase de conhecimento quanto à fase de cumprimento de sentença, tratando-se de etapas de uma mesma relação processual. 4. O entendimento é consolidado no Superior Tribunal de Justiça através da Súmula 105: \"na ação de mandado de segurança não se admite condenação em honorários advocatícios\". 5. A única exceção jurisprudencial refere-se à execução individual de ação coletiva, hipótese não configurada nos autos. 6. Apelação provida, para afastar a condenação em honorários advocatícios imposta à apelante, mantendo os demais termos da sentença. (PROCESSO: 08184546020234058100, APELAÇÃO CÍVEL, DESEMBARGADOR FEDERAL EDVALDO BATISTA DA SILVA JÚNIOR, 1ª TURMA, JULGAMENTO: 03/07/2025)",
      "consulta_processual_url": "https://www.trf5.jus.br/index.php/consulta-processual-fisico-e-eletronico",
      "texto_pdf_html": "data\\docs\\2025_08184546020234058100_03-07-2025.html"
    },
    {
      "numero_processo": "08101291520244050000",
      "classe": "AGRAVO DE INSTRUMENTO",
      "orgao_julgador": "1ª TURMA",
      "data_julgamento": "03/07/2025",
      "relator": "DESEMBARGADOR FEDERAL EDVALDO BATISTA DA SILVA JÚNIOR",
      "ementa": "PROCESSUAL CIVIL. AGRAVO DE INSTRUMENTO. CUMPRIMENTO DE SENTENÇA. HONORÁRIOS ADVOCATÍCIOS. BASE DE CÁLCULO. TÍTULO EXECUTIVO JUDICIAL. INTERPRETAÇÃO LITERAL. PROPORCIONALIDADE.. AGRAVO IMPROVIDO. (PROCESSO: 08101291520244050000, AGRAVO DE INSTRUMENTO, DESEMBARGADOR FEDERAL EDVALDO BATISTA DA SILVA JÚNIOR, 1ª TURMA, JULGAMENTO: 03/07/2025)",
      "texto_pdf": "PROCESSO Nº: 0810129-15.2024.4.05.0000 - AGRAVO DE INSTRUMENTO AGRAVANTE: MIDIAVOX LTDA ADVOGADO: Marcio Rogerio Ferreira De Freitas AGRAVADO: FAZENDA NACIONAL RELATOR(A): Desembargador(a) Federal Edvaldo Batista da Silva Júnior - 1ª Turma MAGISTRADO CONVOCADO: Desembargador(a) Federal Roberta Walmsley S. C. Porto De Barros PROCESSO ORIGINÁRIO: 0809792-65.2018.4.05.8300 - 2ª VARA FEDERAL - PE JUIZ PROLATOR DA SENTENÇA (1° GRAU): Juiz(a) Federal PROCESSUAL CIVIL. AGRAVO DE INSTRUMENTO. CUMPRIMENTO DE SENTENÇA. HONORÁRIOS ADVOCATÍCIOS. BASE DE CÁLCULO. TÍTULO EXECUTIVO JUDICIAL. INTERPRETAÇÃO LITERAL. PROPORCIONALIDADE.. AGRAVO IMPROVIDO. 1. Agravo de Instrumento interposto por MIDIAVOX LTDA em face de decisão proferida pela 2ª Vara Federal da Seção Judiciária de Pernambuco, nos autos do processo nº 0809792-65.2018.4.05.8300, que acolheu impugnação ao cumprimento de sentença apresentada pela FAZENDA NACIONAL, determinando o prosseguimento da execução com os valores elaborados pela União, no montante de R$ 38,58 (trinta e oito reais e cinquenta e oito centavos), atualizado em dezembro de 2019, bem como fixou honorários advocatícios em 10% (dez por cento) sobre o valor do excesso alegado pela agravada. 2. O título executivo judicial estabeleceu expressamente que os honorários advocatícios seriam calculados \"sobre o valor restante, após a consolidação do parcelamento descrito nos autos\", não cabendo interpretação diversa no cumprimento de sentença. 3. A consolidação do parcelamento administrativo realizada pela Receita Federal demonstrou valor remanescente de R$ 385,86, constituindo a base de cálculo adequada para os honorários advocatícios. 4. A fixação de honorários deve observar os princípios da razoabilidade e proporcionalidade, considerando o trabalho efetivamente realizado pelo advogado e as circunstâncias do caso concreto. 5. Agravo de instrumento improvido. (PROCESSO: 08101291520244050000, AGRAVO DE INSTRUMENTO, DESEMBARGADOR FEDERAL EDVALDO BATISTA DA SILVA JÚNIOR, 1ª TURMA, JULGAMENTO: 03/07/2025)",
      "consulta_processual_url": "https://www.trf5.jus.br/index.php/consulta-processual-fisico-e-eletronico",
      "texto_pdf_html": "data\\docs\\2025_08101291520244050000_03-07-2025.html"
    }
  ]
}